,Price,Location,URL,Date,Title,condition,make / manufacturer,model name / number,num image,text,bicycle frame material,bicycle type,frame size,suspension,wheel size,brake type,electric assist,handlebar type,part type,size / dimensions
38256,225.0,houston,https://houston.craigslist.org/bop/d/humble-mavic-aksirum-wheelset-for-road/7470306214.html,2022-04-18 20:27,Mavic Aksirum wheelset for road bikes, excellent, Mavic, Aksium race,9,Mavic Aksium race wheelset Excellent condition Shimano/Sram 9/10/11 speed compatible  Continental tires included  (Cassette not included),,,,,,,,,,
38257,60.0,houston,https://houston.craigslist.org/bik/d/houston-tag-along-bikes/7472994295.html,2022-04-18 19:48,Tag along bikes, good, Trek/Adams,,5,"I have 2 tag along style bikes for sale. My children have outgrown them, so time to clear them out. One is a Trek and the other is an Adams Trail a Bike. Both are in used, but good condition with lots of usable life left. The Trek is $60.00 and includes the clamp for a 27.2 seat post. The Adams is $40.00 because I don’t have the seat post shims for it.  I’ve seen them online from $15 to $20. I can meet in SW Houston in the afternoon or near downtown during the work day.", steel, kids, Small, none (rigid), 20 in,,,,,
38258,385.0,houston,https://houston.craigslist.org/bop/d/houston-skywalker-extra-large-extra/7464729896.html,2022-04-18 17:10,"Skywalker extra large, extra heavy duty bike rack for 6 bikes", like new,,,6,"Please text me only on Eight three two - eight six zero - two four five six.  if you are interested in the items posted,  all the items you see are still available, do not throw low ball offer, serious buyer only, no call please. Very heavy duty steel made,  very sturdy  Dimensions: 99"" L x 36"" D x 20"" H in great condition",,,,,,,,,,
38259,200.0,houston,https://houston.craigslist.org/bik/d/houston-specialized-bikes/7471897905.html,2022-04-18 13:15,SPECIALIZED BIKES,,,,5,"2 SPECIALIZED KIDS FOR SALE. 24"" WHEELS.  12"" FRAME SIZE.  ALUMINUM FRAME  7 SPEEDS  FRONT SUSPENSION.  IN GOOD CONDITION.  $200 EACH OR $380 FOR BOTH.  SERIOUS AND TOTAL INQUIRIES", aluminum, mountain, KIDS,, 24 in,,,,,
38260,300.0,houston,https://houston.craigslist.org/bik/d/houston-wanted-old-bikes-from-1980s-and/7467639344.html,2022-04-18 07:44,WANTED old bikes from 1980's and early 1990's,,,,0,"Looking for old Dyno, GT Performer, BMX, Redline, Mongoose, Hutch, Haro, Skyway, Kuwahara, etc. bikes / bicycles  Whole bikes or parts...", other/unknown, bmx, any,, 20 in,,,,,
38261,99.0,houston,https://houston.craigslist.org/mpo/d/houston-1100lb-motorcycle-atv-jack/7472621350.html,2022-04-18 04:27,1100LB Motorcycle ATV Jack scissor stand Hoist Bikes LIFT ANYTHING, new,,,3,"BRAND NEW IN BOX!!!  Lifts EVERYTHING and ANYTHING you want !!!   Product Features  LIFT UP TO almost 15 inches high!!!!!  Weight Capacity:  1,100 lbs. POUNDS  !!  For repairing , for use in the garage,  shop, outdoors  or at the track. Designed to fit most motorcycle models OR ATVS Wide deck center  Brand - Dragway Tools  Can be used to LIFT EVERYTHING AND ANYTHING ELSE also!!!!!   Introductions: This is our 1100LBS Motorcycle / ATV Jack, which is made from ULTRA strength Metal when loaded, the adjustable locking screws and  wheels improve stability and safety. But it will also roll easily on four durable casters, making it easy to position,  easy to adjust and easy to store.  It can be used alone or with almost any motorcycle lift It has an 1100 Lb. capacity, made of solid steel and it's easy to use, and so strong.  It'll easily handle small vehicles like dirt bikes and  ATVs.  Features: 1. New and in a good condition. 2. Adopting premium Metal for good hardness and durability. 3. With 1100lbs capacity. 4. Help you easily repair dirt bikes or ATVs. 5. Easy to operate. 6. 12 cm removable crank handle.   Specifications: Color:  Red Capacity:  1100 Lbs Minimum Height:  3.35"" / 8.5cm Maximum Height:  13.38"" / 33.99cm Dimensions:  (16.73 x 10.04 x 4.72)"" / (42.5 x 25.5 x 12)cm (L x W x H)    TAGS -  bikes ,,  lifting , motorcycles ,  scooter , moped , asdd ,,  high , raise , ATV , motocross , motor ,, repair , tools , dirt bike ,  lift  ,",,,,,,,,,,
38262,1.0,houston,https://houston.craigslist.org/bik/d/brenham-vintage-bikes/7472507870.html,2022-04-17 16:34,Vintage bikes,,,,6,"1940’s Western Flyer 500.00 and Rollfast bikes 350.00 also 96 GT , barely used 100.00 . Stored inside", steel, cruiser, Unknown,, 27 in,,,,,
38263,1600.0,houston,https://houston.craigslist.org/spo/d/friendswood-rogue-echo-bike-sole-bike/7472455832.html,2022-04-17 13:56,Rogue Echo Bike & Sole Bike for Sale, like new,,,11,"I have 2 bikes for sale.  I purchased both bikes at the end of Covid and I can't ride them due to knee injuries.  They are both like new. The Rogue bike has less than 10 minutes of use (most likely less).  Absolutely perfect condition.  I am willing to sell this bike for $700.00 (retail before tax and shipping is 845.00). Like I said, this bike is virtually new.  The Sole Stationary (LCB Studio) bike has approx. 25-30 hours of use.  Great bike but again, my knees can't take it.  Perfect Condition. Spent a lot of time looking for a great light commercial bike and it is well worth it. I am willing to sell this bike for $900 (retail before tax and shipping is $1,299.99).  https://www.roguefitness.com/rogue-echo-bike https://www.soletreadmills.com/Bikes/LCB-SOLE-Upright-Bike",,,,,,,,,,
38264,10.0,houston,https://houston.craigslist.org/bop/d/houston-brake-discs-for-front-and-rear/7472093621.html,2022-04-16 12:52,* Brake Discs for Front and Rear Mountain Bikes *,,,,0,,,,,,,,,,,
38265,4500.0,houston,https://houston.craigslist.org/snw/d/tomball-yamaha-yz-250-will-consider/7460101594.html,2022-04-16 10:44,Yamaha YZ 250 (will consider trades for other bikes),,,,8,"This bike is in excellent condition with no problems and under 47 hours of riding! The only reason I did not put ""like new"" is due to some scratches and dirt from trail riding. I have owned it for almost 3 years with no major problems. Like many Yamahas, it warms up a little slow but runs great and responds well. I have put handguards, a skid plate and a different FMF pipe on the bike since owning it (but I also have the original). I am only selling it because I prefer a different bike for trail riding and my wife and I are looking for land right now and could use the extra money.  I will entertain offers. I am offering to serious buyers only and I only accept cash but will consider trades for a 4-stroke and a smaller cash offer. This is NOT a beginner bike. If you are interested, you can call or text me. I WILL get back with you if I do not answer.",,,,,,,,,,
38266,150.0,houston,https://houston.craigslist.org/bik/d/houston-schwinn-mountain-bikes/7460595684.html,2022-04-16 07:40,Schwinn Mountain Bikes,,,,0,,,,,,,,,,,
38267,1.0,houston,https://houston.craigslist.org/sgd/d/conroe-atvs-utvs-dirt-bikes-go-karts/7471768861.html,2022-04-15 15:39,"ATVs, UTVs, Dirt Bikes, Go-Karts, Motorcycles, Scooters and more!",,,,0,"Prices start at just $999! We are also offering FREE delivery up to a 15 mile radius. (Inquire about further distances.)  INVENTORY LISTED HERE: austinpowersports.com/inventory  GET PRE-APPROVED HERE: austinpowersports.com/financing  We have lots of inventory to choose from! We also have financing options that are easy to qualify for right on our website!  All units include our dealer warranty (with extended warranty options) and a blue Texas Title! We have many units that are in the assembly process and will come available during the week. We do not charge any assembly or destination fees!  ATVs, UTVs, Dirt Bikes, Go-Karts, Motorcycles, Scooters and more!  Address: 817 N. Frazier St. Conroe, Texas 77301  Phone: 936-247-4500 CHOOSE OPTION 0  Hours: Tuesday-Saturday 10am-6pm (We are closed Sunday and Monday)  Website: austinpowersports.com Facebook: fb.com/austinpowersportsconroe Click on inventory to view our prices! Call or stop by today!  TAGS/KEYWORDS: ATV UTV DIRT BIKE DIRTBIKE TAO APOLLO TAOTAO DONGFANG SHANDONG FANGPOWER ELECTRIC GOKART GO-KART GO KART GOLF CART MOTORCYCLE SCOOTER MOPED FOUR WHEELER FOUR-WHEELER Z20 Z40 X18 DB-25 110cc 125cc 200cc 250cc 300cc OFF ROAD OFF-ROAD STREET LEGAL STREET-LEGAL UTILITY SPORT KAWASAKI HARLEY QUAD ENDURO 4 WHEEL PARTS SERVICE MECHANIC MOTO CYCLE MOTOR",,,,,,,,,,
38268,1800.0,houston,https://houston.craigslist.org/bik/d/houston-juiced-bikes-scorpion/7471469878.html,2022-04-14 22:05,Juiced Bikes Scorpion,,,,17,"Selling my Scorpion as I don't use it much. Been in storage for a while collecting dust, has less than 300 miles(will verify). Comes with the original charger too.   Also has the bike horn to alert others and extremely bright headlight/taillights. I've fallen once on it and the left handle bar tip has Some scratches from gliding on cement(Check Pictures). Overall works well and was super fun to use I just don't use it anymore and want to get rid of it.   Speed is 18-22mph, you can do 28mph if you add the off- road mod from their website.   Range is up to 75miles and parts for this are easily found on the manufacturer website apart from very thorough manuals for disassembly or repair.   Paid $2500 for it. Priced to sell or Best Offer.", aluminum, other,,,,,,,,
38269,350.0,houston,https://houston.craigslist.org/bik/d/houston-2006-haro-bikes-dave-mirra-540/7470565384.html,2022-04-12 19:13,"2006 HARO Bikes Dave Mirra 540 BMX Flatland Freestyle Bike 20"" Bicycle", good,,,6,"I am offering up for sale this collectible 2006 HARO Bikes Dave Mirra 540 BMX Flatland Freestyle Bike 20"" Bicycle.  It is left hand drive as all real Mirra bikes are. Dave Mirra died back in 2016 and these bikes are becoming more and more rare as the years go by.  This bike is ALL ORIGINAL and still in nice shape with a few dings and scratches. Not to shabby for a 16 year old bike !   It consists of the following components:  HARO BIKES Dave Mirra 540 Chro-Moly Frame HARO BIKES Dave Mirra 540 Chro-Moly Threadless Forks HARO Threadless 4-Bolt Stem HARO  Chro-Moly SEVEN 7.5 2PC Handlebars Aheadset Threadless Headset HARO Grips with Bar Ends TEKTRO 990 Brake Levers (Front and Rear) TEKTRO 990 Brake Calipers (Front and Rear) Odyssey GYRO Brake Detangler System HARO BIKES Seat Clamp HARO BIKES Seatpost HARO BIKES Padded Saddle Seat HARO BIKES 3 PC Cranks with HARO Chainring HARO BIKES Aluminum Platform Pedals AlexRims DM18 Aluminum 36 Spoke 20"" Rims with 14mm Haro Hubs HARO Multi Surface Flatland/Freestyle/Street Tires Pegs on rear   The top tube length from center of steering tube to center of seatpost insert tube is 20.5 inches.   This bike is in good condition and rides great.  $350 CASH gets you this great bike !   Thanks for looking.", steel, bmx, 20.5 TT, none (rigid), 20 in, u-brakes, none, riser,,
38270,20.0,houston,https://houston.craigslist.org/bik/d/katy-bikes/7470130849.html,2022-04-11 19:49,2 bikes,, Schwinn, Ranger,0,2 Bikes. Works but tires need pumping., other/unknown, cruiser, Medium,, 24 in,,,,,
38271,10.0,houston,https://houston.craigslist.org/bik/d/katy-bikes/7469964714.html,2022-04-11 13:44,Bikes,,,,0,"I have three kid's bikes. Two of them need either a new innertube or tire, but otherwise work fine. $10 each or $25 for all three. My kids have outgrown and I no longer need them. Call or text Joe.", steel, bmx, 12,, 12 in,,,,,
38272,100.0,houston,https://houston.craigslist.org/spo/d/houston-two-excercise-bikes/7468733848.html,2022-04-08 14:28,Two Excercise bikes, good, Doufit, EB-01,2,Take both for $100.  Email me for more info or pick up.  Doufit EB-01 Exercise Bike with Seat  Fit Quest 699-794 (Purple/Black color),,,,,,,,,,
38273,30.0,houston,https://houston.craigslist.org/spo/d/houston-floor-stand-for-bikes/7468631822.html,2022-04-08 11:29,Floor Stand for 2 bikes, like new,,,4,Floor rack for 2 bikes. $30 *bicycles not included *,,,,,,,,,,
38274,2295.0,houston,https://houston.craigslist.org/sgd/d/electric-the-mid-drive-ebike-that/7468116651.html,2022-04-07 09:15,ELECTRIC! The Mid-drive eBike that Shreds! CyberBike eMountain Bikes!, new, Cyberbike,,15,"Introducing the New 2022 Cyberbike Electric Mountain Bikes   Riders agree: Nothing comes close to Cyberbike's combination of performance, value, style, and quality.  See the Cyberbike Mullet Pro in action HERE! (and here, by popular demand, is last year's intro featuring Division 1 Collegiate Mountain Racer Corey Jackson on the first edition Cyberbike) Order online for fast delivery at www.Cyberbike.com All 2022 Cyberbikes are in stock and ready to shred, Order yours before they're sold out!  More mid-drive power than ever Awesome new color graphic display Easier to ride, lower standover frame, the lowest of any mid-drive eMTB New, structurally superior, mountain ready rear suspension linkage The best brakes in the business, even Quad-piston brakes on some models! Massive brake rotors up to 220mm 34mm gold tube forks on some models up to 140mm travel Wider range of models  A proper e-Mountain bike needs to be mid-drive and have full suspension, it's as simple as that. Until now, if you wanted an electric mountain bike to tackle rugged trails, your choices have been heavy, low-quality, fat tire, hub-motor beach bikes, or legacy brands charging $4000 or more for low-power eBikes without full suspension.   Whether your knees are tired or you just want to shred, there is simply no better choice for performance and value than Cyberbike. An American company with great customer support: Cyberbike, USA. The mountains are calling. Will you answer?  Cyberbike eBikes come all with the quietest and most powerful motor in its class, with a long range (65 miles and more) battery, and powerful e-spec hydraulic disk brakes that will be there when you need them. A lightweight package with 500 watts of power, top-of-the-line battery range, and quality components, all for the price of an inexpensive yet stellar bike! You'll get so much more than other eBikes with the CyberBike, it's the real e-MTB experience for the adventurous rider. Performance, specs, and quality components throughout, and the best warranty in the industry, from an American company with experienced American mechanics on call for all your tech support needs.  54 volt/500 watt climbing power with 13Amp hour Li-Ion battery and only 52 lbs means you'll get power and tons of battery range. Now with available throttle! Now from only $2495 Note: Owning and riding comes with risks. Wear proper protection, properly maintain and check your bike, and ride within your limits. By purchasing our products you agree to take full responsibility for the ownership of your bike, including the above and all other reasonable precautions for yourself or anyone you allow to ride your bike.",,,,,,,,,,
38275,15.0,houston,https://houston.craigslist.org/tag/d/sugar-land-bikes-scooter-and-helmets/7467597146.html,2022-04-06 01:02,"bikes , Scooter and Helmets",,,,5,Bike $15 Scooter $15 Helmet 5 Each,,,,,,,,,,
38276,150.0,houston,https://houston.craigslist.org/bik/d/richmond-schwinn-sidewinder-mountain/7467369529.html,2022-04-05 13:23,Schwinn Sidewinder Mountain bikes,,,,2,"For sale are two Schwinn Sidewinder Entry-level mountain bikes, Excellent and Like new condition. $150 each  Details here:  https://www.walmart.com/ip/Schwinn-Sidewinder-Mountain-Bike-26-inch-wheels-black-green/857861835  (Only one is pictured.  The other is the same model.)", steel, mountain, Adult,, 26 in,,,,,
38277,200.0,houston,https://houston.craigslist.org/spo/d/barker-schwinn-road-bikes/7466273410.html,2022-04-02 18:43,2 Schwinn Road Bikes, good, Schwinn," brochures ""receipts"" included",5,"50$ each. Vintage well kept and ridable already, older models with all paperwork. New rubber on each.",,,,,,,,,,
38278,2500.0,houston,https://houston.craigslist.org/mcy/d/friendswood-race-bikes-and-parts-for/7465247383.html,2022-03-31 11:37,Race Bikes and Parts FOR SALE,,,,4,"TWO BIKES - Together or Separate, BOGO  2007 Yamaha R6 race bike $2000.00  •	Full safety wired, PCIII, GPR dampener, down 1 up 2, 520 chain, slipper clutch mod, braided front brake lines, GP shift, aftermarket bars, spare wheels, and a box of spares. Currently not running. Dropped a cylinder @ MSRH June 2011. No metal banging like internal damage, just not firing on 1 cylinder. Could be the PCIII, spark plug or coil. Did not repair, just moved into garage. Got busy with work and let sit.   1987 Honda VFR 700 $500.00  •	Used as a ""track day"" bike until I upgraded. Currently not running.  Was in the process of getting it ready to put back on the street full time. Same thing…got busy with work and just put it in the garage and let sit.   •	These bikes are “race bikes”. They are not street legal. They could be “parted out” for more money or would make good project bikes if interested.  •	Clear titles in hand for both bikes  *** CASH ONLY ***",,,,,,,,,,
38279,949.0,houston,https://houston.craigslist.org/snd/d/arlington-new-atvs-dirt-bikes-go-karts/7463180003.html,2022-03-26 10:37,New ATVs | Dirt Bikes |Go-Karts Golf Carts Scooters & More Sale !!!!!!,,,,18,"FREE SHIPPING! Only at 360Powersports.com  CALL NOW 469-217-7070  SHOP OUR IN-STOCK ITEMS TODAY!   https://www.360powersports.com/in-stock/  360 Powersports is your one-stop-shop Atvs, dirt bikes, go-karts, scooters, utvs, side by side.  TAKING CARE OF BUSINESS ONE CUSTOMER AT A TIME!     Use this code at check out to save $25 Buy1Save25     HUGE SALE ON ALL PRODUCTS!!  Free shipping right to you!   Fast & Financing With Flexible Monthly Payments!     WE ALSO OFFER FULLY ASSEMBLED AND TESTED SERVICE AT A ADDITIONAL COST. WE HIGHLY RECOMMEND YOU GET IT FULLY ASSEMBLED AND TESTED SO WHEN YOU RECEIVE YOUR UNIT YOU JUST GAS & GO.      ATVS 110cc Beginner ATVs - $949 125cc Kids Mid-Size ATVs - $1299 Adult ATVs - starting at $1999  Dirt Bikes Kids Dirt Bikes starting at $399.95  Mid size Dirt Bikes starting at $929 Full-Size Dirt Bikes - starting at $1309  Go-Karts & UTVs Kids Go-Kart - starting at $1379 Adult GoKarts & UTVs starting at $2649  Golf carts (Gas)  Gas Powered Golf Carts starting at $6250     Golf carts (Electric)   Electric golf Carts starting at $7950  360 Powersports is one of the nation’s largest power sports dealers across the USA. We are the HIGHEST RATED online dealer on Google and many other rating platforms! We are NOT the lowest dirt cheap price on the internet and nor do we strive to be. When purchasing a vehicle with us you will get value and customer service including our 360 Care, Tech Support, assigned Rep, fast delivery, and more! We carry all parts and all products come with industry-leading warranties! Most of our products come with speed governors, remote kill switches, factory-tested & heat-cycled engines, and much more!   **Fast 5-10 Day Shipping Right To You Free shipping!      Shop Now At www.360Powersports.com To Receive The Best Customer Service At The Lowest Prices  OR Call Us At 469-217-7070 To Place Your Order!     Keywords: MOTORCYCLE, MOTORCYCLES, HONDA, YAMAHA, KAWASAKI, DIRT BIKE, DIRT BIKES, ATV, ATVS, GO-KART, GO-KARTS, POLARIS. atv, atvs, kids atv, 4 wheeler, 4-wheeler, 4-wheelers, quad, kid quad, mini quad, quads, go-kart, go-karts, gokart, gokarts, go kart, go karts, gocart, go cart, dune buggy, dune buggie, dune buggies, sand rail, dirt bike, pit bike, moped, scooter, enduro, motorcycle, mini bike, monkey bike, doodle bug, dirtbike, pitbike, coolster, roketa, honda clone, gy6, taotao, bashan, kandi, kinroad, dongfang, chinese, china, parts, repairs, clearance, budget, wholesale, sale, 49cc, 50cc, 70cc, 80cc, 90cc, 110cc, 125cc, 150cc, 170cc, 180cc, 200cc, 250cc go-kart, batman, jaguar, recon, hunter, rancher, shark, rapidity, viper, t-rex, cazador utv, utvs, polaris copy, crazor, avenger, sxs, ninja bike, Kawasaki, Polaris SCOOTER, SCOOTERS, MOTORCYCLE, MOTORCYCLES, HONDA, YAMAHA, KAWASAKI, DIRT BIKE, DIRT BIKES, ATV, ATVS, GO-KART, GO-KARTS, POLARIS. atv, atvs, kids atv, 4 wheeler, 4-wheeler, 4-wheelers, quad, kid quad, mini quad, quads, go-kart, go-karts, gokart, gokarts, go kart, go karts, gocart, go cart, dune buggy, dune buggie, dune buggies, sand rail, dirt bike, pit bike, moped, scooter, enduro, motorcycle, mini bike, monkey bike, doodle bug, dirtbike, pitbike, coolster, roketa, honda clone, gy6, taotao, bashan, kandi, kinroad, dongfang, chinese, china, parts, repairs, clearance, budget, wholesale, sale, 49cc, 50cc, 70cc, 80cc, 90cc, 110cc, 125cc, 150cc, 170cc, 180cc, 200cc, 250cc go-kart, batman, jaguar, recon, hunter, rancher, shark, rapidity, viper, t-rex, cazador utv, utvs, polaris copy, crazor, avenger, sxs, ninja bike, Kawasaki, Polaris, cazador, electric golf carts , enforcer golf carts",,,,,,,,,,
38280,299.0,houston,https://houston.craigslist.org/bik/d/folding-bikes-folding-bicycles-bike/7462733334.html,2022-03-25 10:06,FOLDING BIKES FOLDING BICYCLES BIKE BICYCLE FOLDING,,,,4,"20"" Alloy FOLDING BIKES - $299 cash price  THESE ARE  OPEN BOX BIKES   ABOUT 5 LEFT RIGHT NOW.   NEW IN BOX ALSO AVAILABLE - ONLY: $399   20"" - 7-SPEEDS Shimano Shifters - ALLOY LIGHTWEIGHT MODEL   CALL TO SET UP TIME TO PICK SOME UP AT WAREHOUSE IN sw houston.   BETWEEN 9-2 MONDAY-SATURDAY.  NEW ONES AVAILABLE - ONLY $499  THANKS  GREENZONEBIKES.COM  ALAN show contact info   BIKE, BIKES, BICYCLE, BICYCLES, FOLDING BIKES, FOLDING BIKE, FOLDING BICYCLES, FOLDING BICYCLE, electric bikes, electric bike kits", alloy, folding," 20""",, 20 in,,,,,
38281,1299.0,houston,https://houston.craigslist.org/snd/d/adkins-march-madness-sales-dirt-bikes/7462534011.html,2022-03-24 17:43,"March Madness SALES!!!  Dirt Bikes, Trikes, ATVs & UTVs!!!",,,,24,"March Madness SALES!!!  We’ve got alllllll kinds of great stuff going on at How We Roll and we just want to share some of it with you guys!!! We’ve just put a ton of stuff on sale!!! Anything from dirt bikes and ATVs to motor trikes and UTVs!!! That’s right!!! A little something for EVERYONE!!!  1.) X9 125cc Dirt Bikes were $1499, NOW ONLY $1299!!! 2.) 125cc Tao Tao ATVs were $1999, NOW ONLY $1599!!! 3.) Massimo 200cc Spider Trike was $4999, NOW ONLY $4599!!! 4.) Massimo TBoss 410 was $8999, NOW ONLY $8499!!!!  Everything is brand new and comes with a warranty!! And, AS ALWAYS, How We Roll Motorsports services EVERYTHING that we sell so there’s no need to worry in the future!!! We’ve got your back!!!  Financing options ARE available!!! Prices do not include taxes. Vehicle discounts cannot be combined. Vehicles cannot be held on layaway.  Vehicles can be found at any of our three locations but it’s always best to call and make sure!!!  ADKINS: 11310 Highway 87 East, Adkins TX 78101. 210.649.1537 - Ask For Courtney!! HELOTES: 18593 Bandera Road, Helotes TX 78023. 210.957.0110 - Ask For Mandy!!! SAN ANTONIO: 30 Essex Street, San Antonio TX 78210. 210.988.2157 - Ask For Jimmy or Nick!!!  Come take advantage of these AWESOME SALES while they last!!!   #HowWeRollMotorsports #Adkins #Helotes #SanAntonio #CustomerServicePriority #MarchMadness #MarchMadnessSales #Massimo #MassimoDirtBikes #MassimoGoCarts #MassimoGKM200 #GKM200 #MassimoGKA200 #GKA200 #MassimoUTVs #MassimoTBoss410 #TaoTao #TaoTao125 #Warranty #ServiceCenter",,,,,,,,,,
38282,40.0,houston,https://houston.craigslist.org/bik/d/richmond-used-kids-bikes/7462419838.html,2022-03-24 13:35,Used kids bikes,,,,2,"$40 per bike, both bikes $80 2 kids bikes, one for ages 6 to 10 broken chain other for ages 10 to 13 with a broken seat", other/unknown, kids, Small,, other/unknown,,,,,
38283,799.0,houston,https://houston.craigslist.org/snd/d/humble-spring-sale-on-4wheelers-go/7461974843.html,2022-03-23 12:50,Spring Sale on 4Wheelers Go Karts and Dirt Bikes,,,,17,"🌻SPRING SALE!🌼 BOR has fully stocked showroom with units starting at $799 BUMPER TO BUMPER + 6MO WARRANTY available on all units!  We are Houston leading dealer for affordable 4 Wheelers, Go Carts and Dirt Bikes. 16 years in business and over a million sales and repairs under our belts. Come check out us out and find out why! BOR has something for everyone! Kids and adult models in stock.  WE ALSO PRICE MATCH local competitors! Ask sales associate for details! (832)766-5651 Tues-Friday 10am-5pm Saturday 10am-4pm     Atv, go kart, 4 wheeler, go cart, GoKart, gocart, four wheeler, dirt bikes, ATV, atv's, kids 4 wheeler, fourwheeler, atv, go kart, atvs, go-kart, power wheels",,,,,,,,,,
38284,35.0,houston,https://houston.craigslist.org/bik/d/bellaire-two-16-kids-bicycles-bikes/7461105688.html,2022-03-21 13:01,Two (2) 16” kids bicycles bikes Royalbaby,, Royalbaby,,3,"Two 16” Royalbaby kids bikes in great condition, includes training wheels and baskets.    The bikes are Blue and Pink. $35 each or $65 for both.   Retails for $125 each from Amazon:   RoyalBaby Girls Kids Bike Stargirl 16 Inch Bicycle 3-9 Years Old Basket Training Wheels Kickstand Pink Blue Child's Cycle   https://www.amazon.com/dp/B00H5FJKIG/ref=cm_sw_r_cp_api_glt_fabc_GFWJVN4YDABWMYGKA469?psc=1", steel, kids, Kids 16”,, 16 in,,,,,
38285,880.0,houston,https://houston.craigslist.org/bik/d/lake-jackson-vintage-flying-otasco/7472971898.html,2022-04-18 18:43,Vintage Flying-O Otasco Scorpion,,,,7,The bike definitely needs new tires and tubes. This bike has endured many years of storage. It is time for a new home and a new makeover. These bikes run upwards of $1k to $4k when fixed up.  Must meet in Lake Jackson., steel, kids, Kids bike,, other/unknown,,,,,
38286,220.0,houston,https://houston.craigslist.org/bik/d/houston-bianchi-bike/7472883243.html,2022-04-18 15:22,Bianchi Bike,, Bianchi,,6,Bianchi 21 speed bike. Equipped with Shimano brakes and derailleurs. Recently serviced. Bikes shift and brake well. New 700c tires and presta tubes. Bike will work for someone 5’ 5”to 5’ 11”.  Ready to ride and enjoy.   Price is $220 cash, alloy, hybrid/comfort, Medium,, 700C, caliper,,,,
