,Price,Location,URL,Date,Title,condition,make / manufacturer,model name / number,num image,text,bicycle frame material,bicycle type,frame size,wheel size,part type,serial number,suspension,brake type,handlebar type,electric assist,size / dimensions
5592,150.0,cosprings,https://cosprings.craigslist.org/spo/d/colorado-springs-bike-rack-xport-bikes/7472378456.html,2022-04-17 09:17,Bike Rack (Xport) - 4 Bikes, good, Xport, Xport,2,"Xport hitch mount (2"") bike carrier up to 4 bikes.  Text  show contact info .",,,,,,,,,,,
5593,1400.0,cosprings,https://cosprings.craigslist.org/bik/d/colorado-springs-blb-london-lapovaria/7463552552.html,2022-04-13 14:45,BLB London LaPovaria Air 50cm rare track bike,, Brick Lane Bikes, LaPiovra Air,4,"No trades. Read full ad. No trades   Rare BLB LaPiovra Air 50cm frame with carbon fork (aluminum steer tube), Conquer Elite Wheelset, Full carbon bullhorns (Profile design Cobra), SRAM Omnium Chainring, SL-K stem, Thompson seatpost, MKS Sylvan pedals with double leather toe cages.   Minor cosmetic blemishes here and there since it’s a bike that got ridden but no functional issues.   No trades. This is a one of a kind track bike build.   $1400 OBO no trades. Low ballers can keep looking. I’ll 100% ignore BS offers.   Don’t setup a test ride unless you have cash in hand. No exceptions.", aluminum, track, 50cm, 700C,,,,,,,
5594,60.0,cosprings,https://cosprings.craigslist.org/bik/d/colorado-springs-kid-bikes/7470082022.html,2022-04-11 16:38,3 kid bikes, good,,,3,3 kid bikes. $20 each All will need tires and some TLC. Vintage for sure, steel, kids, Medium, 12 in,,,,,,,
5595,800.0,cosprings,https://cosprings.craigslist.org/bik/d/weston-trek-bikes/7469983028.html,2022-04-11 13:16,Trek bikes, excellent,,,6,Trek bikes for sale $800. obo Excellent condition very well taken care of have not been ridden very much tires brand new the mail see is 18 inches, aluminum, road, 13 in, other/unknown,,,,,,,
5596,20.0,cosprings,https://cosprings.craigslist.org/bop/d/colorado-springs-wooden-bike-rack-fits/7458336535.html,2022-04-11 11:39,Wooden Bike Rack - Fits 6 Bikes - Great for Garage, excellent,,,3,"I made this with 2x4s. The bike's rear wheel wedges in to be held up. Holds up to six bikes. Screws throughout.   The pictures show it after I moved it from the wall but it was held against a wall with a couple screws.   Cash or Zelle.  BTW, the two bikes in the picture are for sale, too.  https://cosprings.craigslist.org/bik/d/colorado-springs-gt-traffic-20-commuter/ show contact info .html https://cosprings.craigslist.org/bik/d/colorado-springs-58-cm-specialized/ show contact info .html",,,,," racks, fenders, bags",,,,,,
5597,200.0,cosprings,https://cosprings.craigslist.org/bik/d/colorado-springs-bianchi-bikes/7469679648.html,2022-04-10 19:12,Bianchi Bikes, excellent, Bianchi, Boardwalk & Advantage,4,Two Bianchi bikes--one Advantage and one Boardwalk, steel, hybrid/comfort, unknown, 25 in,,,,,,,
5598,100.0,cosprings,https://cosprings.craigslist.org/for/d/yoder-bikes-deskfiling-cabinetgarden/7468135727.html,2022-04-07 08:59,"Bikes, desk,filing cabinet,garden cultivator", good,,,8,"A antique garden cultivator tool, bikes, metal office desk, metal filing cabinet, electric heaters. All items for one cash price of $100.00",,,,,,,,,,,
5599,2295.0,cosprings,https://cosprings.craigslist.org/sgd/d/electric-the-mid-drive-ebike-that/7468099326.html,2022-04-07 07:36,ELECTRIC! The Mid-drive eBike that Shreds! CyberBike eMountain Bikes!, new, Cyberbike,,15,"Introducing the New 2022 Cyberbike Electric Mountain Bikes   Riders agree: Nothing comes close to Cyberbike's combination of performance, value, style, and quality.  See the Cyberbike Mullet Pro in action HERE! (and here, by popular demand, is last year's intro featuring Division 1 Collegiate Mountain Racer Corey Jackson on the first edition Cyberbike) Order online for fast delivery at www.Cyberbike.com All 2022 Cyberbikes are in stock and ready to shred, Order yours before they're sold out!  More mid-drive power than ever Awesome new color graphic display Easier to ride, lower standover frame, the lowest of any mid-drive eMTB New, structurally superior, mountain ready rear suspension linkage The best brakes in the business, even Quad-piston brakes on some models! Massive brake rotors up to 220mm 34mm gold tube forks on some models up to 140mm travel Wider range of models  A proper e-Mountain bike needs to be mid-drive and have full suspension, it's as simple as that. Until now, if you wanted an electric mountain bike to tackle rugged trails, your choices have been heavy, low-quality, fat tire, hub-motor beach bikes, or legacy brands charging $4000 or more for low-power eBikes without full suspension.   Whether your knees are tired or you just want to shred, there is simply no better choice for performance and value than Cyberbike. An American company with great customer support: Cyberbike, USA. The mountains are calling. Will you answer?  Cyberbike eBikes come all with the quietest and most powerful motor in its class, with a long range (65 miles and more) battery, and powerful e-spec hydraulic disk brakes that will be there when you need them. A lightweight package with 500 watts of power, top-of-the-line battery range, and quality components, all for the price of an inexpensive yet stellar bike! You'll get so much more than other eBikes with the CyberBike, it's the real e-MTB experience for the adventurous rider. Performance, specs, and quality components throughout, and the best warranty in the industry, from an American company with experienced American mechanics on call for all your tech support needs.  54 volt/500 watt climbing power with 13Amp hour Li-Ion battery and only 52 lbs means you'll get power and tons of battery range. Now with available throttle! Now from only $2495 Note: Owning and riding comes with risks. Wear proper protection, properly maintain and check your bike, and ride within your limits. By purchasing our products you agree to take full responsibility for the ownership of your bike, including the above and all other reasonable precautions for yourself or anyone you allow to ride your bike.",,,,,,,,,,,
5600,100.0,cosprings,https://cosprings.craigslist.org/bik/d/colorado-springs-bikes-mens-womens/7466576752.html,2022-04-03 14:59,2 Bikes 1 men's 1 womens, good," Geness, Tuesday", ?,5,"Womens day cruser a Tuesday Bike 24""  Men's Geness 26""  V 2100 mountain bike ridden only 2 times", other/unknown, mountain," 24- 26""", 24 in,, ?, frame and fork (full suspension),,,,
5601,50.0,cosprings,https://cosprings.craigslist.org/spo/d/monument-gravity-stand-for-two-bikes/7461462649.html,2022-04-02 19:23,Gravity Stand for Two Bikes,,,,3,"Nice condition gravity stand for two bikes. Lightly used. If you can see the ad, it is still available.  Please remember a contact number with your reply.  Thanks for looking!",,,,,,,,,,,
5602,2995.0,cosprings,https://cosprings.craigslist.org/mcd/d/colorado-springs-2017-oset-20-inch-race/7465369517.html,2022-03-31 14:40,2017 OSET 20 INCH RACE Bikes,,,,9,"Apex Sports address:    327 South Weber Street Colorado Springs CO, 80903phone:      ☎ (719) 297-4373 ext 16text:       Text 16 to (719) 297-4373 for more details  link:       https://apexsportsinc.com/dx1inventory/69a97468-819d-4283-af78-ae680170fd20  contact:    Apex Sports  2017 OSET 20 INCH RACE BIKES InfoType: Play BikesStock #: 00000DetailsCondition: UsedDrivetrainOdometer: 0 MILESDescription ELECTRIC TRIALS BIKE 20 INCH Apex Sports address:    327 South Weber Street Colorado Springs CO, 80903phone:      ☎ (719) 297-4373 ext 16text:       Text 16 to (719) 297-4373 for more details  link:       https://apexsportsinc.com/dx1inventory/69a97468-819d-4283-af78-ae680170fd20  contact:    Apex Sports",,,,,,,,,,,
5603,999.0,cosprings,https://cosprings.craigslist.org/wan/d/colorado-springs-motorcycles-and-dirt/7454565641.html,2022-03-30 12:39,Motorcycles and dirt bikes barn cleaning,,,,0,"Do you have any old motorcycles laying around collecting rust or taking up your space! Or old parts laying around? I can help you remove them from your property! I can help clean out your old barn or shed, looking for dirt bikes street bikes kids bikes scooters ect ect... Will pay cash or help you with something else you need!",,,,,,,,,,,
5604,69.0,cosprings,https://cosprings.craigslist.org/spo/d/colorado-springs-thule-tailgate-pad/7461751232.html,2022-04-18 18:48,Thule tailgate pad, good,,,0,"Thule tailgate pad for your mountain bikes.  a little dusty, but all straps and such in good shape. reduced 4/1/22",,,,,,,,,,,
5605,1199.0,cosprings,https://cosprings.craigslist.org/bik/d/monument-sant-cruz-tallboy-lt/7472976924.html,2022-04-18 17:58,Sant Cruz Tallboy LT,,,,0,,,,,,,,,,,,
5606,40.0,cosprings,https://cosprings.craigslist.org/bop/d/usaf-academy-yakima-bike-trunk-mount/7469300691.html,2022-04-18 16:59,Yakima 2 bike trunk mount rack,,,,0,,,,,,,,,,,,
5607,20000.0,cosprings,https://cosprings.craigslist.org/rvs/d/colorado-springs-2016-palomino-palomini/7472935453.html,2022-04-18 16:08,2016 Palomino PaloMini 177 ORV BH (Toy Hauler),,,,17,"This has been a great camper for our family for the last few years. It has served us well but we no longer need the Toy Hauler portion of the camper because I have sold all the toys and would like to gain more space. This thing is amazing. Off Road package, massive front platform for all the toys and extremely light so it can be towed with most any truck or large SUV. Dry weight is about 3800lbs, Has a bunk house, queen bed, full table, kitchen, bathroom with shower and tub that I can fit in(6'2""). Lots of storage, has awning with led lights, outdoor speakers and a lot more that I am missing. The person I purchased this from had custom ramps made to fit a SxS on it. Also added a hitch receiver to the rear as well so you can add more fun to it if you want. You can fit 2 ATVs on it, a SxS, and I've had 3 bikes on it as well. I'll attach photos of it all loaded up. We have taken good care of it and it has no issues. Everything is working great. It's a very unique setup and the space is utilized very well. Respond to this listing if you have any questions. Thanks for looking   Link to Specs and Layout  https://www.rvusa.com/rv-guide/2016-palomino-palomini-toy-hauler-floorplan-177-orv-bh-tr27248",,,,,,,,,,,
5608,75.0,cosprings,https://cosprings.craigslist.org/bop/d/colorado-springs-new-in-box-bell/7472136033.html,2022-04-18 13:45,NEW IN BOX Bell LOCKING DoubleBack Two-Bike Trunk Rack,,,,6,"NEW IN BOX Bell LOCKING DoubleBack Two-Bike Trunk Rack CAR Cradle Biking Travel  A Quick and easy carrier solution for any car - No-tools installation Holds 1 or 2 bikes of all frame types with cradles Reflective Red end caps increase visibility Easy, one-step folding with hub Stable fit to most car styles Maximum 35 lbs. per bike (70 lbs. total) Holds one or two bikes of all frame types with cradles Reflective red end caps increase visibility Easiest, one step folding with new hub Stable fit to all car styles No tool assembly Locking Cable Included  Retailed New for $79.99 + $14.99 S & H Online Ebay I am only asking $75 New still in the box never opened   Please call  show contact info   Go To : ebay.com/itm/293767752804",,,,,,,,,,,
5609,55.0,cosprings,https://cosprings.craigslist.org/bik/d/colorado-springs-vertical-bike-rack/7472834790.html,2022-04-18 12:51,Vertical Bike Rack Holds 4,,,,2,"$55 cash only Exactly as pictured. Freestanding on rolling, locking wheel casters 69"" tall x 43"" wide  Hang 4 (or maybe more) bikes vertically by the tire, in shed or garage. Takes up much less room to store", other/unknown, other, 69 x 43, other/unknown,,, other/unknown, other/unknown, other/unknown,,
5610,130.0,cosprings,https://cosprings.craigslist.org/bik/d/monument-girls-liv-24-mountain-bike/7469676324.html,2022-04-18 12:43,"Girls Liv 24"" Mountain Bike",,,,5,Great little bike. Still a little big for my daughter. We are going to stick with her smaller bike for now but don't want to hold 2 bikes for her. Asking $100. Call or text me at  show contact info, aluminum, mountain, small, 24 in,,, suspension fork (hardtail),,,,
5611,70.0,cosprings,https://cosprings.craigslist.org/spo/d/castle-rock-inter-rim-bike-trainer/7472745353.html,2022-04-18 10:13,Inter Rim Bike Trainer,,,,0,,,,,,,,,,,,
5612,300.0,cosprings,https://cosprings.craigslist.org/bik/d/colorado-springs-custom-21-bmx-300-obo/7472737537.html,2022-04-18 10:01,Custom 21” bmx $300 obo,,,,0,,,,,,,,,,,,
5613,2500.0,cosprings,https://cosprings.craigslist.org/mcy/d/colorado-springs-2004-yamaha-wr450/7472723555.html,2022-04-18 09:31,2004 Yamaha WR450,,,,6,04 Yamaha WR450. Needs a little work but a low miles bike. We bought the bikes new from Grand Junction Dealership. If you want info let me know.,,,,,,,,,,,
5614,50.0,cosprings,https://cosprings.craigslist.org/bik/d/usaf-academy-two-20-kid-bikes/7460397606.html,2022-03-19 14:36,"Two 20"" Kid Bikes",,,,2,"Blue Performance Downforce 20"" youth bike, $75  Pink Schwinn Deelite 20"" youth bike, $50", aluminum, kids," Youth 20"" tires", 20 in,,,,,,,
5615,35.0,cosprings,https://cosprings.craigslist.org/bop/d/colorado-springs-cocoweb-deluxe-bike/7472616448.html,2022-04-18 01:45,Cocoweb deluxe bike adapter,,,,3,"CONVENIENT: The DELUXE BAR ADAPTER installs with the push of a button. The bar also includes a user friendly quick release to remove it from the bike easily WORKS LIKE A CHARM: The frame easily attaches to your bike's seat post and handlebar stem post. This provides a horizontal bar so that it can hang on a top tube bike rack or use it to create a higher bar for ratchet arms. Maximum load capacity of 35 Ibs. when used on a Hanging Rack VERSATILE: This bike frame adapter bar is ideal to help secure kids bikes or any bike with a sloped top tube. PROTECTS YOUR BIKES: With the vinyl coated hangers, you can have peace of mind knowing your bikes finish will not be damaged STURDY: With a telescopic adjustment from 19"" to 26"" you can be sure it will stay put.  Retails New For $48.53 Compares to this one : amazon.com/Swagman-64005-Deluxe-Bar-Adapter/dp/B000YZG8JS/ref=sr_1_8?dchild=1&gclid=Cj0KCQjwna2FBhDPARIsACAEc_UeWV76Al2L-7YWETdyyzfVKyUgAanNHOVKIM95LzMzOmKNZSwEqGgaAg6BEALw_wcB&hvadid=410063425892&hvdev=c&hvlocphy=1014471&hvnetw=g&hvqmt=b&hvrand=5635789199925327761&hvtargid=kwd-20083874231&hydadcr=9406_11542751&keywords=bike+rack+adapter+bar&qid=1621909795&sr=8-8  I am only Asking $35 Like New Reduced to : $30  Please call  show contact info",,,,,,,,,,,
5616,80.0,cosprings,https://cosprings.craigslist.org/bop/d/colorado-springs-yakima-hangout-trunk/7472616156.html,2022-04-18 01:40,YAKIMA HANGOUT TRUNK MOUNTED CARRIER RACK - 2 BIKE(Reduced),,,,4,YAKIMA HANGOUT TRUNK MOUNTED CARRIER RACK - 2 BIKE  Holds up to two bikes. Quick Trigger™ hub system makes install easy and fast Integrated Stable Cradles™ hold bikes firmly in place Padded feet and coated metal buckles protect your vehicle Arms fold for compact storage  Retails New For $149 I am only Asking $100 Like New Reduced to $80  Please call  show contact info   For more info. & pics. Go To : cambriabike.com/products/yakima-hangout-trunk-mounted-carrier-rack-2-bike?variant=13158532546672&utm_source=googleshopping&utm_medium=cse&utm_source=google&utm_medium=cpc&adpos=&scid=scplp101828&sc_intid=101828&gclid=CjwKCAjwm7mEBhBsEiwA_of-TN1XHAMItlDmm291ECBpGsjsyauw0wQpnKb5P6grvQ3kElssZnJQAxoCw-YQAvD_BwE,,,,,,,,,,,
5617,31900.0,cosprings,https://cosprings.craigslist.org/for/d/model-land-for-sale-4086-acres-pinon/7472579924.html,2022-04-17 20:47,"LAND FOR SALE, 40.86 ACRES, PINON PINE TREES, JUNIPERS, ELECTRIC",,,,0,,,,,,,,,,,,
5618,170.0,cosprings,https://cosprings.craigslist.org/bik/d/colorado-springs-trek-mystic-16-loaded/7460893816.html,2022-04-17 12:21,"Trek Mystic 16"" Loaded Metallic Pink", like new, Trek, Mystic Loaded,10,"Ok it's time your little Princess had a bike, well your little girl deserves a quality bike! Why not get her a Sweeeeeet ride for the cost of a cheaply made Walmart bike. A very gently used Trek Mystic 16"" single speed Bike with all the bells and whistles. A Beautiful Metallic Pink with a Trek basket and all the safety pads. A near new Bike kept in excellent condition.    2017 Trek Mystic 16"" Girl's Kids' Bicycle w/ Pads, & Basket / Metallic Pink.  Specifications: Brand: Trek, Model: Mystic 16, Size: Kids, Year: 2017. Frame Material/Construction: 16"" Dialed frame size, high-tensile steel, Fork: High-tensile steel, Weight: 25lbs.  This bike has a weight load of 90lbs. Components: Headset: 1"" Adjustable ball bearing, Brakes: Coster, Handlebar: Dialed 16"" size, steel, Stem: Alloy and steel, two bolt. Seatpost: Steel, Saddle: Dialed 16"" size, padded. Front Hub: Bolt-On 28h, front & Rear Hub: Bolt-On 28h Rims: Chrome over Steel 16"", Front Tire: Knobby 16x2.125 Rear Tire: Knobby 16x2.125. Drivetrain: Crankset: Dialed 3.5"" length, 26T, Chain: KMC. Accessories - Padded handelbar & Stem, and a Trek basket included. Instructions for buying - Please Do Not Approach Me with Scams (why waste both of our time), No Sending for the bike, no codes, ect. - You will need to see it! No scams - can you send me a code - No!!, I don't do business with thieves!! Cash is the payment! I am trust worthy and expect you to be. Email or texts only (if it looks suspicious I report it and only respond if the authorities want me to). ***I'm happy to take Reasonable offers,*** I price these where you can ride a couple of years and sell for the same, I go through all aspects of the bikes operations. Come Enjoy the outdoors, the beauty of our area and get some exercise. Have a Great Day and Blessings unto you!!", steel, kids, Kids Girls step - thru, 16 in,,, none (rigid), coaster, riser, none,
5619,35.0,cosprings,https://cosprings.craigslist.org/bop/d/bicycle-tune-up-and-repair/7465464559.html,2022-04-17 11:39,Bicycle tune up and repair,,,,2,"24 hour turn around or less. Drop off or mobile bicycle repair. Professional service,  full tune ups, 40 point inspection includes, cleaning, brake/shifter, headset, bottom  bracket adjustments, front; rear wheel truing plus overall safety check for - $65.  Single speed, BMX and cruiser style bikes $35 -$45. Complete overhauls tune up plus new cable housing and inner wire, re grease or replace  sealed bearings in hubs, headset, crankset $100 plus parts needed. Wheel truing - $10-$15. wheel builds - $65. Front or rear suspension fluid and seals $50 plus parts. Full suspension frame bearing replacement $75, you provide bearings. New bike in a box assembly includes full tune $75 $15 pre purchase inspection before you buy a used bike.  In business since 1988, former bike shop owner/mechanic.  All work is guaranteed.  show contact info",,,,,,,,,,,
5620,3400.0,cosprings,https://cosprings.craigslist.org/mcy/d/colorado-springs-2003-yamaha-road-star/7472420961.html,2022-04-17 11:13,2003 Yamaha road star 1600 Silver edition,,,,6,"I’m selling my 2003 Yamaha road star 1600 silver edition. It has a little over 14,100 miles on it. I’m selling it because my back is messed up and I haven’t been able to ride it around without being in a lot of pain so it’s been sitting for awhile.  The bike itself runs great. It needs to be lubed up in one area for a small squeak  but besides that it is mechanically in good shape. It spent most of its time in a barn so it’s a bit dusty but she starts right up and the tires have alot of life left in them. The body is in good shape with the exception of one small dent on the tank and the floor board on the left side is missing one bolt but that bolt will be in the mail in the next few days.  The bike comes with two seats the original Silverado seat and the stinger seat. If you know anything about bikes you know seats are not cheap and you get two with this one. The stinger is great for around town but the Silverado seat is big and wide for those long rides which is what is on it right now. I’d hate to sell it because it’s a great bike but I hate seeing it just sit. This bike is comparable to a road king in size  it is not small by any means.  Asking $3400 or Best offer takes her. Shoot me a txt if your interested.",,,,,,,,,,,
5621,200.0,cosprings,https://cosprings.craigslist.org/bop/d/colorado-springs-bike-travel-case/7472389313.html,2022-04-17 09:47,Bike Travel Case, excellent, Trico,,3,"Trico Iron Case that is a top of the line hard shell plastic case to transport your bike. Excellent condition for less than half the cost of a new one.  see pics and Google ""Trico Iron Case"" for more details. Will fit most bikes and the case weighs 30 pounds.",,,,,,,,,,,
5622,215.0,cosprings,https://cosprings.craigslist.org/bik/d/colorado-springs-fuji-dynamite-xs/7472315355.html,2022-04-17 02:43,"Fuji Dynamite 2.0 13"" XS-S", excellent, Fuji, Dynamite 2.0,10,"Hey the riding season is here - so you are looking for a smaller size Mountain Bike with all the attributes of a larger bike here is your chance to get just what you need. Or maybe to treat your youth, or shorter adult, to a super nice Fuji Dynamite 2.0 13"" A great Bike for those of shorter statue, or teens. A well made bike with all the features and functions, of Quality adult bikes just smaller for those that need a smaller bike. All tuned and ready to go, this is a quality Bike by a well loved Japanese Manufacturer.  Don't waste your money on a disposable bike from Walmart etc. no - get a quality bike that will last many years - a sturdy, well made bike to handle the rough trails and the street. Specs: Frame- TIG-welded, Fuji Altair 1 AL. Fork- Fuji Power Shock, 50mm travel, Aluminum/steel, single crown Multi surface Mix: ProMax aluminum linear-pull brakes, Promax aluminum levers, Shimano Tourney RS-31 Shimano Tourney CO-50, bottom-pull/clamp-on 28.6mm, Shimano Tourney TX-50, ProWheel MAP-100 ATB, 24/34/42 teeth, Wellgo resin Sealed cartridge,  7-speed, 13 - 28 teeth, Chain- KMC UG-51, Seat & post-Alloy,  Fuji MTB Jr., Stem- Fuji MTB Riser, Fuji ATB, 1 1/8"" Fuji ATB.  24"" wheels, Hub ATB Oversized Steel, Wheel Jalco VP-20, 36-hole, 24 x 2.00"" Multi-Purpose ATB. Spokes - UCP, 14ga. (2.0mm).      Please Do Not Approach Me with Scams (why waste both of our time), No Sending for the bike, no codes, ect. - You will need to see it! No scam- can you send me a code - No!!, I don't do business with thieves!! Cash is the payment! I am trust worthy and expect you to be. Email or texts only (if it looks suspicious I report it and only respond if the authorities want me to). ***I'm happy to take Reasonable offers,*** I price these where you can ride a couple of years and sell for the same, I go through them all. Enjoy the outdoors, the beauty of our area and get some exercise. Have a Great Day and Blessings unto you!!", aluminum, mountain," 13"" XS-S Frame", 24 in,,, suspension fork (hardtail), v-brakes, cruiser, none,
5623,50.0,cosprings,https://cosprings.craigslist.org/bop/d/colorado-springs-indoor-exercise/7472309626.html,2022-04-17 00:38,Indoor Exercise Bicycle trainer Magnetic Flywheel Stand (Reduced),,,,8,"Sportneer Bike Trainer Stand for Indoor Exercise Bicycle Magnetic Flywheel Stand  STABILITY ON ANY SURFACE: Built with a wide base and low stance for unshakable balance. Features 5 adjustable anti-slip rubber feet to even out any uneven flooring SPIN IN SILENCE: Smooth, seamless design and noise reduction resistance wheel mean you there’s no need to amp up the volume when you build up the burn (Note: The noise is mainly related to the materials and tread of bike tires. We highly suggest you to use road bikes because the noise will be louder if MTB is used.) 6 RESISTANCE SETTINGS: Train to your standards with bar-mounted remote and wide range resistance curve to simulate all cycling conditions EASY BIKE RELEASE: Ready to head outside? Just hit the press-down lever clamp to easily release and remove your ride. Front wheel riser block and rear quick release lever are included for quick installation. GREAT COMPABILITY: The Indoor Bike Trainer Stand fits any road or mountain bike with a 26-28"" or 700c wheel and with rear wheel axel between 4.92'-6.57""  Come with front wheel stabilizer  New (not pictured)  Retails New for $191.40 on ebay I am only asking $110 Like new Reduced to $50  Go To : sportrhino.com/products/sportneer-bike-trainer-stand-steel-bicycle-exercise-magnetic-stand-with-noise-reduction-wheel-for-road-bike?gclid=Cj0KCQjwnueFBhChARIsAPu3YkT7KannA_HkfgCIaAaWPPKNih1f02q1GUq3QGFUzlDXrrx3bAaEzzUaAosDEALw_wcB",,,,,,,,,,,
5624,50.0,cosprings,https://cosprings.craigslist.org/bop/d/colorado-springs-bell-cantilever-bike/7472309017.html,2022-04-17 00:30,2 - Bell Cantilever 300 3-Bike Trunk Rack/Carrier (Reduced),,,,5,"Bell Cantilever 300 3-Bike Trunk Rack, one Step Folding With Hub  Patented, adjustable hubs for a custom fit Rugged steel construction Stable, 6-strap design holds 3 bikes securely Minibike blocks with integrated tie-downs add stability Folds flat for easy storage Ideal for coupes, hatchbacks, minivans and sport utility vehicles Bell bike carrier is useful for long trips Fully assembled and can be installed quickly  Retails New for $92.59 I am only asking $60 Like New Reduced to $50 each   One Looks like this one , but it is a 3-bike & the other one the cradles are Black  For info. & pics. Go To : walmart.com/ip/Bell-Sports-Cantilever-300-3-Bike-Trunk-Rack/3919",,,,,,,,,,,
