,Price,Location,URL,Date,Title,bicycle frame material,bicycle type,brake type,condition,electric assist,frame size,handlebar type,make / manufacturer,suspension,wheel size,num image,text,model name / number,part type,serial number,size / dimensions
3058,2200.0,hanford,https://bakersfield.craigslist.org/bik/d/bakersfield-stealth-electric-bikes-37/7469298928.html,2022-04-09 17:49,Stealth Electric Bikes F-37 Stealth Fighter, aluminum, mountain, disc (hydraulic), excellent, throttle, NA, downhill, Stealth Electric Bikes, frame and fork (full suspension), 24 in,15,2015 Stealth Electric Bikes F-37 Stealth Fighter   This is a custom hand built beast – Stealth Fighter #185 that used to belong to a well known forum member on Endless Sphere: Has a twist throttle. Very fast bike!   -Brakes are Magura downhill MT2’s -1332 miles on upgraded F37 Controller + Battery= 4100 Watts 40 MPH - Rear wheel is 1.40 x 18″ MC with VeeRubber 3.00 x 18 Super Trail Star tire – all mounted to vented air cooled hub - Front fork is Marzocchi 380RS with 200mm of travel - Shock DNM Burner with coil spring with 200mm of travel -Brooks Seat -Carbon fiber bars -AC Charger, F-37 Stealth Fighter,, #185,
3059,2000.0,hanford,https://fresno.craigslist.org/for/d/fresno-125cc-dirt-bikes-and-50cc-dirt/7459069818.html,2022-04-08 14:12,125cc dirt bikes and 50cc dirt bikes,,,, new,,,,,,,5,"Brand new perfect condition! Dirt bikes available , delivery included to local areas in Fresno! Contact to coordinate delivery.  50cc dirt bikes available , minimum order amount : 4 total.  Four total 50cc dirt bikes, two stroke automatic for $2000.   Or 125cc dirt bikes available! Fully automatic for $1900, or manual for $2000.  Please contact to coordinate delivery, serious buyers only",,,,
3060,2000.0,hanford,https://fresno.craigslist.org/spo/d/fresno-dirt-bikes-available/7459070440.html,2022-04-08 14:11,Dirt Bikes available,,,, new,,,,,,,5,"Brand new perfect condition! Dirt bikes available , delivery included to local areas in Fresno! Contact to coordinate delivery.  50cc dirt bikes available , minimum order amount : 4 total.  Four total 50cc dirt bikes, two stroke automatic for $2000.   Or 125cc dirt bikes available! Fully automatic for $1900, or manual for $2000.  Please contact to coordinate delivery, serious buyers only",,,,
3061,25.0,hanford,https://fresno.craigslist.org/bik/d/fresno-many-kids-bikesfor-age-6/7464290031.html,2022-04-07 23:32,Many Kids Bikes(for age 2-6), steel, kids, coaster, excellent,, Small, flat, Kids, none (rigid), 10 in,8,$20-35 each. ** Have a few more not pictured).  Call Darryl anytime at 559-444-328three, Small,,,
3062,2295.0,hanford,https://merced.craigslist.org/sgd/d/electric-the-mid-drive-ebike-that/7468135994.html,2022-04-07 07:55,ELECTRIC! The Mid-drive eBike that Shreds! CyberBike eMountain Bikes!,,,, new,,,, Cyberbike,,,15,"Introducing the New 2022 Cyberbike Electric Mountain Bikes   Riders agree: Nothing comes close to Cyberbike's combination of performance, value, style, and quality.  See the Cyberbike Mullet Pro in action HERE! (and here, by popular demand, is last year's intro featuring Division 1 Collegiate Mountain Racer Corey Jackson on the first edition Cyberbike) Order online for fast delivery at www.Cyberbike.com All 2022 Cyberbikes are in stock and ready to shred, Order yours before they're sold out!  More mid-drive power than ever Awesome new color graphic display Easier to ride, lower standover frame, the lowest of any mid-drive eMTB New, structurally superior, mountain ready rear suspension linkage The best brakes in the business, even Quad-piston brakes on some models! Massive brake rotors up to 220mm 34mm gold tube forks on some models up to 140mm travel Wider range of models  A proper e-Mountain bike needs to be mid-drive and have full suspension, it's as simple as that. Until now, if you wanted an electric mountain bike to tackle rugged trails, your choices have been heavy, low-quality, fat tire, hub-motor beach bikes, or legacy brands charging $4000 or more for low-power eBikes without full suspension.   Whether your knees are tired or you just want to shred, there is simply no better choice for performance and value than Cyberbike. An American company with great customer support: Cyberbike, USA. The mountains are calling. Will you answer?  Cyberbike eBikes come all with the quietest and most powerful motor in its class, with a long range (65 miles and more) battery, and powerful e-spec hydraulic disk brakes that will be there when you need them. A lightweight package with 500 watts of power, top-of-the-line battery range, and quality components, all for the price of an inexpensive yet stellar bike! You'll get so much more than other eBikes with the CyberBike, it's the real e-MTB experience for the adventurous rider. Performance, specs, and quality components throughout, and the best warranty in the industry, from an American company with experienced American mechanics on call for all your tech support needs.  54 volt/500 watt climbing power with 13Amp hour Li-Ion battery and only 52 lbs means you'll get power and tons of battery range. Now with available throttle! Now from only $2495 Note: Owning and riding comes with risks. Wear proper protection, properly maintain and check your bike, and ride within your limits. By purchasing our products you agree to take full responsibility for the ownership of your bike, including the above and all other reasonable precautions for yourself or anyone you allow to ride your bike.",,,,
3063,600.0,hanford,https://slo.craigslist.org/bik/d/pismo-beach-cruiser-7d-bikes/7458352164.html,2022-04-04 20:29,Cruiser 7D Bikes,,,,,,,,,,,0,,,,,
3064,250.0,hanford,https://slo.craigslist.org/snw/d/san-miguel-pit-bikes/7455180546.html,2022-04-03 10:28,Pit bikes,,,,,,,,,,,3,"Two pit bikes, $250 each or $400  for the pair. These were both running, but they are projects. So if you need to hear them run, don’t waste my time. Dan  show contact info    Mini bikes, motor bikes, motorcycles, Honda, Yamaha, Kawasaki. Suzuki. Go kart, small engine,",,,,
3065,300.0,hanford,https://slo.craigslist.org/bik/d/paso-robles-vintage-folding-bikes/7466284423.html,2022-04-02 17:20,Vintage Folding Bikes, aluminum, other,,,, Medium,,,, 16 in,4,Vintage Victoria folding bikes for sale! These are in beautiful condition great for RV camping or to put in your trunk as a fun bike! Call or text only! No emails!,,,,
3066,1099.0,hanford,https://bakersfield.craigslist.org/snd/d/hanford-brand-new-tao-db-dirt-bikes-for/7465773432.html,2022-04-01 13:10,BRAND NEW TAO DB10 110 DIRT BIKES FOR SALE!!,,,,,,,,,,,8,"TAO DB10 110cc AUTOMATIC TRANSMISSION BRAND NEW! MSRP: $1099  FEROMA MOTORSPORTS & AUTO SALES!! ◆SALES◆SERVICE◆PARTS◆ACCESSORIES◆  HERE AT FEROMA MOTORSPORTS WE CARRY A LARGE INVENTORY OF PRE-OWNED ATV's, DIRT BIKES, CRUISERS, STREET BIKES, UTV's, GO-KARTS, AUTOMOBILES, AND SO MUCH MORE!!  COME TO THE SHOP FOR ALL YOUR REPAIRS OR PARTS NEEDS!! (powersports only)  ONLY DEALER THAT GIVES WARRANTYS ON USED ATV'S!!  WE ALSO ACCEPT TRADE-INS, AND PAY CA$H FOR USED ATV's, DIRTBIKES, STREET BIKES, ETC...  STOP IN AND CHECK OUT OUR SHOWROOMS, AND SALES LOT- OR SHOP FOR ANY AND ALL OF YOUR MOTORSPORTS APPAREL NEEDS HERE IN OUR RETAIL STORE!!  CALL US OR COME BY FOR MORE INFO!!  VISIT OUR WEBSITE FOR COMPLETE INVENTORY AND OTHER SERVICES!! www.feromamotorsports.com  MON-FRI: 9 AM TO 6 PM SAT: 9 AM TO 3 PM  FEROMA MOTORSPORTS & AUTO SALES 601 E. 7TH ST. HANFORD, CA 93230 PH.# (559)582-5501 www.feromamotorsports.com",,,,
3067,999.0,hanford,https://fresno.craigslist.org/mcd/d/hanford-brand-new-syx-moto-pad-60-dirt/7464601024.html,2022-03-29 16:10,BRAND NEW SYX MOTO PAD-60 DIRT BIKES FOR SALE!!,,,,,,,,,,,5,"SYX MOTO PAD-60 DIRT BIKE 60cc FULLY AUTOMATIC TRANSMISSION  MULTIPLE COLORS AVAILABLE BRAND NEW! MSRP: $999  FEROMA MOTORSPORTS & AUTO SALES!! ◆SALES◆SERVICE◆PARTS◆ACCESSORIES◆  HERE AT FEROMA MOTORSPORTS WE CARRY A LARGE INVENTORY OF PRE-OWNED ATV's, DIRT BIKES, CRUISERS, STREET BIKES, UTV's, GO-KARTS, AUTOMOBILES, AND SO MUCH MORE!!  COME TO THE SHOP FOR ALL YOUR REPAIRS OR PARTS NEEDS!! (powersports only)  ONLY DEALER THAT GIVES WARRANTYS ON USED ATV'S!!  WE ALSO ACCEPT TRADE-INS, AND PAY CA$H FOR USED ATV's, DIRTBIKES, STREET BIKES, ETC...  STOP IN AND CHECK OUT OUR SHOWROOMS, AND SALES LOT- OR SHOP FOR ANY AND ALL OF YOUR MOTORSPORTS APPAREL NEEDS HERE IN OUR RETAIL STORE!!  CALL US OR COME BY FOR MORE INFO!!  VISIT OUR WEBSITE FOR COMPLETE INVENTORY AND OTHER SERVICES!! www.feromamotorsports.com  MON-FRI: 9 AM TO 6 PM SAT: 9 AM TO 3 PM  FEROMA MOTORSPORTS & AUTO SALES 601 E. 7TH ST. HANFORD, CA 93230 PH.# (559)582-5501 www.feromamotorsports.com",,,,
3068,100.0,hanford,https://slo.craigslist.org/bik/d/atascadero-bikes-two/7464598315.html,2022-03-29 16:07,Bikes - two,,,,,,,,,,,0,,,,,
3069,1498.0,hanford,https://fresno.craigslist.org/snd/d/hanford-brand-new-syx-moto-pad-125f/7464599343.html,2022-03-29 16:06,BRAND NEW SYX MOTO PAD-125F AUTOMATIC DIRT BIKES FOR SALE!!,,,,,,,,,,,4,"SYX MOTO PAD-125 F 125cc FULLY AUTOMATIC TRANSMISSION ​ ELECTRIC START BRAND NEW MSRP: $1498 (+tax&dmv fees)  FEROMA MOTORSPORTS & AUTO SALES!! ◆SALES◆SERVICE◆PARTS◆ACCESSORIES◆  HERE AT FEROMA MOTORSPORTS WE CARRY A LARGE INVENTORY OF PRE-OWNED ATV's, DIRT BIKES, CRUISERS, STREET BIKES, UTV's, GO-KARTS, AUTOMOBILES, AND SO MUCH MORE!!  COME TO THE SHOP FOR ALL YOUR REPAIRS OR PARTS NEEDS!! (powersports only)  ONLY DEALER THAT GIVES WARRANTYS ON USED ATV'S!!  WE ALSO ACCEPT TRADE-INS, AND PAY CA$H FOR USED ATV's, DIRTBIKES, STREET BIKES, ETC...  STOP IN AND CHECK OUT OUR SHOWROOMS, AND SALES LOT- OR SHOP FOR ANY AND ALL OF YOUR MOTORSPORTS APPAREL NEEDS HERE IN OUR RETAIL STORE!!  CALL US OR COME BY FOR MORE INFO!!  VISIT OUR WEBSITE FOR COMPLETE INVENTORY AND OTHER SERVICES!! www.feromamotorsports.com  MON-FRI: 9 AM TO 6 PM SAT: 9 AM TO 3 PM  FEROMA MOTORSPORTS & AUTO SALES 601 E. 7TH ST. HANFORD, CA 93230 PH.# (559)582-5501 www.feromamotorsports.com",,,,
3070,650.0,hanford,https://fresno.craigslist.org/snd/d/hanford-brand-new-syx-moto-holeshot/7464594092.html,2022-03-29 15:52,BRAND NEW SYX MOTO HOLESHOT DIRT BIKES FOR SALE!!,,,,,,,,,,,0,"SYX MOTO HOLESHOT 50cc 2-STROKE PULL START BRAND NEW! MULTIPLE COLORS IN STOCK! RETAIL: $650 (+tax&dmv fees)  SPECIFICATIONS: Engine: Engine Type	2 Stroke, Single Cylinder Displacement	50cc Bore and Stroke	1.73 inches x 1.31 inches Starter	Pull Start Cooling	Air Cooled Max Speed	30 mph May vary depending on road condition, rider weight etc. Compression Ratio	8.0:1 Rated Power	2.52HP/7000rpm Carburetor	H117A FLOAT (PLUNGER) Fuel grade	91# gas Mixture ratio of fuel & lubricant oil	20~25:1  Drive Train: Transmission	Automatic Centrifugal Drive System	Chain Chassis / Suspension / Brakes Wheel Type	Alloy Rear Suspension	Spring Front Brake	Disc Rear Brake	Disc Front Tire	2.5-10 Rear Tire	2.5-10  Dimensions / Capacities: Length	50.4 inches Width	22 inches Height	33.5 inches Seat Height	23 inches Ground Clearance	7.5 inches Net Weight	48 lbs Gross Weight	57 lbs Weight Capacity	176 lbs Fuel Capacity	0.45 gal  Other: Restrictions	CA Legal with Red Sticker  FEROMA MOTORSPORTS & AUTO SALES!! ◆SALES◆SERVICE◆PARTS◆ACCESSORIES◆  HERE AT FEROMA MOTORSPORTS WE CARRY A LARGE INVENTORY OF PRE-OWNED ATV's, DIRT BIKES, CRUISERS, STREET BIKES, UTV's, GO-KARTS, AUTOMOBILES, AND SO MUCH MORE!!  COME TO THE SHOP FOR ALL YOUR REPAIRS OR PARTS NEEDS!! (powersports only)  ONLY DEALER THAT GIVES WARRANTYS ON USED ATV'S!!  WE ALSO ACCEPT TRADE-INS, AND PAY CA$H FOR USED ATV's, DIRTBIKES, STREET BIKES, ETC...  STOP IN AND CHECK OUT OUR SHOWROOMS, AND SALES LOT- OR SHOP FOR ANY AND ALL OF YOUR MOTORSPORTS APPAREL NEEDS HERE IN OUR RETAIL STORE!!  CALL US OR COME BY FOR MORE INFO!!  VISIT OUR WEBSITE FOR COMPLETE INVENTORY AND OTHER SERVICES!! www.feromamotorsports.com  MON-FRI: 9 AM TO 6 PM SAT: 9 AM TO 3 PM  FEROMA MOTORSPORTS & AUTO SALES 601 E. 7TH ST. HANFORD, CA 93230 PH.# (559)582-5501 www.feromamotorsports.com",,,,
3071,1498.0,hanford,https://fresno.craigslist.org/mcd/d/hanford-brand-new-tao-dbx1-125-dirt/7464590815.html,2022-03-29 15:43,BRAND NEW TAO DBX1 125 DIRT BIKES FOR SALE!!,,,,,,,,,,,5,"TAO DBX1 125 125cc MANUAL TRANSMISSION  BRAND NEW! MSRP: $1498  FEROMA MOTORSPORTS & AUTO SALES!! ◆SALES◆SERVICE◆PARTS◆ACCESSORIES◆  HERE AT FEROMA MOTORSPORTS WE CARRY A LARGE INVENTORY OF PRE-OWNED ATV's, DIRT BIKES, CRUISERS, STREET BIKES, UTV's, GO-KARTS, AUTOMOBILES, AND SO MUCH MORE!!  COME TO THE SHOP FOR ALL YOUR REPAIRS OR PARTS NEEDS!! (powersports only)  ONLY DEALER THAT GIVES WARRANTYS ON USED ATV'S!!  WE ALSO ACCEPT TRADE-INS, AND PAY CA$H FOR USED ATV's, DIRTBIKES, STREET BIKES, ETC...  STOP IN AND CHECK OUT OUR SHOWROOMS, AND SALES LOT- OR SHOP FOR ANY AND ALL OF YOUR MOTORSPORTS APPAREL NEEDS HERE IN OUR RETAIL STORE!!  CALL US OR COME BY FOR MORE INFO!!  VISIT OUR WEBSITE FOR COMPLETE INVENTORY AND OTHER SERVICES!! www.feromamotorsports.com  MON-FRI: 9 AM TO 6 PM SAT: 9 AM TO 3 PM  FEROMA MOTORSPORTS & AUTO SALES 601 E. 7TH ST. HANFORD, CA 93230 PH.# (559)582-5501 www.feromamotorsports.com",,,,
3072,1450.0,hanford,https://fresno.craigslist.org/mcd/d/hanford-brand-new-apollo-db-x15-dirt/7464584511.html,2022-03-29 15:27,BRAND NEW APOLLO DB-X15 DIRT BIKES FOR SALE!!,,,,,,,,,,,6,"APOLLO DB-X15 125cc MANUAL TRANSMISSION BRAND NEW! *LIMITED SUPPLY IN STOCK **MULTIPLE COLORS AVAILABLE! MSRP: $1450  FEROMA MOTORSPORTS & AUTO SALES!! ◆SALES◆SERVICE◆PARTS◆ACCESSORIES◆  HERE AT FEROMA MOTORSPORTS WE CARRY A LARGE INVENTORY OF PRE-OWNED ATV's, DIRT BIKES, CRUISERS, STREET BIKES, UTV's, GO-KARTS, AUTOMOBILES, AND SO MUCH MORE!!  COME TO THE SHOP FOR ALL YOUR REPAIRS OR PARTS NEEDS!! (powersports only)  ONLY DEALER THAT GIVES WARRANTYS ON USED ATV'S!!  WE ALSO ACCEPT TRADE-INS, AND PAY CA$H FOR USED ATV's, DIRTBIKES, STREET BIKES, ETC...  STOP IN AND CHECK OUT OUR SHOWROOMS, AND SALES LOT- OR SHOP FOR ANY AND ALL OF YOUR MOTORSPORTS APPAREL NEEDS HERE IN OUR RETAIL STORE!!  CALL US OR COME BY FOR MORE INFO!!  VISIT OUR WEBSITE FOR COMPLETE INVENTORY AND OTHER SERVICES!! www.feromamotorsports.com  MON-FRI: 9 AM TO 6 PM SAT: 9 AM TO 3 PM  FEROMA MOTORSPORTS & AUTO SALES 601 E. 7TH ST. HANFORD, CA 93230 PH.# (559)582-5501 www.feromamotorsports.com",,,,
3073,1500.0,hanford,https://santamaria.craigslist.org/bik/d/oxnard-sondor-electric-bikes-set-of/7453225145.html,2022-03-28 14:07,Sondor Electric Bikes- set of 2, other/unknown, hybrid/comfort,, excellent, pedal assist," Medium, large",,,, other/unknown,0,Upgraded Batteries  Great condition - needs only brake adjustments   Serious inquiries only $1500 each  Stored in Oxnard,,,,
3074,1.0,hanford,https://slo.craigslist.org/mpo/d/atascadero-ducati-sport-classic2-bikes/7463333934.html,2022-03-26 13:38,"DUCATI Sport Classic..2 bikes and NOS Tanks ,Parts",,,,,,,, Ducati,,,0,"I have a group of  Ducati's Sport classic  bikes and parts,   Italian  Twin shock retro bike  If you loved the 900ss    You will really love the  This 1,000cc Fuel Injected power band, Light weight trellis framed. -Factory WET Clutch- easy to work on air cooled modern retro motorcycle   I have (2) project Bikes and a ton of Parts I have collected for them including multi- body/tank sets -Some sets are NOS or Pro resealed Tanks, Forks- Gauge sets- pipes -seats----  complete Black SE tank and body set-- lots of goodies Both bikes ran when last played with will need work repair , been sitting  The price will be reasonable.- I will sell any combo or whole collection   I only respond to PHONE CALLs --NO Text- NO email Serious with cash can CALL  (805) 296-766FIVE-- NO Text/Email", SE 900ss,,,
3075,50.0,hanford,https://bakersfield.craigslist.org/bop/d/bakersfield-bike-rack-for-three-bikes/7458190161.html,2022-03-26 08:56,Bike rack for three bikes,,,,,,,, Viper,,,3,Bike rack for three bikes Fits on a tow hitch,,,,
3076,900.0,hanford,https://bakersfield.craigslist.org/bik/d/bakersfield-bikes-for-sale/7462132176.html,2022-03-23 16:38,6 Bikes for Sale, aluminum, mountain,,,, 5,,,, 10 in,2,Schwinn aluminum dr2 225 Giant Cypress 225 Breezer 225 Schwinn Trailway 125 2 kids bikes 100 each OR  900 for all Can send more pictures of all bikes if needed,,,,
3077,50.0,hanford,https://fresno.craigslist.org/wan/d/fresno-adult-or-kid-bikes/7449235169.html,2022-03-22 23:35,Adult Or Kid Bikes,,,,,,,,,,,0,We buy Good shape Bikes Send pictures or text  show contact info  Thanks,,,,
3078,100.0,hanford,https://fresno.craigslist.org/bik/d/madera-mountain-bikes/7457474868.html,2022-03-21 19:22,Mountain bikes, alloy, mountain,,,, 26,, Giant, suspension fork (hardtail), 26 in,2,Giant boulder se  Diamond back   20” 100 firm for both bikes,,,,
3079,50.0,hanford,https://fresno.craigslist.org/bik/d/clovis-trail-bikes-folder-hitch-bike/7460496481.html,2022-03-19 18:09,Trail-a-Bikes Folder 1 Hitch Bike, steel, other,,,, Hitch Bike,,,, other/unknown,2,"More than 25 years since its debut in 1986, the Folder One is the original that continues to set the bar for the hitch bike category. Featuring the patented Adams hitch that is often imitated but never duplicated, the Folder One offers unmatched safety and durability for years of enjoyment. Backed by a lifetime warranty, the Folder One is the best way to introduce kids to the joys of cycling.  Steel frame, designed for children aged 4+, I had my 9 year old still riding with me for long trips. Simple single-speed is easy to pedal and ride Patented, folding frame for easy storage and transport Compatible with most 26"" and 700c lead bicycles Low center of gravity offers increased stability to parents and children Best-in-class steel hitch + 4 adapters will fit almost any seatpost Full chainguard and bashguard for enhanced durability Includes safety flag for maximum visibility on the road",,,,
3080,300.0,hanford,https://slo.craigslist.org/bop/d/san-luis-obispo-yakima-dr-tray-bike-rack/7472959971.html,2022-04-18 16:11,Yakima Dr Tray bike rack,,,,,,,,,,,0,,,,,
3081,55.0,hanford,https://fresno.craigslist.org/bik/d/fresno-indoor-bike-trainer-cycleops-mag/7467120296.html,2022-04-18 15:52,Indoor Bike Trainer CycleOps Mag, other/unknown, road,, excellent,, Medium,, CycleOps,, 700C,4,"Magnetic resistance unit provides a quiet and frictionless ride.  Linear resistance boosts workout intensity to match each pedal stroke and gear click. Noise level at 20 mph is 70-74 decibels.  Precision-machined alloy roller reduces tire wear and slippage. Adjust tire fit to a resistant unit with a convenient turn knob. Made in Madison, WI, USA Lifetime warranty Will fit MOST 29er wheels up to 2.25"" width, depending on tire tread  (700c or 622 mm ISO (inside rim diameter) wheels, commonly called 29"" wheels.) Most mountain bikes once used ISO 559 mm wheels, commonly called 26"" wheels New 5-position adjustment makes it easy to vary your workouts. Excellent condition Please call  show contact info  if interested. (THIS NUMBER DOES NOT ACCEPT TEXT) Thanks for looking",,,,
3082,10000.0,hanford,https://merced.craigslist.org/snw/d/merced-2011-harley-davidson-super-glide/7463786463.html,2022-04-18 15:30,2011 HARLEY DAVIDSON SUPER GLIDE CUSTOM,,,,,,,,,,,8,"2011 Harley Davidson Super Glide Custom this bike is super clean ready to roll needs nothing one of the baddest bikes I've ever ridden and I've owned alot of bikes looking for 10,000 or trade call text or email anytime  show contact info  thanks",,,,
3083,6999.0,hanford,https://fresno.craigslist.org/snd/d/hanford-2009-kawasaki-kfx-450r-for-sale/7472896901.html,2022-04-18 13:46,2009 KAWASAKI KFX 450R FOR SALE!!,,,,,,,,,,,2,"2009 KAWASAKI KFX 450r 450cc MANUAL TRANSMISSION FUEL INJECTION SPARKS RACING EXHAUST EXCELLENT CONDITION, SUPER CLEAN! RETAIL: $6999 (+tax&dmv fees)  FEROMA MOTORSPORTS & AUTO SALES!! ◆SALES◆SERVICE◆PARTS◆ACCESSORIES◆  HERE AT FEROMA MOTORSPORTS WE CARRY A LARGE INVENTORY OF PRE-OWNED ATV's, DIRT BIKES, CRUISERS, STREET BIKES, UTV's, GO-KARTS, AUTOMOBILES, AND SO MUCH MORE!!  COME TO THE SHOP FOR ALL YOUR REPAIRS OR PARTS NEEDS!! (powersports only)  ONLY DEALER THAT GIVES WARRANTYS ON USED ATV'S!!  WE ALSO ACCEPT TRADE-INS, AND PAY CA$H FOR USED ATV's, DIRTBIKES, STREET BIKES, ETC...  STOP IN AND CHECK OUT OUR SHOWROOMS, AND SALES LOT- OR SHOP FOR ANY AND ALL OF YOUR MOTORSPORTS APPAREL NEEDS HERE IN OUR RETAIL STORE!!  CALL US OR COME BY FOR MORE INFO!!  VISIT OUR WEBSITE FOR COMPLETE INVENTORY AND OTHER SERVICES!! www.feromamotorsports.com  MON-FRI: 9 AM TO 6 PM SAT: 9 AM TO 3 PM  FEROMA MOTORSPORTS & AUTO SALES 601 E. 7TH ST. HANFORD, CA 93230 PH.# (559)582-5501 www.feromamotorsports.com",,,,
3084,5999.0,hanford,https://fresno.craigslist.org/mcd/d/hanford-2011-honda-crf-450r-for-sale/7472894516.html,2022-04-18 13:41,2011 HONDA CRF 450r FOR SALE!!,,,,,,,,,,,4,"2011 HONDA CRF 450r  450cc 4-STROKE MANUAL TRANSMISSION EXCELLENT CONDITION, SUPER CLEAN! RETAIL: $5999 (+tax&dmv fees)  FEROMA MOTORSPORTS & AUTO SALES!! ◆SALES◆SERVICE◆PARTS◆ACCESSORIES◆  HERE AT FEROMA MOTORSPORTS WE CARRY A LARGE INVENTORY OF PRE-OWNED ATV's, DIRT BIKES, CRUISERS, STREET BIKES, UTV's, GO-KARTS, AUTOMOBILES, AND SO MUCH MORE!!  COME TO THE SHOP FOR ALL YOUR REPAIRS OR PARTS NEEDS!! (powersports only)  WE ALSO ACCEPT TRADE-INS, AND PAY CA$H FOR USED ATV's, DIRTBIKES, STREET BIKES, ETC...  STOP IN AND CHECK OUT OUR SHOWROOMS, AND SALES LOT- OR SHOP FOR ANY AND ALL OF YOUR MOTORSPORTS APPAREL NEEDS HERE IN OUR RETAIL STORE!!  CALL US OR COME BY FOR MORE INFO!!  VISIT OUR WEBSITE FOR COMPLETE INVENTORY AND OTHER SERVICES!! www.feromamotorsports.com  MON-FRI: 9 AM TO 6 PM SAT: 9 AM TO 3 PM  FEROMA MOTORSPORTS & AUTO SALES 601 E. 7TH ST. HANFORD, CA 93230 PH.# (559)582-5501 www.feromamotorsports.com",,,,
3085,3995.0,hanford,https://fresno.craigslist.org/snd/d/hanford-2015-honda-trx-90x-for-sale/7472893235.html,2022-04-18 13:38,2015 HONDA TRX 90X FOR SALE!!,,,,,,,,,,,7,"2015 HONDA TRX 90X 90cc SEMI-AUTOMATIC TRANSMISSION ADJUSTABLE SAFETY THROTTLE  EXCELLENT CONDITION, SUPER CLEAN! RETAIL: $3995 (+tax&dmv fees)  FEROMA MOTORSPORTS & AUTO SALES!! ◆SALES◆SERVICE◆PARTS◆ACCESSORIES◆  HERE AT FEROMA MOTORSPORTS WE CARRY A LARGE INVENTORY OF PRE-OWNED ATV's, DIRT BIKES, CRUISERS, STREET BIKES, UTV's, GO-KARTS, AUTOMOBILES, AND SO MUCH MORE!!  COME TO THE SHOP FOR ALL YOUR REPAIRS OR PARTS NEEDS!! (powersports only)  ONLY DEALER THAT GIVES WARRANTYS ON USED ATV'S!!  WE ALSO ACCEPT TRADE-INS, AND PAY CA$H FOR USED ATV's, DIRTBIKES, STREET BIKES, ETC...  STOP IN AND CHECK OUT OUR SHOWROOMS, AND SALES LOT- OR SHOP FOR ANY AND ALL OF YOUR MOTORSPORTS APPAREL NEEDS HERE IN OUR RETAIL STORE!!  CALL US OR COME BY FOR MORE INFO!!  VISIT OUR WEBSITE FOR COMPLETE INVENTORY AND OTHER SERVICES!! www.feromamotorsports.com  MON-FRI: 9 AM TO 6 PM SAT: 9 AM TO 3 PM  FEROMA MOTORSPORTS & AUTO SALES 601 E. 7TH ST. HANFORD, CA 93230 PH.# (559)582-5501 www.feromamotorsports.com",,,,
3086,3995.0,hanford,https://fresno.craigslist.org/snd/d/hanford-2012-honda-trx-90x-for-sale/7472893626.html,2022-04-18 13:39,2012 HONDA TRX 90X FOR SALE!!,,,,,,,,,,,7,"2012 HONDA TRX 90X 90cc SEMI-AUTOMATIC TRANSMISSION ADJUSTABLE SAFETY THROTTLE  EXCELLENT CONDITION, SUPER CLEAN! RETAIL: $3995 (+tax&dmv fees)  FEROMA MOTORSPORTS & AUTO SALES!! ◆SALES◆SERVICE◆PARTS◆ACCESSORIES◆  HERE AT FEROMA MOTORSPORTS WE CARRY A LARGE INVENTORY OF PRE-OWNED ATV's, DIRT BIKES, CRUISERS, STREET BIKES, UTV's, GO-KARTS, AUTOMOBILES, AND SO MUCH MORE!!  COME TO THE SHOP FOR ALL YOUR REPAIRS OR PARTS NEEDS!! (powersports only)  ONLY DEALER THAT GIVES WARRANTYS ON USED ATV'S!!  WE ALSO ACCEPT TRADE-INS, AND PAY CA$H FOR USED ATV's, DIRTBIKES, STREET BIKES, ETC...  STOP IN AND CHECK OUT OUR SHOWROOMS, AND SALES LOT- OR SHOP FOR ANY AND ALL OF YOUR MOTORSPORTS APPAREL NEEDS HERE IN OUR RETAIL STORE!!  CALL US OR COME BY FOR MORE INFO!!  VISIT OUR WEBSITE FOR COMPLETE INVENTORY AND OTHER SERVICES!! www.feromamotorsports.com  MON-FRI: 9 AM TO 6 PM SAT: 9 AM TO 3 PM  FEROMA MOTORSPORTS & AUTO SALES 601 E. 7TH ST. HANFORD, CA 93230 PH.# (559)582-5501 www.feromamotorsports.com",,,,
3087,4000.0,hanford,https://bakersfield.craigslist.org/mcy/d/lamont-goldwings-4700/7472839114.html,2022-04-18 11:55,"GOLDWINGS-$4,700 &",,,,,,,,,,,17,***It's a 1500 Goldwing - It's available.  Enjoy the walk-around video clip I made of the bike. Contact me if interested. Text inquiries work best.  Paste link in search-bar to watch video.  https://youtu.be/GhhbIj7XHVQ  Asking price slightly flexible during an in person viewing.  'Check out my blue 1500 Goldwing on Craigslist'  You might also enjoy this Honda Goldwing Ad.  https://youtu.be/NTOKVCFRPmc  Thanks for viewing.,,,,
3088,6500.0,hanford,https://fresno.craigslist.org/mcy/d/fresno-2016-ktm-300-sx/7472831772.html,2022-04-18 11:41,2016 KTM 300 SX,,,,,,,,,,,4,"Have For Sale  1 Owner 2016 KTM 250 SX, upgraded with KTM’s 300 kit and 6 speed transmission. Like new condition with low hours, never been on a track,  only trail ridden by 68 year old. Well taken care of, only selling my bikes because of health conditions.   Bogkin Suspension  KTM Powerparts fuel tank KTM skid plate Fastway pegs Fastway sparky FMF Fatty/guard Gripper Seat New Rear tire New Grips Comes with the title, manual,  complete low hour 250 top end, stock tank, pipe, sprockets. Serious only inquire  $6500 obo",,,,
