,Price,Location,URL,Date,Title,bicycle frame material,bicycle type,brake type,condition,electric assist,frame size,handlebar type,make / manufacturer,suspension,wheel size,num image,text,model name / number,part type,serial number,size / dimensions
3102,1000.0,hanford,https://bakersfield.craigslist.org/for/d/tehachapi-think-grow-led-horticulture/7472618272.html,2022-04-18 01:42,Think Grow LED Horticulture Grow lights! Commercial grade! New Cond.!,,,, like new,,,, ThinkGrow,,,5,"Hello Craigslist!!    I have for Sale some 'ThinkGrow' LED Model-W Grow lights. Fully dimmable and full spectrum. If you're looking at this ad, you should know that these are the Ferrari of grow lights. They are in AMAZING condition and work perfectly. No issues whatsoever.   ...keeping it short and sweet, They are 1000 Watt Equivalent using only 630 Real Watts. Commercial grade. Extremely efficient, FULL spectrum. Google them for yourself for full specs because its too much to get into here. All you need to know is these are the best of the best. Perfect for cannabis, indoor gardening, micro-green farming, growing your own fruits and veggies indoors. Any type of agriculture cultivation really.   They are able to be ran in configuration with one another or individually using a Trolmaster controller. You can run them without the controller and just plug them into a regular 120v outlet. Ill include the adapter for you. These are the cream of the crop of horticulture lights. Super easy to use.  THESE CAN BE RAN IN EITHER VEG OR FLOWER.  The light bars are removable.   VEG IT COVERS A 7X7 SQUARE FOOT GROW SPACE EACH LIGHT  FLOWER IT COVERS A 5X5 SQUARE FOOT GROW SPACE EACH LIGHT  They normally run $1300+ each IF you can find them. I'll do $1000 each. In the pictures they are at 1% power just to give you and idea, at 100% they are absolutely insane. At 100% power they are as powerful and bright as a 1000W has yet they only use 630 WATTS!  Everybody is worried about density with LED and it is absolutely there. These are full spectrum and more efficient then a HPS. Full spectrum = more purple and more flavor! LED is the future, look at all the big facilities transitioning to LED. Equivalent yields and quality and nearly half the electricity cost.   If you buy MORE then 2 I'll do $900 each. I have 6 left. May be interested in trades for quads? dirt bikes? No more equipment. I have other items if interested. AC units, c02 tanks etc. Flood tables, Everything you need.", Model-W,,,
3103,1.0,hanford,https://fresno.craigslist.org/bik/d/clovis-beach-bike-for-sale-earth-cruiser/7466049543.html,2022-04-17 23:29,"3 Beach Bike, for sale Earth Cruiser", aluminum, cruiser,,,, 54,,,, 26 in,24,"3 bikes for sale Not using the bike Paid close to $599 for each from Earth Cruiser  But I am asking for fraction of the cost so, time to let it go blue $200 ( Sunbicycle)  Gray $220 ( Earth Cruiser)  Purple Bike $125 OBO (Earth Cruiser) ( Need some TLC) and paddles(Miss place it during moving)  Buy all 3 bikes and you will get the discount   Call 559  666 4075",,,,
3104,3700.0,hanford,https://slo.craigslist.org/mcy/d/san-luis-obispo-bmw-r1100gs-abs-3700-obo/7472605723.html,2022-04-17 22:11,BMW R1100GS w/ABS 3700 OBO,,,,,,,,,,,5,"1995 BMW R1100GS with ABS $3700 OBO.   Renewed Reg May 2023 Photos taken 04/20/2022.  Bike starts and runs, doesnt smoke under hard acceleration and makes decent power. Compression is fine. Can do a wheelie if you want and go 120mph, but realize it weighs 600lbs. She's a road warrior, not a BMX bike.   No tire kickers and garage princess folks. She's my little Rocinante Panzer Princess. Hopefully you are a person that understands why the BMW community loves this bike so much. I even got the Lenny Rocket Sprockets if you wanna install them in the future.  If you read everything below, this price is a steal (ill even say I sold it to you for $100).  If you know your way around a bike, especially BMW maintenance, you'll realize why this is a gem of a buy for you. Turnkey ready, mechanically sound, new fluids, pads, filters, fuses, solid tires, bright LEDs, new clutch, new upgraded metal head gaskets and new valve cover seals, new fuel injectors, heads recently serviced and timing set. You literally don't need to do anything but ride it. I'm forthcoming about anything on it, so just ask.   Bikes require regular maintenance, and usually only BMW mechanics will work on BMW bikes. So you either give them your arm and leg, or you do it all yourself. If you read below, I've shown you how easy it is to do yourself with detailed resources/videos/manuals/guides/schematics with detailed part numbers and more.  Please be a serious buyer and communicate with me to set a date to see it. I'm in the AG/Grover/Pismo area. Too many flakey people lately.    259 (R 850 GS, R 1100 GS) BMW R 1100 GS. Type Code: 0409 Produced 05/1994  This is all the info you will ever need for parts on this bike Ebay, Amazon, wherever. Schematics for all the parts and part numbers here: RealOEM.com. They have detailed photographs sectioned out for each part of the bike with part numbers as well as their compatibility with parts on newer models. My PDF manual, type a keyword and find the maintenance piece you need broken down in elaborate detail.   I love this bike immensely. Can carry a lot of stuff, great on mileage, handles beautifully. She’s like the hot girlfriend everyone can’t stop staring at. Loud guttural poppy engine, not meant for hauling ass like on a sport bike but great for all around travel (yes she can do a wheelie, but shes also like 500-600lbs). Regular compliments and stoke from enthusiasts all around. She is truly a tough and beautiful panzer. I am sad to see her go, but I need the money and have a truck already. I just hope you enjoy it as much as I have and give her the love I wish I could. Clean title in hand.  Mechanic owned, regular maintenance done and can provide you the mileage/photos/receipts of when it was all done so you can keep track too. She's got some paint flakes, scratches, etc, but she's Rocinante, total work horse.  Lot's of amazing spare parts, bolts, tools, and other useful stuff included below. I am going to be super thorough in here because I like selling things better than when I found them. Brake fluid, brake pads, and oil serviced less than 1k miles ago. All the mission critical stuff on it is pretty new so you don't have to do much other than oil changes.  $3700 OBO, cash-in-hand to ride. Read the whole listing here because there's a lot of awesome stuff I'm giving ya. Know this bike down to every nut and bolt, been riding BMW's for 10 years now.   Valid license and/or M1 License required (usually I'll take a photo of your license and you can have a friend with you stay with me while you ride it), I have a spare helmet and jacket if needed. If you drop it, you buy it although it has caging around the valve covers so it wouldn't be much of a big deal. I can ride to you or you can meet me somewhere in the area.   Perks  • Lots of key maintenance done and an entirely new clutch, she is looking for new adventures, still room for other fun projects. • Paper manual with photos and easily searchable pdf manual with drawn schematics included. • Tags recently renewed in CA. Good til May 2022. Insurance is $15 a month, it is amazing. Clean title in hand  • Nice adjustable windscreen • Digital Oil Temp, Gear Position, and Fuel Level Readouts • ABS system for safe breaking • Super Bright White LED lights • Cell phone mount for GPS • Passenger Seat Included • PIAA Fog Lights (helps a lot when you are out in the country) • Side/Back Carrying Cases with locks and keys with black reflector tape. You can fit an amazing amount of things in the cases and back of the bike with ropes/bunjee chords. Just did a big sur run with like 300lbs on it.  • Engine cage oilpan/protector and highway footrests • I have Lennie’s Rocket Sprockets but have not installed them yet ($250 shipped from AUS). Supposed to help with torque all around. Also helps with the slow torque response at higher speeds/RPM’s and gears. • SPARE set of cleaned cylinder heads/pushrods/rockers/valves/springs/camshafts/new valve stem seals, etc. I bought an extra pair off Ebay because a bolt broke.   • Spare functional stock fuel injectors, airbox rubber boots/grommets • Spare new PIAA Fog Light wiring harnesses/relay switch/fuse (they sent me two for some reason)  Key Maintenance/Parts/Upgrades • 53K: New rear main seal, new clutch kit from Bosch, all fluids flushed (drives, brake fluid, oil, etc), new rear brake pads, new AGM battery • 62K: New iridium single electrode spark plugs (Densos) • 62K: New continental alternator belt • 62K: New metal head and rubber gaskets/o rings etc from Athena, new valve stem seals and collets, piston and compression chambers thoroughly cleaned of all carbon deposits, valve timing set, oil changed • 62K: New upgraded Bosch V14 fuel injectors (4 pintels instead of one) used on newer R1200 models. • 62K: New Air Filter • 63K: 600mile valve maintenance follow up. Slackened head bolts retightened, valve timing readjusted (new oil and oil filter 20W50 motorcycle oil), throttle bodies resynched. • 63K: New ABS mirrors, new PIAA fog light relay/fuse/wiring • 63K: New starter • 64k front brake pads replaced and fluids flushed   Other stuff that is helpful • Most of the bolts are 3,4, 6, 8, 10mm with a pitch of 1.25 if you need a handful ever from a hardware store • Euromotoelectrics.com have most if not all the parts you ever need and can ship to you within two days easily. They are amazing people through and through. Way cheaper than BMW, quality service, quality parts, BMW Tigard sucks miserably so do not go there. • Beamerboneyard.com • RealOEM.com if you need to cross reference parts or need schematics of anything on the bike • Youtube: Chris Harris. This guy is amazing, if you need any video guides on how to do pretty much any thing on the bike this guy has you covered. • Forums and communities of enthusiasts for guides and help on anything you need: Advrider.com, BMWspourttouring.com, UKgser.com, Prelicanparts.com  Anyways, if you have any other questions just ask. Best, Joseph  BMW, Touring, Dual-Sport, Adventure, Funduro, Enduro, Oilhead, Boxer, Classic, Shaft Drive, Paralever, Flat-Twin, Motorrad",,,,
3105,10.0,hanford,https://bakersfield.craigslist.org/mpo/d/bakersfield-motorcycle-windscreen/7462983322.html,2022-04-17 19:49,"Motorcycle Windscreen Faring Bolts, New",,,, new,,,," Bodyworks, LLC",,,0,"This is a new box of Aluminum Universal Billet Complete Motorcycle Windscreen Faring Bolts Kit Fastener Clip Bodywork Screws Nut For CR125R CR250R, CR500R, CRF450, CRF250, CNC Aluminum. This kit is a common size on most bikes. The set includes socket head bolts, button head bolts, flange bolts, nylon removable rivets, nuts, fairing bolts with nylon washers, windscreen fasteners and more. Under the needs of mechanics and riders at the dealership and at the racetrack, this kit has premium factory style. 100% Brand New. Made from 6061-t6 Aluminum. Bolt motorcycle hardware meets or exceeds OEM specs. Easy to install. We have 10 sets. This kit retails on Amazon for $23.99, plus tax. Asking price is $10.00, each."," CR125R, 250R, 500R, CRF 450",,,
3106,120.0,hanford,https://santamaria.craigslist.org/bop/d/lompoc-raceface-full-size-tail-gate-pad/7472516621.html,2022-04-17 15:04,RACEFACE FULL SIZE TAIL GATE PAD,,,, new,,,, raceface,,,2,"Hi, have a new raceface tail gate pad for 5 bikes , full size trucks , new in the plastic , thanks for Looking. eight055883569", pad," racks, fenders, bags",,
3107,1.0,hanford,https://slo.craigslist.org/bop/d/paso-robles-launch-ramps/7472515256.html,2022-04-17 14:59,Launch ramps,,,,,,,,,,,0,"Two 5 foot""5 launch ramps and 1 4 foot launch ramp. Fair condition can be used as is. I used them for my mountain bikes. They are really fun, smooth kickers. I'm relocating and can't take them with.",,,,
3108,175.0,hanford,https://slo.craigslist.org/bik/d/san-luis-obispo-road-commuter-paperboy/7451545271.html,2022-03-19 09:06,Road/Commuter/Paperboy Bikes, steel, road,,,, 15” - 63cm,,,, 700C,8,"Road and shopping bikes built up to spec: please provide your height, expected cycling distances, and budget to help me determine what may suit you well.  Over thirty years’ experience.",,,,
3109,250.0,hanford,https://santamaria.craigslist.org/bik/d/lompoc-bicycles/7472506069.html,2022-04-17 14:28,Bicycles, aluminum, bmx,,,, All sizes,,,, 20 in,0,Selling 2 brand new 2021 Redline MX Junior BMX racing bicycles with full factory warranty. These are super lite fast bikes. They list for 465.00. I'm selling my last two bikes for 250.00 each. Call Steve at 80 five 717-0 one 47 These are priced below wholesale while they last.,,,,
3110,8000.0,hanford,https://fresno.craigslist.org/mcy/d/fresno-big-dog-mastiff-06/7472500635.html,2022-04-17 14:07,Big Dog Mastiff 06,,,,,,,,,,,2,Big Dog Chopper 06 Mastiff. 117 S&S Super. 6 speed. Great condition. New clutch. New starter. New electronic compression releases. These bikes are becoming very rare and may never see built again (Collector)! Clean fast head turner!!,,,,
3111,1900.0,hanford,https://bakersfield.craigslist.org/bik/d/delano-schwinn-stingray-fastback-speed/7461566188.html,2022-04-17 10:12,Schwinn Stingray Fastback 3 Speed, steel, cruiser,, good,, 20 inch,, Schwinn,, 20 in,4,"1971 Schwinn stingray fastback. 3 speed stik shifter. Original paint. Reupholstered seat cover. The OG chrome wheels hubs been degreased and lubed, running smooth. Everything is all original except for the newer mag rims.  I still have the original S-5 rims (mounted new tires) aswell as the original old cracked tires, and pedals.  These bikes are hard to find. If your a serious buyer maybe we can make a deal.  Text 66one.270.7one03 Serious inquiries only. Willing to trade. (Equal value)", stingray fastback,,,
3112,1.0,hanford,https://slo.craigslist.org/for/d/paso-robles-huge-parking-lot-sale-and/7472296434.html,2022-04-16 21:17,Huge parking lot sale and BBQ,,,,,,,,,,,0,,,,,
3113,475.0,hanford,https://bakersfield.craigslist.org/snw/d/bakersfield-dirt-bike-50cc-new/7472266475.html,2022-04-16 18:25,Dirt Bike 50cc (New),,,,,,,,,,,5,Brand New Automatic 50cc Dirt Bikes great for Ages 5 and Up! It goes 45-50 Mph and has a weight capacity of 220 pounds. I’m asking ($475 Each) Better deal if you purchase more than one! Serious buyers only thanks!!!,,,,
3114,160.0,hanford,https://fresno.craigslist.org/bop/d/fresno-or-bike-hitch-mount-carrier/7472248765.html,2022-04-16 17:14,4 or 2 Bike Hitch Mount Carrier,,,,,,,,,,,3,"4 or 2 Bicycle 2"" receiver hitch bike carrier Will hold all style bicycles and sizes not just bikes with a top bar Very secure fastening system  $160 Firm - Cash only  Text is best - Can see most anytime  559-433-57three7",,,,
3115,1.0,hanford,https://fresno.craigslist.org/wto/d/fresno-wanted-5x5-5x127-used-wheels/7472241519.html,2022-04-16 16:48,wanted 5x5.  5x127  Used wheels tires custom for my Astro Van,,,,,,,,,,,0,also fat collection trade cars bikes trikes trailers avail ...,,,,
3116,5250.0,hanford,https://slo.craigslist.org/cto/d/arroyo-grande-1994-ford-250/7472228509.html,2022-04-16 16:02,1994 Ford F-250,,,,,,,,,,,0,,,,,
3117,160.0,hanford,https://slo.craigslist.org/bik/d/grover-beach-16-boy-girl-raleigh-rowdy/7472225150.html,2022-04-16 15:57,16” boy/girl Raleigh Rowdy mountain style bike,,,,,,,,,,,0,,,,,
3118,15.0,hanford,https://fresno.craigslist.org/bop/d/fresno-seven-bicycles/7469584893.html,2022-04-16 15:13,Seven  bicycles,,,, excellent,,,,,,,4,Phone or text only,,,,
