,Price,Location,URL,Date,Title,bicycle frame material,bicycle type,condition,frame size,wheel size,num image,text,make / manufacturer,model name / number,electric assist,brake type,handlebar type,suspension,engine hours (total),length overall (LOA),propulsion type,year manufactured,paint color,size / dimensions,serial number
4121,2375.0,redding,https://redding.craigslist.org/trb/d/santa-fe-springs-single-rail-motercycle/7465237898.html,2022-03-31 09:20,Single Rail Motercycle Trailer Folds For Storage,,, new,,,16,"Tow Smart Trailers / SINGLE RAIL MOTORCYCLE TRAILER* -- !   ☎ Call: (562) 788-0416  📱 Text  (562) 788-0416     For more details, pictures and information on this Tow Smart Trailers* SINGLE RAIL MOTORCYCLE TRAILER* , Paste the link below into your browser:   https://towsmarttrailers.com/products/foldable-motorcycletrailer    Total Prices? Price of Trailer with Silver Mag wheels starts at $2375.00 + Tax Shipping cost Starts at $499      https://towsmarttrailers.com/products/foldable-motorcycletrailer     Trailer Information:   Bikers love their bikes. Sounds pretty obvious doesn't it? But by the looks of some of the trailers we've seen hauling these prized motorcycles around, you might not be so sure. That's where we come in.Your bikes deserve a trailer that's worthy to haul it. A trailer that's built right, with quality parts and killer looks too.    Our SINGLE rail motorcycle trailer Independent torsion-axel design makes it easy to maneuver and even simpler to store. Mag wheels, chocks, a ramp and radial tires are standard. The finish is powder coated for maximum durability!    But the best part is, it's fully adjustable to carry up to 1 sport bikes or 1 baggers or 1 bike OR 1,000LB!    We look forward to providing you with a motorcycle trailer you'd be proud to haul your bike on! FEATURES:   Folds for easy storage - reduces in size from 105’’ to 83’’ Wide channel rail accommodates vast range of tire sizes Transports Goldwing motorcycles, Harley-Davidson, cruisers, sport bikes, and more* 13″ Aluminum wheels - STANDARD Radial tires - STANDARD Diamond tread plate floor Lightweight tubular frame (325 lbs. empty weight)  3-piece ride-up loading ramp  integrated wheel chocks Folds for easy storage  Wide channel rail accommodates vast range of tire sizes Transports Goldwing motorcycles, Harley-Davidson, cruisers, sport bikes, and more*   SPECIFICATIONS  Trailer Deck Dimensions: 35’’ W x 84’’ L - Diamond Shape - Rounded Square Rear Clearance to the Top of the Deck: 13’’ H Tailgate Length: 32’’ L Folded Length: 85’’ L (from tip of coupler to end of folded bed) Overall Extended Length: 117’’ L (from front of coupler to end of open trailer bed) Overall Width: 72’’ W (outside fender to fender) Overall Width: 54’’ W (inside fender to fender) Height: 27’’ Maximum Motorcycle Length: 98’’ L (from motorcycle’s front tire to its rear axle) Trailer Deck Type: Aluminum Diamond Tread Plate 3-Piece Loading Ramp Overall dimensions: 33’’ W x 42.5’’ L Outside ramps (2): 11’’ W x 42.5’’ L Center ramp (1): 11’’ W x 42.5’’ L Hitch: Class 2 or Higher Hitch Height: 21’’-22’’ Ball Size: 2’’ Tire Size: ST175/80R13 Radial Tire Wheel: 13” Aluminum Split Spoke Air Pressure: 50 cold psi Suspension Independent Torsion Axle Suspension Mounts Double Mounting Brackets Empty Weight: 300lb Maximum Load Capacity: 1000lb Frame Material: Steel Tubing Finish: Powder Coated  Contact German: 562-788-0416  https://towsmarttrailers.com/products/foldable-motorcycletrailer     *Conveniently located and at affordable rates. *            2022 Tow Smart Trailers / Single Rail bike  trailer☎ Phone Number: (562) 788-0416              📱 Text Number: (562) 788-0416    Disclaimer: Prices may vary from region to region, as will incentives, and are subject to change without notice. The publisher assumes no responsibility for errors and/or omissions contained within and makes no representations, expressed or implied, to any actual or prospective purchaser of this trailer or truck body, its specifications, or price. Inventory information is compiled from publicly available sources and may vary. All inventory item prices exclude tax, title, and registration fees; and may exclude dealership service fees and finance charges. Please contact the store for more information.                Moto trailer motorcycle baja dirt bike quad toy hauler towing trailer  Bike hauler camping trailer enduro Ducati harley trailer Zieman droptail this is not a kendon motorcycle stand up trailer carson trailer toy hauler towing. off road monster ninja cb honda cbr r1 r6 r1000 thisn is not a kendon stand up trailer quad trailer toy hauler towing trailer quad atv utility trailer camping hauler carrier trailer camping trailers motorcycle trailers atv trailers car dolly small camping trailers motorcycle trailers for sale camping trailers for sale car dolly for sale atv trailers for sale motorcycle pull behind trailers off road camping trailers used camping trailers used motorcycle trailers used motorcycle trailers for sale atv pull behind trailers enclosed motorcycle trailers small camping trailers for sale car wheel dolly lightweight camping trailers pull behind motorcycle trailers car tow dolly for sale motorcycle camping trailers enclosed motorcycle trailers for sale motorcycle camper trailers motorcycle cargo trailers pop up camping trailers atv utility trailers used car dolly for sale car dolly straps used camping trailers for sale teardrop camping trailers compact camping trailers car towing dolly motorcycle trailers enclosed vintage camping trailers for sale tiny camping trailers vintage camping trailers small trailers for camping car seat dolly pull behind motorcycle trailers for sale aluminum motorcycle trailers aluminum atv trailers motorcycle tent trailers atv hauler trailers used car tow dolly for sale car dolly rentals car dolly trailer used motorcycle pull behind trailers for sale custom motorcycle trailers coleman camping trailers jayco camping trailers 4x4 camping trailers aluminum cargo trailer used atv trailers used enclosed motorcycle trailers for sale tow car dolly best camping trailers used car dolly master tow car dolly dolly car used pull behind motorcycle trailers for sale retro camping trailers open motorcycle trailers motorcycle hauling trailers enclosed atv trailers used atv trailers for sale motorcycle chocks for trailers car dolly parts 2 wheel car dolly two wheel car dolly car body dolly best small camping trailers cheap camping trailers light camping trailers custom camping trailers used pull behind motorcycle trailers haulmark motorcycle trailers aluminum atv trailers for sale atv dump trailers garage car dolly hydraulic car dolly folding camping trailers camping trailers small hybrid camping trailers trailers camping ultralight camping trailers trailers for camping aluma motorcycle trailers cheap atv trailers car dolly for sale used demco car dolly rv car dolly luxury camping trailers small trailers camping motorcycle cargo trailers for sale folding motorcycle trailers featherlite trailers motorcycle trailers kendon motorcycle trailers trailers for atv motorcycle trailers used light weight camping trailers micro camping trailers tractor supply atv trailers car tire dolly heavy duty car dolly car towing dolly for sale off road camping trailers for sale extreme camping trailers car dolly fenders acme car dolly camping tent trailers harley davidson motorcycle trailers camping travel trailers camping trailers used motorcycle camp trailers lite camping trailers aluminum camping trailers camping pop up trailers starcraft camping trailers used teardrop camping trailers offroad camping trailers used motorcycle cargo trailers for sale tow behind motorcycle trailers motorcycle pull behind trailers for sale fold up motorcycle trailers cheap motorcycle trailers aluminum motorcycle trailers for sale motorcycle enclosed trailers featherlite motorcycle trailers single motorcycle trailers small motorcycle trailers custom enclosed motorcycle trailers off road atv trailers atv enclosed trailers polar atv trailers used enclosed motorcycle trailers motorcycle camper trailers for sale used car tow dolly car dolly plans motorcycle travel trailers best motorcycle trailers used motorcycle camping trailers for sale all aluminum cargo trailer old camping trailers tiny trailers for camping atv camping trailers rv camping trailers popup camping trailers tent camping trailers camping trailers for motorcycles airstream camping trailers scamp camping trailers motorcycle camping trailers for sale featherlite camping trailers used motorcycle pull behind trailers motorcycle transport trailers motorcycle trailers with living quarters used motorcycle trailers enclosed motorcycle pull trailers lightweight motorcycle trailers motorcycle tow behind trailers custom atv trailers enclosed fiberglass motorcycle trailers bushtec motorcycle trailers small car camping trailers cheap car dolly stehl car dolly new camping trailers enclosed atv trailers for sale atv utility trailers for sale used enclosed atv trailers cheap motorcycle trailers for sale used motorcycle camper trailers used folding motorcycle trailers used motorcycle tent trailers for sale camping cargo trailers atv utv trailers stehl tow car dolly zieman atv trailers best atv trailers vintage camping trailers sale car caddy dolly car frame dolly car dolly prices small lightweight camping trailers camping trailers for sale used fiberglass camping trailers single wheel motorcycle trailers motorcycle trailers pull behind motorcycle trailers houston fiberglass motorcycle trailers motorcycle tag along trailers motorcycle towable trailers trailers motorcycle covered motorcycle trailers trailers for motorcycle trailers atv atv hauling trailers side load atv trailers motorcycle trailers for sale used car dolly towing car caddy tow dolly motorcycle trailers rentals chariot motorcycle trailers motorcycle trike trailers motorcycle teardrop trailers kendon motorcycle trailers for sale motorcycle enclosed trailers for sale apache camping trailers car dolly wheels car dolly tie down straps haulmark motorcycle trailers for sale camping utility trailers used small camping trailers for sale used scamp camping trailers folding motorcycle trailers sale utility trailers for atv car trailer dolly echo atv trailers pop up camping trailers for sale trailers to pull behind atv pull behind atv trailers shasta camping trailers very small camping trailers old kendon stand up camping trailers for sale cheap atv trailers for sale small atv trailers keystone camping trailers roadmaster car dolly diy camping trailers iron horse motorcycle trailers aluminum car dolly towmaster car dolly motorcycle car dolly casita camping trailers lightweight camping trailers for sale car dolly tire straps 5th wheel camping trailers camping trailers manufacturers cargo camping trailers bunkhouse motorcycle camping trailers small camping trailers sale motorcycle utility trailers motorcycle pull behind cargo trailers single wheel motorcycle cargo trailers wells cargo motorcycle trailers motorcycle touring trailers motorcycle towing trailers atv aluminum trailers motorcycle tow trailers atv off road trailers atv tow behind trailers triton atv trailers motorcycle camping trailers used car tow dollys towing car dolly tow dolly car motorcycle rv trailers buy car dolly camping trailers parts car tow dolly rentals covered motorcycle trailers for sale motorcycle tent trailers for sale used motorcycle camper trailers for sale tow car dolly for sale car tow dolly kendon single rail stand up trailer motorcyclle trailer  straps car tow dolly for sale used rv car tow dolly motorcycle car tow dolly how to build a car tow dolly motorcycle trailers for dogs motorcycle rail for trailers used motorcycle camping trailers folding motorcycle trailers for sale car camping trailers cheap camping trailers for sale atv camp trailers aluminum enclosed motorcycle trailers harley davidson motorcycle trailers for sale renting camping trailers aluminum open motorcycle trailers motorcycle trailers san diego motorcycle luggage trailers motorcycle rails for trailers toy hauler camping trailers rv motorcycle trailers atv trailers houston aluma motorcycle trailers for sale atv camper trailers motorcycle dog trailers solar panels for camping trailers teardrop camping trailers for sale tear drop camping trailers atv hunting trailers not a kendon stand up trailer adventure camping trailers aluminum cargo trailer manufacturers phoenix motorcycle trailers used jayco camping trailers forest river camping trailers atv dump trailers for sale motorcycle pet trailers used motorcycle tent trailers used airstream camping trailers tandem car dolly roadmaster motorcycle trailers classic camping trailers towable motorcycle trailers atv wagon trailers atv log trailers a frame camping trailers car dolly trailer for sale dolly car trailer folding camping trailers for sale 4x4 camping trailers for sale tab camping trailers wilderness camping trailers expandable camping trailers car dolly casters motorcycle pop up trailers small camping trailers used utility atv trailers atv cargo trailers camping trailers brisbane camping trailers melbourne camping trailers prices car dolly used car tow dolly plans acme trailer eze-tow car dolly pull behind trailers for atv fema camping trailers atv trailers used atv transport trailers atv logging trailers", TOWSMART TRAILERS,,,,,,,,, 2022, black,,
4122,2500.0,redding,https://redding.craigslist.org/boa/d/palo-cedro-kawasaki-750sx/7454860247.html,2022-03-30 15:52,kawasaki 750sx,,,,,,2,"standup jetski for sale  750cc single carb,  ski starts up and seems to run good  but has not been in the water for a few years, comes with extra jet parts and hull,  has aftermarket steering unit shorter aluminum pole skat prop  few other mods,  i have title, maybe interested in trading for other skis, no seadoo's........   also interested in quads and dirt bikes,  or shoot me an offer if you have cash, please don't waste my time with lowball bs... ,339..2255...will get some pics soon..",,,,,,,, 7, power,,,,
4123,9200.0,redding,https://redding.craigslist.org/mcy/d/redding-2016-honda-africa-twin-dct/7464966750.html,2022-03-30 14:01,2016 Honda Africa Twin DCT,,,,,,6,"Purchased the bike Oct of 2021. My first on-off road of the many street bikes Ive owned. The last months I have commuted and tried a few fire roads and I love every aspect of this bike including the spectacular DCT system. The one flaw for me is that if I drop this while riding alone I don't think I would be able to pick it up. I am 60 and will need something lighter to continue this new style of riding. This bike has all of the Givi off-road equipment and heated grips, moose shield, foot peg guard, center stand, throttle lock, never used Tusk panniers, Givi trunk, Givi tank bag, bar risers, new chain/sprockets and major services completed. No issues with the bike. Would trade for the right KTM 690r enduro.",,,,,,,,,,,,,
4124,1.0,redding,https://redding.craigslist.org/mcd/d/san-diego-r1-r6-cbr-600-gsxr-600-gsxr/7464522363.html,2022-03-29 13:05,R1 R6 CBR 600 GSXR 600 GSXR 1000 Hayabusa Vulcan S ZX6R SHADOW,,,,,,5,"OUR WEBSITE IS AKMOTORCYCLES.COM TO SEE OUR ENTIRE USED INVENTORY GO TO OUR WEBSITE : )   ⭐⭐We have over 150 used motorcycles in stock⭐⭐ ⭐⭐NATIONWIDE DELIVERY AVAILABLE⭐⭐ ⭐⭐⭐⭐NO HIDDEN DEALER FEES⭐⭐⭐⭐ ⭐ALL CREDIT LEVELS FINANCING AVAILABLE⭐  Please go akmotorcycles.com to see our current inventory and apply for financing directly on our website.  All listed inventory is subject to prior sale, we recommend calling to confirm availability.  To visit our showroom, contact us today to see our premier selection of pre-owned motorcycles in person. AK Motors is located in El Cajon San Diego California, offering convenient access from the South Bay and beyond.  AK MOTORS Call or Text us today at: ☎ Call: (619) 550-4419 📱 Text: (619) 550-4419  ⭐⭐⭐⭐⭐⭐⭐⭐⭐⭐⭐⭐⭐⭐⭐⭐⭐⭐⭐⭐⭐⭐⭐⭐⭐⭐⭐⭐⭐⭐⭐⭐⭐  We carry a wide array of used motorcycles for sale, including all of the Japanese brands: Honda, Kawasaki, Suzuki, and Yamaha along side others like BMW and KTM. With our comprehensive selection of motorcycles, we will find the right bike for any rider level and discipline from cruisers, standard and naked motorcycles, sport touring, adventure, dual sport to full blown super-sport bikes.  Whether it’s the famous Kawasaki Ninja 300, Ninja 400, Ninja 650, Z650, Honda CBR300R, CB300F, CBR500R, Yamaha R3, FZ6R, the FZ07 or any of the top of the line super sport bikes such as the Honda CBR600RR, Kawasaki Ninja ZX6R, Suzuki GSXR 600, GSXR 750, or Yamaha R6. We also carry cruisers like the Kawasaki Vulcan S, Honda Rebel, Shadow Phantom, Honda Fury, and the Yamaha Bolt. If you’re into bigger bikes, we also carry the Yamaha R1, FZ09, FZ10, Suzuki GSXR 1000, Hayabusa GSX1300R, Kawasaki ZX10R, ZX14R, Ninja 1000, the Z1000, and the incredible BMW S1000RR.  You can buy with confidence knowing every motorcycle that we sell undergoes a full safety inspection to ensure it is in proper running order. We also purchase used motorcycles. Don’t want to deal with the hassle of selling a used motorcycle? Stop by our El Cajon San Diego showroom to get a free, on the spot purchase estimate. Come with the bike & title to leave with a check.  ⭐⭐⭐⭐⭐⭐⭐⭐⭐⭐⭐⭐⭐⭐⭐⭐⭐⭐⭐⭐⭐⭐⭐⭐⭐⭐⭐⭐⭐⭐⭐⭐⭐",,,,,,,,,,,,,
4125,3000.0,redding,https://redding.craigslist.org/grd/d/redding-stunning-35inch-miniature-horse/7463724293.html,2022-03-27 14:42,Stunning 35inch miniature horse,,,,,,6,"Absolutely darling 35 inch tall miniature gelding.   ""Tito"" is approx 10 years old, ground drives, is broke to lead line, ponies, longes and yield both ends, moves off pressure, ties, clips, bathes, loads, and is pretty much unflappable out and about. I can shop vac him, blow dry him (with a leaf blower), hundreds of miles of trail experience. He crosses water, rocks, hills, brush, streets, boulders, logs, bridges. Tons of exposure to bikes, dogs, heavy equipment, traffic, horses, disc golf! Basically he has seen it all. Trash and debri doesn't phase him. Adores to go out and explore. Unfortunately my life has gotten to busy for him and he has just been sitting lately. Would love to find a trail or companion home for this strinking little guy.   3k firm home check and references will be required. He is UTD on shots, worming, fecal, dental, trim, and sheath cleaning. He is just a super cool kind dude 😎",,,,,,,,,,,,,
4126,1200.0,redding,https://redding.craigslist.org/mpo/d/palo-cedro-1972-kawasaki-mt75/7472981109.html,2022-04-18 17:09,1972 Kawasaki MT75,,,,,,0,,,,,,,,,,,,,,
4127,1400.0,redding,https://redding.craigslist.org/bik/d/weaverville-marin-hawk-hill/7472934926.html,2022-04-18 15:11,Marin Hawk hill 2,,,,,,0,,,,,,,,,,,,,,
4128,4500.0,redding,https://redding.craigslist.org/mcy/d/millville-2004-ktm450/7472844496.html,2022-04-18 12:04,2004 ktm450,,,,,,2,Nice bike runs good. Check it out if this is what your looking for you will enjoy. I’m Ben 530-410-9870,,,,,,,,,,,,,
4129,20.0,redding,https://redding.craigslist.org/mpo/d/redding-shinko-front-tire/7472841908.html,2022-04-18 12:04,SHINKO FRONT TIRE,,,,,,2,SHINKO HEAVY DUTY SR777.              80/90-21 FRONT TIRE I bought for my Kawasaki valcan custom but sold bike new still in package $20,,,,,,,,,,,,,
4130,100.0,redding,https://redding.craigslist.org/spo/d/anderson-roadmaster-mountain-bike/7470098669.html,2022-04-18 11:50,Roadmaster mountain Bike,,,,,,2,roadmaster mountain sport 18 speed womans bicycle bike good condition,,,,,,,,,,,,,
4131,6000.0,redding,https://redding.craigslist.org/mcy/d/redding-2017-honda-crf-450x/7472784320.html,2022-04-18 10:16,2017 Honda CRF 450X,,,,,,5,"Honda CRF 450X 4 stroke, electric start and kick start, one ride on new tires, new chain, new sprocket, and new Renthal bars. Great bike and very fast!  $6000 obo I bought a side by side and don’t use it anymore.   Located in Redding Matt",,,,,,,,,,,,,
4132,100.0,redding,https://redding.craigslist.org/bik/d/palo-cedro-schwinn-skyliner-bicycle/7472588553.html,2022-04-17 20:06,Schwinn Skyliner Bicycle, alloy, mountain,, Large, other/unknown,4,"Schwinn Skyliner Mens Bicycle. In good shape. Rides great. Unsure of bike size, but fits 5’11”-6’6” very well. Has been in storage - needs a little TLC.  $75 obo.", Schwinn, Skyliner,,,, suspension fork (hardtail),,,,,,,
4133,15.0,redding,https://redding.craigslist.org/bop/d/redding-bike-stuff/7472574179.html,2022-04-17 18:51,bike stuff,,,,,,0,,,,,,,,,,,,,,
4134,400.0,redding,https://redding.craigslist.org/bik/d/proberta-dolce-specialized-bike/7472556138.html,2022-04-17 17:32,Dol'Ce Specialized Bike Enhanced Butted Aluminum, aluminum, track, good, Not sure, 20 in,2,"Dol'Ce Specialized Bike, asking $400 obo call or txt my name is Candy at 8four0-seven6eight3",,,,,,,,,,,,,
4135,20.0,redding,https://redding.craigslist.org/mpo/d/mount-shasta-afx-helmets-for-sale/7464206039.html,2022-04-17 16:12,AFX Helmets for SALE,,, good,,,14,"Two AFX Freedom design motorcycle helmets for sale.    I no longer own a bike.  My loss, perhaps your gain.    They are Kyo Loku designed helmets.  They are in nearly ""new"" condition.  See the photos.  The FX 3 II is medium (7 1/4 - 7 3/8) size.  The FX - 7 is a small  (7 - 7 1/8) size.    These helmets sell for upwards of 60.00 each.  Would like to sell as a pair.  Therefore....$20.00 each or BOTH for $30.00", AFX Helmets, Freedom FX 3II,,,,,,,,,,,
4136,300.0,redding,https://redding.craigslist.org/bik/d/redding-early-rider-belter-16-kids-bike/7472526846.html,2022-04-17 15:40,"Early Rider Belter 16"" Kids Bike", aluminum, kids,," 16""", 16 in,0,See link to learn more about this bike. Cash only please and text if you're interested.   https://us.earlyrider.com/products/belter-16, Early Rider, Belter 16,,,,,,,,,,,
4137,40.0,redding,https://redding.craigslist.org/bop/d/redding-trunk-mount-bike-rack/7463408578.html,2022-03-26 16:55,Trunk mount bike rack,,,,,,0,Yakima trunk mount bike rack for 2 bikes. I don't know model number but it worked with a Honda Civic and a Miata., Yakima,,,,,,,,,,,,
4138,950.0,redding,https://redding.craigslist.org/bik/d/redding-specialized-roubaix-carbon-road/7467846852.html,2022-04-17 11:54,Specialized Roubaix Carbon Road Bike,,,,,,0,,,,,,,,,,,,,,
4139,250.0,redding,https://redding.craigslist.org/for/d/redding-workout-bike/7461254305.html,2022-04-17 11:44,Workout Bike,,,,,,2,Pro form stationary cycling bike. Works great. We switched out the original seat with a 60 dollar gel seat. 250 obo.,,,,,,,,,,,,,
4140,1900.0,redding,https://redding.craigslist.org/bik/d/chico-specialized-camber-fs-carbon/7470765427.html,2022-04-17 09:55,Specialized Camber FS carbon fiber mtn bike lots of extras/add ons,,,,,,0,,,,,,,,,,,,,,
4141,5950.0,redding,https://redding.craigslist.org/mpo/d/shingletown-1989-harley-davidson-xlh/7466465979.html,2022-04-17 08:30,1989 Harley Davidson XLH 1200 GANGSTER ROAD KING,,, excellent,,,14,"1989 Harley Davidson XLH 1200 EVOLUTION Gangster Bars With Racing Ignition, NEW Carb, Dialed in by HD Redding, Customized to ROAD KING  I have installed turn signals from a 1965 FLH in place of the small turn signal shown in the you-tube video.  Selling Entire Bike Collection, Retiring  SEE YOU TUBE VIDEO:  1989 Harley Davidson XLH 1200 EVOLUTION https://www.youtube.com/watch?v=rx9mGgFql88  EMAIL IS PREFERRED, OVER ASKING ME TO CALL YOU OR TEXT YOU, THANK YOU  SORRY,NO TRADES. CASH or PAYPAL. I will assist with your Shipper. Ride On.....", HarleyDavidson, XLH 1200 SPORTSTER,,,,,,,,,, 6x5x3,
4142,9050.0,redding,https://redding.craigslist.org/mpo/d/redding-2022-husqvarna-fc-450-rock-star/7472367070.html,2022-04-17 07:41,2022 Husqvarna FC 450 Rock Star Edition,,, like new,,,3,2022 Husqvarna FC 450 RockStar Edition... Very Low Hrs 30 FMF Pipe Factory Wheels Pro Taper Bars Maping Controls   show contact info    2022 Husqvarna FC450 Factory edition. Only 400 were ever being made to be sold to the public this bike is rare.   The first owner took care of the bike very meticulously!  I am the 1st owner.... title and registration are in my name. $9050  Parts on bike: - Hinson clutch cover - Factory wheel set - Factory Husqvarna Triple clamp - FMF Carbon Fiber silencer - Composite Subframe,,,,,,,,,,,,,
4143,50.0,redding,https://redding.craigslist.org/mpo/d/redding-60s-70s-80s-honda-motorcycle/7463205687.html,2022-03-26 09:30,60s 70s 80s Honda Motorcycle parts,,,,,,0,"Lots and lots of small bore honda parts ct90 trail 90 ct70 z50 cl 175 160 sl st cb 350 and 750 parts..tons of random bits, harley exhaust, engines xr xl frame atc parts and bikes.  Text is best since it helps weed out scammers thanks!",,,,,,,,,,,,,
