,Price,Location,URL,Date,Title,condition,make / manufacturer,model name / number,num image,text,bicycle frame material,bicycle type,frame size,wheel size,part type,serial number,suspension,brake type,handlebar type,electric assist,size / dimensions
5648,35.0,cosprings,https://cosprings.craigslist.org/sgd/d/colorado-springs-rexpid-broadheads/7471521675.html,2022-04-15 05:39,REXPID BROADHEADS, new, REXPID, NURI,3,"BOWHUNTERS EDGE IS PROUD TO REPRESENT REXPID AND THEIR LINE OF SHOOT LIKE  FIELD TIP BROADHED LINE.  NEVER BEFORE HAS THERE BEEN A BROADHEAD THAT FLYS AS ACCURATELY S REXPID BROADHEADS ND THEY ARE BSOLUTELY DEVASTATING BOTH FIXED BLADES AND EXPANDABLES. TOTALLY NEW DESIGNS ND TECHNOLOGY..CHECKN THEM OUT ON LINE AND GET YOUR TODY AT BOWHUNTERS EDGE  THE NURI IS CURRENTLY ARE BEST SELLER..GREAT ENTRY AND EXITS HOLES AND SUPER ACCURATE DEVASTATING BROADHEAD PIERCING FLESH AND BONES MULTIPLE HARVESTS IN 2019 BY OUR CUSTOMER USING THESE AMAZING BROADHEADS   EXCLUSIVELY AT BOWHUNTERS EDGE ARCHERY, COLORADO'S PREMIER BOWTECH/DIAMOND AUTHORIZED DEALER. CALL AND ASK FOR ROB OR STEVE TODAY.  ASK ABOUT OUR MILITARY AND VETERAN'S DISCOUNT PROGRAM!!!  BOWHUNTERS EDGE 3812 E PIKES PEAK AVE STE 217 COLORADO SPRINGS, COLORADO 80909 719-597-7774 (N.E CORNER OF PIKES PEAK AND ACADEMY BLVD)  VISIT US ON THE WEB AT bowhuntersedge.com  VISIT US ON FACEBOOK AT BOWHUNTERS EDGE COLORADO SPRINGS FACEBOOK    The Best Bows are Made not by Hoyt, Mathews, Bear, PSE, Diamond, Martin, Prime, Quest, Mission, Obsession, Struthers, Elite, but are made for the Best Archers By BOWTECH and are offered in colorado springs and southern colorado by BOWHUNTERS EDGE,home to the best archery equipment and bows in colorado springs! ""We Refuse To Follow"" HUNTING, FISHING, ATV, ARCHERY, FIREARMS, GUNS, HORSES MOUNTAIN BIKES, FOUR WHEEL DRIVE TRUCKS..IF YOU CAN DO THESE YOU CAN SHOOT A BOW. SPEED BOW, FAST BOW. THE BEST BOW ON THE MARKET. IF YOU ARE A BRONCOS FAN WE EVEN HAVE LONG BOWS, RECURVE BOWS, COMPOUND BOWS, ARROWS, RELEASES AND MORE, VAPOR TRAIL, PRO V REXPID, NURI",,,,,,,,,,,
5649,399.0,cosprings,https://cosprings.craigslist.org/sgd/d/colorado-springs-diamond-infinite-305/7471521551.html,2022-04-15 05:38,DIAMOND INFINITE 305, new, DIAMOND, INFINITE 305,0,"THE NEW DIAMOND INFINITE 305, THE NEWEST BOW IN A THE INFINITE SERIES , THE BEST SELLING BOW IN AMERICA.  IDEAL FOR BEGINNERS AND YOUTH, AS IT IS DESIGNED TO GROW WITH THE SHOOTER. The leader in ease of use, versatility and adjustability now features premium performance, that other bows can’t touch at a price too good to pass up. As with the entire Edge Series, the adjustability of the Edge 320 makes it the perfect bow for the beginning and experienced archer alike, with the ease of tunability that only the Synchronized Binary Cam System offers. Looking for a little extra punch? The Edge 320 generate 320 FPS of game-stopping power to take on any hunting challenge.  The Edge 320 is the only choice for premium performance without the shot to your wallet.  SPECS DRAW LENGTH - 15-31” DRAW WEIGHT - 7-70 LBS SPEED - 320 FPS BRACE HEIGHT - 7 1/4” AXLE TO AXLE - 32” MASS WEIGHT - 3.6 LBS EFFECTIVE LET-OFF - 85%     The Best Bows are Made not by Hoyt, Mathews, Bear, PSE, Diamond, Martin, Prime, Quest, Mission, Obsession, Struthers, Elite, but are made for the Best Archers By BOWTECH and are offered in colorado springs and southern colorado by BOWHUNTERS EDGE,home to the best archery equipment and bows in colorado springs! ""We Refuse To Follow"" HUNTING, FISHING, ATV, ARCHERY, FIREARMS, GUNS, HORSES MOUNTAIN BIKES, FOUR WHEEL DRIVE TRUCKS..IF YOU CAN DO THESE YOU CAN SHOOT A BOWRecurves, Long Bows, Compound Bows , strings, releases and bows for Bronco fANS, USED COMPOUND BOWS, INFINITE 320",,,,,,,,,,,
5650,159.0,cosprings,https://cosprings.craigslist.org/sgd/d/colorado-springs-vapor-trail-pro-arrow/7471521245.html,2022-04-15 05:36,VAPOR TRAIL PRO V ARROW REST, new, VAPOR TRAIL, PRO V,0,"BOW HUNTERS EDGE SPECIAL EDITION VAPOR TRAIL PRO V ARROW REST IS BY FAR OUR BEST SELLING ARROW REST AND IN 2017 IT GOT EVEN BETTER WITH THE INTRODUCTION OF VAPOR TRAILS NEW SHAG PAD ARROW HOLDER  New for 2018 is a streamlined universal main bracket for added strength and rigidity. We also incorporated a newly contoured bumper for increased noise reduction and longevity.  The Limb Driver Pro-V climbed it's way to the top of list, winning the Bowhunting World Reader's Choice GOLD Award for 2014 and SILVER in 2015. Our customers have spoken. Now it's your turn find out what all of our customer's are talking about.  The Pro-V revolutionized the archery industry by becoming the first ever limb driven rest with a full-capture option, an adjustable spring tension, and free-floating launcher arm. By supporting the arrow for 70% of the shot cycle, the Pro-V allows the arrow to reach the speed needed to stabilize itself before being pulled away, adding an obvious increase in accuracy and performance, especially downrange. During this support, the free-floating launcher arm and adjustable spring-tension pair up allowing the archer to fine-tune the performance even further to their liking   BOWHUNTERS EDGE SPECIAL EDITION VAPOR TRAIL PRO V AVAILABLE IN COLORADO SPRINGS EXCLUSIVELY AT BOWHUNTERS EDGE ARCHERY, COLORADO'S PREMIER BOWTECH/DIAMOND AUTHORIZED DEALER. CALL AND ASK FOR ROB OR STEVE TODAY.  ASK ABOUT OUR MILITARY AND VETERAN'S DISCOUNT PROGRAM!!!  BOWHUNTERS EDGE 3812 E PIKES PEAK AVE STE 217 COLORADO SPRINGS, COLORADO 80909 719-597-7774 (N.E CORNER OF PIKES PEAK AND ACADEMY BLVD)  VISIT US ON THE WEB AT bowhuntersedge.com  VISIT US ON FACEBOOK AT BOWHUNTERS EDGE COLORADO SPRINGS FACEBOOK    The Best Bows are Made not by Hoyt, Mathews, Bear, PSE, Diamond, Martin, Prime, Quest, Mission, Obsession, Struthers, Elite, but are made for the Best Archers By BOWTECH and are offered in colorado springs and southern colorado by BOWHUNTERS EDGE,home to the best archery equipment and bows in colorado springs! ""We Refuse To Follow"" HUNTING, FISHING, ATV, ARCHERY, FIREARMS, GUNS, HORSES MOUNTAIN BIKES, FOUR WHEEL DRIVE TRUCKS..IF YOU CAN DO THESE YOU CAN SHOOT A BOW. SPEED BOW, FAST BOW. THE BEST BOW ON THE MARKET. IF YOU ARE A BRONCOS FAN WE EVEN HAVE LONG BOWS, RECURVE BOWS, COMPOUND BOWS, ARROWS, RELEASES AND MORE, VAPOR TRAIL, PRO V",,,,,,,,,,,
5651,1199.0,cosprings,https://cosprings.craigslist.org/sgd/d/colorado-springs-2022-eva-shockey-gen/7471520519.html,2022-04-15 05:32,2022 EVA SHOCKEY GEN 2,, BOWTECH, EVA SHOCKEY GEN 2,4,"PREMIUM LADIES’ BOW, DEADLOCK TECHNOLOGY, AND EVA SHOCKEY…SINCE WE’RE NAME DROPPING.  It’s everything that makes Bowtech bows the most accurate in the world, and then some. No ladies bow on the market even comes close. Designed in conjunction with its namesake, the new Eva Shockey Signature Series Gen II is smooth, hard-hitting, deadly accurate, and weighs in at a mere 3.9 pounds; thanks to its feather-light, yet rock-solid riser. With the addition of the most reliably accurate cam system in the world, it has no equal.  Dead Lock Cams: Not only the quickest and simplest way to achieve perfect arrow flight, but the surest way to maintain it. Just move the cams left or right on the axles with a turn of a screw to position all the energy directly behind the arrow. Then lock it down for permanent, repeatable accuracy…all with a smooth-as-silk draw and outstanding speed.  Dead Lock Pocket: Dead Lock limb pockets lock every component in the entire bow structure as one for the most rigid, accuracy-producing platform possible.	  Dead Lock Cable Containment: The reduced torque translates to added forgiveness and dramatically enhanced shot-to-shot consistency.  Clutch Performance Grip: The most comfortable modular grips on the market are engineered to reduce torque while increasing comfort. Our low-profile Clutch grip comes standard. The Clutch Control grip is available for purchase separately. Both grips are available in 4 popular colors.	  Orbit Dampener: Significantly reduces all felt vibration while offsetting the weight of additional accessories.  Color Finishes  Black ,Flat Dark Earth, Smoke Grey, Mossy Oak,  Breakup Country    SPECIFICATIONS AXLE-TO-AXLE        30"" BRACE HEIGHT         7"" IBO SPEED                 323 FPS DRAW LENGTH         23.5 - 28.5"" FULLY ADJUSTABLE DRAW WEIGHT      40, 50,  OR 60 LBS MASS WEIGHT        3.9 LBS  ONLY AT  BOWHUNTERS EDGE 3812 E PIKES PEAK AVE COLORADO SPRINGS, COLO 809090 COLORADO'S PREMIER BOWTECH/ DIAMOND AUTHORIZED DEALER AND THE NUMBER 1 SELLING BOWTECH DEALER IN THE SOUTHWEST UNITED STATES  719-5907-7774  The Best Bows are Made not by Hoyt, Mathews, Bear, PSE, Diamond, Martin, Prime, Quest, Mission, Obsession, Struthers, Elite, but are made for the Best Archers By BOWTECH and are offered in colorado springs and southern colorado by BOWHUNTERS EDGE,home to the best archery equipment and bows in colorado springs! ""We Refuse To Follow"" HUNTING, FISHING, ATV, ARCHERY, FIREARMS, GUNS, HORSES MOUNTAIN BIKES, FOUR WHEEL DRIVE TRUCKS..IF YOU CAN DO THESE YOU CAN SHOOT A BOWRecurves, Long Bows, Compound Bows , strings, releases and bows for Bronco fANS, ZION",,,,,,,,,,,
5652,799.0,cosprings,https://cosprings.craigslist.org/sgd/d/colorado-springs-new-2022-bowtech/7471519934.html,2022-04-15 05:29,NEW 2022 BOWTECH CARBON ZION (MICRO CARBON FINISH), new, BOWTECH, CARBON ZION,4,"2021 BOWTECH CARBON ZION  BARE BOW- $799.00  WITH RAK PACKAGE AS SHOWN $849.00 ( COLORADO SPRINGS)     The Carbon ZION  features top-level technologies that our competitors wish they could offer at a price they could never match. With Bowtech's revolutionary PowerShift FlipDisc2 technology and field proven Binary cams loaded onto a lightweight and durable carbon riser, the Carbon ZION delivers performance and power with every shot. For bragging rights and big trophies, there's no better bow than the Carbon ZION  BOWTECHS CARBON FIBER BOWS HAVE BEEN SMOKING THE COMPETITION FOR MORE THAN 5 YEARS NOW..THEY ARE NOT ONLY QUIETER, SMOOTHER, FASTER AND MORE ACCURATE THAN ANY OTHER CARBON BOWS ON THE MARKET, BUT ALSO THE LEAST EXPENSIVE CARBON RISER BOWS MADE DUE TO BOWTECHS SUPERIOR TECHNOLOGY ENABLING THEM TO KEEP COSTS DOWN IN MANUFACTURING THE BEST CARBON RISERS IN THE INDUSTRY.  WITH THE NEW FLIP DISC TECHNOLOGY YOU LITERALLY HAVE TWO BOWS IN ONE WITH THE SPEED , TECHNOLOGY AND ACCURACY FOUND IN ALL BOWTECH BOWS, THE ICON FEATURES A CARBON RISER COMING IN AT AN AMAZING 3.2 POUNDS TOTAL MASS WEIGHT, HAS AN ADJUSTABLE DRAW LENGTH FROM 26.5 TO 30.5 INCHES, AXLE TO AXLE LENGTH OF 31 INCHES, BRACE HEIGHT OF 7 INCHES, 87.2 POUNDS OF KINETIC ENERGY, 80% LET OFF AND A BLAZING SPEED OF 335 FEET PER SECOND.  IF YOU ARE GETTING WEAK SHOULDERS OR HAVE AN INJURY TRY THIS BOW!!!! YOU WON'T BE SORRY AND YOU WILL CONTINUE TO SHOOT AND HUNT!!!!!  THIS BOW COMES READY TO SHOOT WITH OCTANE REST,QUIVER, STABILIZER , WRIST SLING, 4 PIN SIGHT, CARBON PEEP AND D LOOP ALREADY INSTALLED  AVAILABLE IN COLORADO SPRINGS ONLY AT BOWHUNTERS EDGE ARCHERY, COLORADO'S PREMIER BOWTECH/DIAMOND AUTHORIZED DEALER. CALL AND ASK FOR ROB OR STEVE TODAY.  ASK ABOUT OUR MILITARY AND VETERAN'S DISCOUNT PROGRAM!!!  BOWHUNTERS EDGE 3812 E PIKES PEAK AVE STE 100 COLORADO SPRINGS, COLORADO 80909 719-597-7774 (N.E CORNER OF PIKES PEAK AND ACADEMY BLVD)  VISIT US ON THE WEB AT bowhuntersedge.com  VISIT US ON FACEBOOK AT BOWHUNTERS EDGE COLORADO SPRINGS FACEBOOK    The Best Bows are Made not by Hoyt, Mathews, Bear, PSE, Diamond, Martin, Prime, Quest, Mission, Obsession, Struthers, Elite, but are made for the Best Archers By BOWTECH and are offered in colorado springs and southern colorado by BOWHUNTERS EDGE,home to the best archery equipment and bows in colorado springs! ""We Refuse To Follow"" HUNTING, FISHING, ATV, ARCHERY, FIREARMS, GUNS, HORSES MOUNTAIN BIKES, FOUR WHEEL DRIVE TRUCKS..IF YOU CAN DO THESE YOU CAN SHOOT A BOWRecurves, Long Bows, Compound Bows , strings, releases and bows for Bronco fANS",,,,,,,,,,,
5653,1099.0,cosprings,https://cosprings.craigslist.org/sgd/d/colorado-springs-new-2022-bowtech/7471519470.html,2022-04-15 05:26,NEW 2022 BOWTECH CARBON ZION  DLX (MICRO CARBON FINISH), new, BOWTECH, CARBON ZION DLX,2,"2022 BOWTECH CARBON ZION  DLX- $1099.00 ( COLORADO SPRINGS)  EQUIPPED WITH RIPCORD DROP AWAY REST, BLACK GOLD 5 PIN SIGHT, TIGHT SPOT QUIVER, D LOOP , PEEP AND WRIST SLING AND NOW IN SEVERAL NEW CAMO OPTIONS  The Carbon ZION DLX is the next generation of R.A.K. equipped Carbon bows. The Carbon ZION   features top-level technologies that our competitors wish they could offer at a price they could never match. With Bowtech's revolutionary PowerShift FlipDisc2 technology and field proven Binary cams loaded onto a lightweight and durable carbon riser, the Carbon ZION DLX delivers performance and power with every shot. For bragging rights and big trophies, there's no better bow than the Carbon ZION DLX  BOWTECHS CARBON FIBER BOWS HAVE BEEN SMOKING THE COMPETITION FOR FIVE PLUS YEARS NOW..THEY ARE NOT ONLY QUIETER, SMOOTHER, FASTER AND MORE ACCURATE THAN ANY OTHER CARBON BOWS ON THE MARKET, BUT ALSO THE LEAST EXPENSIVE CARBON RISER BOWS MADE DUE TO BOWTECHS SUPERIOR TECHNOLOGY ENABLING THEM TO KEEP COSTS DOWN IN MANUFACTURING THE BEST CARBON RISERS IN THE INDUSTRY.  WITH THE NEW FLIP DISC TECHNOLOGY YOU LITERALLY HAVE TWO BOWS IN ONE WITH THE SPEED , TECHNOLOGY AND ACCURACY FOUND IN ALL BOWTECH BOWS, THE ICON FEATURES A CARBON RISER COMING IN AT AN AMAZING 3.2 POUNDS TOTAL MASS WEIGHT, HAS AN ADJUSTABLE DRAW LENGTH FROM 26.5 TO 30.5 INCHES, AXLE TO AXLE LENGTH OF 31 INCHES, BRACE HEIGHT OF 7 INCHES, 87.2 POUNDS OF KINETIC ENERGY, 80% LET OFF AND A BLAZING SPEED OF 335 FEET PER SECOND.  IF YOU ARE GETTING WEAK SHOULDERS OR HAVE AN INJURY TRY THIS BOW!!!! YOU WON'T BE SORRY AND YOU WILL CONTINUE TO SHOOT AND HUNT!!!!!  THIS BOW COMES READY TO SHOOT WITH OCTANE REST,QUIVER, STABILIZER , WRIST SLING, 4 PIN SIGHT, CARBON PEEP AND D LOOP ALREADY INSTALLED  AVAILABLE IN COLORADO SPRINGS ONLY AT BOWHUNTERS EDGE ARCHERY, COLORADO'S PREMIER BOWTECH/DIAMOND AUTHORIZED DEALER. CALL AND ASK FOR ROB OR STEVE TODAY.  ASK ABOUT OUR MILITARY AND VETERAN'S DISCOUNT PROGRAM!!!  BOWHUNTERS EDGE 3812 E PIKES PEAK AVE STE 100 COLORADO SPRINGS, COLORADO 80909 719-597-7774 (N.E CORNER OF PIKES PEAK AND ACADEMY BLVD)  VISIT US ON THE WEB AT bowhuntersedge.com  VISIT US ON FACEBOOK AT BOWHUNTERS EDGE COLORADO SPRINGS FACEBOOK    The Best Bows are Made not by Hoyt, Mathews, Bear, PSE, Diamond, Martin, Prime, Quest, Mission, Obsession, Struthers, Elite, but are made for the Best Archers By BOWTECH and are offered in colorado springs and southern colorado by BOWHUNTERS EDGE,home to the best archery equipment and bows in colorado springs! ""We Refuse To Follow"" HUNTING, FISHING, ATV, ARCHERY, FIREARMS, GUNS, HORSES MOUNTAIN BIKES, FOUR WHEEL DRIVE TRUCKS..IF YOU CAN DO THESE YOU CAN SHOOT A BOWRecurves, Long Bows, Compound Bows , strings, releases and bows for Bronco fANS, ZION",,,,,,,,,,,
5654,1800.0,cosprings,https://cosprings.craigslist.org/bik/d/colorado-springs-2019-marin-rift-zone/7465663776.html,2022-04-14 19:04,2019 Marin Rift Zone 3 - size small, good, Marin, Rift Zone 3,17,"2019 Marin Rift Zone 3 - size Small   Very good condition with only a few scratches on the frame.  Mechanically in excellent condition.  Original owner and ridden for approximately 300 miles.   This is the Rift Zone 3 which is the highest spec for the 2019 model.  29er.  Temporary plastic pedals included.  There's nothing wrong with this bike but selling because I switched to an electric mountain bike.  Temporary pedals included.   *If the ad is up, it's still available.  Price is firm.  Cash only.  Specs: Frame: 6061 Aluminum Frame, 29"" wheels, Boost Thru-Axle Front Fork:  RockShox Revelation RC 29"", 120mm Travel Rear Suspension: RockShox Deluxe RT Debonair Brakes: Shimano Deore M6000 Hydraulic Disc, 180mm Rotor Front, 160mm Rotor Rear Drivetrain: Shimano SLX 1x11 speed, 11-46T Dropper:  TranzX Dropper Post 100mm Travel Tires:  WTB Trail Boss, 29x2.4"", Tubeless Compatible (not setup tubeless) For more info:  https://www.marinbikes.com/bikes/2019-rift-zone-3", aluminum, mountain, Small, 29 in,,, frame and fork (full suspension), disc (hydraulic), riser, none,
5655,65.0,cosprings,https://cosprings.craigslist.org/spo/d/castle-rock-inter-rim-bike-trainer/7470310914.html,2022-04-14 18:16,Inter Rim Bike Trainer,,,,0,,,,,,,,,,,,
5656,25.0,cosprings,https://cosprings.craigslist.org/bik/d/colorado-springs-swagman-locking-hitch/7469804061.html,2022-04-14 12:22,SWAGMAN LOCKING HITCH PIN & CABLE,,,,9,"This 1/2"" hitch pin locks your bike rack to your hitch; the integrated steel cable locks your bike to the rack. The hitch lock fits Swagman racks with 1-1/4"" only shanks and 1-1/4"" and 2"" combination shanks.  Features: Hitch pin locks your Swagman bike rack to your vehicle's 1-1/4"" trailer hitch receiver Built-in anti-rattle device prevents movement of bike-carrier shank in hitch Also compatible with Swagman 1-1/4"" shanks used with 2"" adapter sleeves 10-mm, Braided steel security cable locks your bikes to your bike rack Cable threads through bike frame and attaches to hitch pin with steel thimble 2 Keys require only half-turns to unlock Triple chrome plating on hitch pin ensures durability  Specs: Application: Swagman bike carriers with shanks that slide into 1-1/4"" x 1-1/4"" hitches Compatible with 1-1/4"" and 2"" combination shanks Pin diameter: 1/2"" Overall length of lock: 7"" Pin length: 4-3/4"" Usable pin length: 2-3/4"" Length of threaded portion: 2"" Length of lock core and handle: 2-1/4"" Cable length: 7'  Text Dave at  show contact info", steel, other, n/a, other/unknown,,,,,,,
