,Price,Location,URL,Date,Title,bicycle frame material,bicycle type,brake type,condition,electric assist,frame size,handlebar type,make / manufacturer,suspension,wheel size,num image,text,model name / number,part type,serial number,size / dimensions
3089,29588.0,hanford,https://merced.craigslist.org/ctd/d/sacramento-2014-toyota-tacoma-trd-off/7472820221.html,2022-04-18 11:23,2014 Toyota Tacoma TRD Off Road 4x4 Double Cab With Navigation and JBL,,,,,,,,,,,23,"2014 * Toyota * * Tacoma TRD Off Road 4x4 Double Cab   With Navigation and JBL Premium Audio *  pickup  Silver Sky Metallic - Stock  A33958M&S Auto 209-822-2070Se Habla EspanolWhy Buy From M&S Auto?Thank you for visiting our new website! M&S Auto is Sacramento’s favorite used car dealership, look no further. This company is founded on trust, integrity, and respect. We are proud to offer these values in our sales and business practices so our customers continue to come back. Year:   2014 Make:  Toyota Model:  Tacoma TRD Off Road 4x4 Double Cab Trim:  With Navigation and JBL Premium AudioMileage: 81k miles Exterior Color: Silver Sky Metallic Interior Color: Graphite Engine: 4.0L 6 Cylinders Drive: 4wd Transmission: Automatic VIN: 3TMLU4EN4EM144491Seller Comments: Our 2014 Toyota Tacoma Double Cab V6 4X4 shown in Silver Sky Metallic is built for action.Motivated by a 4.0 Liter V6 offering 236hp on demand to a 5 Speed Automatic transmission for amazing towing and passing.Our Four Wheel Drive attains near 21mpg on the highway plus the utility of this versatile truck paired with good fuel economy makes a very attractive combination.Our Tacoma has a reputation for rugged good looks and working hard.With a bold grille, custom wheels, and aggressive stance, this athletic truck means business.You'll appreciate the ease of hauling bikes, furniture or anything else with a composite bed-liner, a roof rack, and a bed utility rail system.   Once inside our spacious Tacoma, you'll notice comfortable front bucket seats, a 60/40 split rear bench, and rear-seat vents.A premium audio system with available satellite radio, iPod input, and Bluetooth technology communicates with a central 6.1-inch touchscreen display to serve as your personal command center.   Our Tacoma is equipped with Toyota's Star Safety System, which includes ABS, electronic brake-force distribution, brake assist, a backup camera, vehicle stability control, and traction control.This sturdy truck will make a great companion for you.Save this Page and Call for Availability.We Know You Will Enjoy Your Test Drive Towards Ownership! M&S Auto - Celebrating 22 years serving Northern California with over 300 vehicles in stock! *CALL* or *TEXT* us to see how we can help you finance this Toyota Tacoma TRD Off Road 4x4 Double Cab!209-822-2070For all details on this vehicle, visit:https://cl-car.dealersync.com/12152595-87134  Toyota  Tacoma TRD Off Road 4x4 Double Cab  With Navigation and JBL Premium Audio  Silver Sky Metallic FeaturesRoof : Sun/Moonroof*Toyota* *Tacoma* *TRD* *Off* *Road* *4x4* *Double* *Cab* *Access* *Cab* *Toyota* *Tacoma* *TRD* *Off* *Road* *4x4* *Double* *Cab* *Access* *Cab* *PreRunner* *Toyota* *Tacoma* *TRD* *Off* *Road* *4x4* *Double* *Cab* *Access* *Cab* *X-Runner* *Toyota* *Tacoma* *TRD* *Off* *Road* *4x4* *Double* *Cab* *Double* *Cab* *Toyota* *Tacoma* *TRD* *Off* *Road* *4x4* *Double* *Cab* *Double* *Cab* *PreRunner* *Toyota* *Tacoma* *TRD* *Off* *Road* *4x4* *Double* *Cab* *Regular* *Cab* *Pickup* *Toyota* *Tacoma* *TRD* *Off* *Road* *4x4* *Double* *Cab* *SR5* *TRD* *Toyota* *Tacoma* *TRD* *Off* *Road* *4x4* *Double* *Cab* *Xtracab* *Pickup* *Toyota* *Tacoma* *TRD* *Off* *Road* *4x4* *Double* *Cab* *Xtracab* *PreRunner* *Pickup* *Toyota* *Tacoma* *TRD* *Off* *Road* *4x4* *Double* *Cab* *extended* *cab* *Toyota* *Tacoma* *TRD* *Off* *Road* *4x4* *Double* *Cab* *4WD* *Regular* *Toyota* *Tacoma* *TRD* *Off* *Road* *4x4* *Double* *Cab* *TRD* *supercharger* *Pick* *up* 2023  2022  2021  2020  2019  2018  2017  2016  2015  2014  2013  2012  2011  2010  2009  2008  2007  2006  2005  2004  2003  2002  2001  2000   23  22  21    19  18  17  16  15  14  13  12  11  10  09  08  07  06  05  04  03  02  01  00",,,,
3090,31788.0,hanford,https://merced.craigslist.org/ctd/d/sacramento-2015-toyota-tacoma-sr5-4x4/7472820103.html,2022-04-18 11:22,2015 Toyota Tacoma SR5 4x4 Double Cab Long Bed pickup Blue Ribbon,,,,,,,,,,,22,"2015 * Toyota * * Tacoma SR5 4x4   Double Cab Long Bed *  pickup  Blue Ribbon Metallic - Stock  A33871M&S Auto 209-822-2070Se Habla EspanolWhy Buy From M&S Auto?Thank you for visiting our new website! M&S Auto is Sacramento’s favorite used car dealership, look no further. This company is founded on trust, integrity, and respect. We are proud to offer these values in our sales and business practices so our customers continue to come back. Year:   2015 Make:  Toyota Model:  Tacoma SR5 4x4 Trim:  Double Cab Long BedMileage: 77k miles Exterior Color: Blue Ribbon Metallic Interior Color: Graphite Engine: 4.0L 6 Cylinders Drive: 4wd Transmission: Automatic VIN: 3TMMU4FN6FM076344Seller Comments: Tackle your day easily with the capability of our tremendous 2015 Toyota Tacoma Double Cab V6 4X4 proudly presented in Blue Ribbon Metallic.Motivated by a 4.0 Liter V6 producing 236hp on demand while paired with a 5 Speed Automatic transmission for solid shifts.This Four Wheel Drive attains near 21mpg on the highway and is the perfect blend of size and capability designed to handle your every adventure.Our Tacoma has a reputation for looking good and working hard.With a bold grille and aggressive stance, this athletic truck means business.You'll appreciate the convenience of hauling bikes, furniture or anything else with the bed utility rail system, along with the tonneau cover.   Once inside the spacious Tacoma interior, you'll notice upgraded front bucket seats, a 60/40 split rear bench, and plenty of legroom for rear-seat passengers.A premium audio system with available satellite radio, iPod input, and Bluetooth technology communicate with a central 6.1-inch touchscreen display to serve as your command center so you can focus on the road.  Safety is always a priority, and our Toyota Tacoma is equipped with Toyota's Star Safety System, which includes ABS, rear vision camera, electronic brake-force distribution, brake assist, vehicle stability control, and traction control.This sturdy truck will make an excellent companion for you.Save this Page and Call for Availability.We Know You Will Enjoy Your Test Drive Towards Ownership! M&S Auto - Celebrating 22 years serving Northern California with over 300 vehicles in stock! *CALL* or *TEXT* us to see how we can help you finance this Toyota Tacoma SR5 4x4!209-822-2070For all details on this vehicle, visit:https://cl-car.dealersync.com/12056672-87134  Toyota  Tacoma SR5 4x4  Double Cab Long Bed  Blue Ribbon Metallic FeaturesRoof : Sun/Moonroof*Toyota* *Tacoma* *SR5* *4x4* *Access* *Cab* *Toyota* *Tacoma* *SR5* *4x4* *Access* *Cab* *PreRunner* *Toyota* *Tacoma* *SR5* *4x4* *Access* *Cab* *X-Runner* *Toyota* *Tacoma* *SR5* *4x4* *Double* *Cab* *Toyota* *Tacoma* *SR5* *4x4* *Double* *Cab* *PreRunner* *Toyota* *Tacoma* *SR5* *4x4* *Regular* *Cab* *Pickup* *Toyota* *Tacoma* *SR5* *4x4* *SR5* *TRD* *Toyota* *Tacoma* *SR5* *4x4* *Xtracab* *Pickup* *Toyota* *Tacoma* *SR5* *4x4* *Xtracab* *PreRunner* *Pickup* *Toyota* *Tacoma* *SR5* *4x4* *extended* *cab* *Toyota* *Tacoma* *SR5* *4x4* *4WD* *Regular* *Toyota* *Tacoma* *SR5* *4x4* *TRD* *supercharger* *Pick* *up* 2023  2022  2021  2020  2019  2018  2017  2016  2015  2014  2013  2012  2011  2010  2009  2008  2007  2006  2005  2004  2003  2002  2001  2000   23  22  21    19  18  17  16  15  14  13  12  11  10  09  08  07  06  05  04  03  02  01  00",,,,
3091,1900.0,hanford,https://slo.craigslist.org/for/d/paso-robles-kayak-bike-rack-with-kayaks/7472803323.html,2022-04-18 10:54,Kayak/Bike Rack with 2 Kayaks RV Rated,,,, excellent,,,, Yakups,,,4,This Yakups Kayak rack holds 2 kayaks (included) as well as 2 bikes (NOT included) and is rated for use on a 5th wheel trailer.  It was custom built to fit into a hitch receiver on the back of a 5th wheel trailer.  2 Single person Malibu Kayaks are included.  Bikes fit upright in between kayaks.  Kayaks get bungee straps and the bikes are held on with a hook and several straps.,,,,
3092,125.0,hanford,https://slo.craigslist.org/mpo/d/los-osos-harley-davidson-flhtkl-low/7462900692.html,2022-04-18 10:25,Harley-Davidson FLHTKL low  touring model shocks,,,, like new,,,, Harley-Davidson,,,0,"Low adjustable touring shocks for Harley-Davidson baggers.  Stock on StreetGlide and Limited FLHTKL(low) touring model bikes.  Replaced with taller shocks.  As new, less than 1000 miles when removed from 2016 FLHTKL.  Will fit all touring model Harleys 2014 to present.  May also fit older models. $125.00", 54000082,,, 12”
3093,15.0,hanford,https://slo.craigslist.org/bik/d/san-luis-obispo-bike-huffy-children-kids/7465110544.html,2022-04-18 09:07,Bike Huffy Children Kids,,,,,,,,,,,0,,,,,
3094,70.0,hanford,https://fresno.craigslist.org/bop/d/fresno-bike-rack-carrier-holds-bicycles/7464790450.html,2022-04-18 08:20,"BIKE RACK CARRIER HOLDS 2 BICYCLES FITS 2"" RECEIVER OVER HITCH",,,,,,,,,,,0,Came in an estate I bought in good condition holds 2 Bikes. Asking 70.00 O.B.O. If interested call  show contact info  NO TEXTS OR EMAILS PLEASE!!!,,,,
3095,280.0,hanford,https://fresno.craigslist.org/bop/d/sanger-thule-hitching-folding-tilting/7461915008.html,2022-04-18 08:21,THULE HITCHING FOLDING TILTING BIKE CARRIER 5 BICYCLES MADE IN SWEDEN,,,,,,,,,,,0,,,,,
3096,50.0,hanford,https://fresno.craigslist.org/bop/d/fresno-new-allen-sports-compact-folding/7472714054.html,2022-04-18 08:18,NEW ALLEN SPORTS COMPACT FOLDING TRUNK MOUNT BIKE BICYCLE CARRIER,,,, new,,,,,,,0,Here is a new Allen Sports compact folding trunk mount holds 2 bikes. Asking 50.00  If interested call  show contact info  NO TEXTS OR EMAILS PLEASE!!!!,,,,
3097,50.0,hanford,https://slo.craigslist.org/bik/d/arroyo-grande-kids-co-pilot-bike-trailer/7465841941.html,2022-04-18 08:14,Kids Co-Pilot Bike Trailer, other/unknown, kids,,,, Small,,,, other/unknown,3,"Perfect for spring/summer family bike rides!!! Never once used, tiny rust spots just because all our bikes are left outside. Still have instructions and safety flag and all the bolts to attach it. $50 obo",,,,
3098,299.0,hanford,https://fresno.craigslist.org/wtd/d/la-puente-lift-kitkits-for-toyota/7472673392.html,2022-04-18 06:51,"🚘 2.5"",4"",6"",8""Lift Kit(Kits) for Toyota Tundra/4Runner/Tacoma",,,,,,,,,,,14,"2.5"",4"",6"",8""Lift Kit(Kits) for Toyota Tundra/4Runner/Tacoma Installation available	  Suspension Lift Kits(Kit)  2.5"", 3.5"", 4"", 6"", 7"", 7.5"" inch/ Leveling Kits  2"" to 3""	 Same Day Installation available- Call for more detail  626-814-1158	  Also we carry Biggest Selection of Offroad Wheels Fuel, XD series, Moto Metal RBP Method Rims and more...	 Available tires brand and sizes	 RBP Lionhart Lexani Fuel Fedral Nitto Toyo tires package	 33x12.50 x18,  35x12.50x18,  	 33x12.50x20, 35x12.50x20,  37x12.50x20, 	 33x12.50x22,  35x12.50x22, 37x12.50x22	 40x12.50x24	 and more.. 	  audiocityusa.com  -  since 1989 	 888-814-1158   (Open - 7am to 5:30pm -Mon to Sat,  10am to 5pm-Sun  PST)	 13927 Amar Rd, La Puente, CA 91746	 Check out our extensive selection of wheels on cars @ AudioCityUSA.com	  EZ Financing( No Credit Needed) Instant Approval- 90 Days No Interest	 Apply Now at audiocityusa.com and get approved instantly	 If you have a checking account and job, you are already pre-qualified	  Lift Kits Prices - Vehicle year will vary prices(If you don't see your vehicle give us call)	 Nissan Titan	 ------ 2 - 2.5 inch  - $299	 ------ 3 inch  - Call	 ------ 3.5 inch  - Call	 ------ 4 inch  - $999	 ------ 4.5 inch  - Call	 ------ 4.75 inch  - Call	 ------ 6 inch  - $1299	 ------ 7 inch  - x	 ------ 7.5 inch - x	 ------ 8 inch - x	  Toyata Tacoma	 ------ 2 - 2.5 inch  - $299	 ------ 3 inch  - Call	 ------ 3.5 inch  - Call	 ------ 4 inch  - Call	 ------ 4.5 inch  - $999	 ------ 4.75 inch  - x	 ------ 6 inch  - $999	 ------ 7 inch  - x	 ------ 7.5 inch - x	 ------ 8 inch - x	  Toyata Tundra	 ------ 2 - 2.5 inch  - $299	 ------ 3 inch  - Call	 ------ 3.5 inch  - Call	 ------ 4 inch  - $1199	 ------ 4.5 inch  - Call	 ------ 4.75 inch  - Call	 ------ 6 inch  - $1199	 ------ 7 inch  - x	 ------ 7.5 inch - x	 ------ 8 inch - $1799	  Toyata 4 Runner	 ------ 2 - 2.5 inch  - $299	 ------ 3 inch  - Call	 ------ 3.5 inch  - Call	 ------ 4 inch  - Call	 ------ 4.5 inch  - Call	 ------ 4.75 inch  - Call	 ------ 6 inch  - $1899	 ------ 7 inch  - x	 ------ 7.5 inch - x	 ------ 8 inch - x	  Fits on Chevy Chevrolet Blazer, 1500 2500 3500 Dualie Dualy Silverado Colorado Suburban Tahoe Dodge Ram 1500 2500 3500, Ford Expedition Excursion F150 F250 F350 GMC GM Sierra 1500 2500 3500 Yukon Denali Honda Pilot, Hummer H1 H2 H3, Jeep Cherokee Compass Grand Cherokee Wrangler 2WD 4WD Lincoln Mart LT, Nissan Armada Frontier Pathfinder Titan Xterra, Toyota Tacoma 4 Runner FJ Cruiser Land Cruiser Sequoia Tundra and more..	 Suspension Lift Kit Kits  2.5"" inch, 3.5"", 4"", 6"", 7"", 7.5"" and Leveling Kits	 for 1980 1981 1982 1983 1984 1985 1986 1987 1988 1989 1990 1991 1992 1993 1994 1995 1996 1997 1998 1999 2000 2001 2002 2003 2004 2005 2006 2007 2008 2009 2010 2011 2012 2013 2014 2015 2016 2017 2018 2019 2020 2021 2022 2023	 16 17 18 20 22 24 (16x7  16x8  17x8  17x9  18x9  18x10  20x9  20x10  20x12  20x14  22x10 22x12  22x14  24x12  24x14  24x16 ) wheels wheel rims rim tire tires	 chrome black  black machine machined bronze silver Custom color	 Bolt -5Lug  5Lugs 6Lug 6Lugs  8 Lug Lugs (5x5, 5.127, 5.135, 5.139, 6.139, 6.135, 6.120, 6.127,  8.165, 8.170, 8.180 and more)	  LIFT ROAD AMP STEPS KIT KITS PROGRAMMER TIRE WHEELS RIMS CHROME BLACK TREAD CONTROL ARM SHOCKS STRUTS SPRINGS OFF-ROAD OFF EXHAUST MECHANIC SERVICE offroad, offroad fabrication, Off road fab, Fabrication, off road bumper, off road bumpers, off road rear bumper, off road bolt on bumper, Road armor bumper, Dimple dies, Ford, Dodge, Jeep, Toyota, Nissan, Chevy, Hummer, GMC, prerunner, prerunner trucks, roll cages, articulation, rock crawler, long travel, long travel kits, chase truck, chase truck racks, shocks, welding, auto lift kits, D.O.M, 4130, mild steel, aluminum skid plate, skid plate, fabrication off road shop, off road shop, fabrication shop, welding shop, tube bending, tube notching, notching, plasma, plasma cutting, dimple die, dimple die holes, cutting, tube cutting, metal cutting, roll cage, bed cage, engine cage, shock towers, dirt tech, rock crawler, rock sliders, tire gate, tiregate, d-rings, clevis, gas can rack, receiver, hi-lift, high lift, license plate mount, shovel mount, dimple die plate work, dimple die plate, dimple die metal, fuel cell, fuel safe, 4 link, 3 link, long travel suspension, long travel kit, lift spindles, uniball, uni ball, heims, bungs, dirt bikes, utv, jet ski, atv, 4 wheel drive, 4x4, 4x4 trucks, four wheel drive, dual sport, dirt, subaru, wrxrally cars, drift cars, light tabs, light bars, light racks, bump stops, spindles, a-arm, a arm, i-beam i beam, center mount, steering, steering ram, howe, howe pumps, frame, laminate plates, frame plates, fuel cell mounts, 5 point, 4 point, 6 point, 8 point, 10 point, 12 point, race cage, race truck, class 1, class 3, class 5, class 7, class 7s, score, mdr, lucas oil, trophy truck, trophy cart, side by side, side x side, buggy, sand car, 4 seater, 2 seater, two seater, four seater, metal fabrication, bed cage, tubing, CNC, tube notcher, rollback, TJ, razor, fabricator, xj, cherokee, rubicon, wrangler, king of the hammers, king of the desert, tig, mig, metal work, custom fab, welder, boat, trade, barter, rockcrawler, rock-crawler, toyota land cruiser, land cruiser, fj40, fj 40, beadlock, beadlocks, bead lock, bead locks, beadlock wheels, tubebuggy, tube buggy, suburban, small block, big block, small block, swap, horsepower, truck, car, tbi, 1500, 3500, 2500 , silverado, blazer, k5, k5 blazer, c20, 700r4, th350, 700, 4l60, 4l80, t5, t6, k10, k20, seat, valve covers, power steering, power steering pump, air intake, rear bench seat, 4 by 4, custom, carbon fiber, fiberglass, front clip, air scoop, scoop, fiberglass fenders, bedsides, fiberglass bedsides, bed sides, fiberglass 1piece, dash, custom dash, metal dash, flow masters, flowmaster, spin tech, magna flow, magnaflow, turbo, turbo mufflers, mufflers, exhaust, transmission, monster truck, crop truck, airbags, custom work, bench, tilt steering wheel, wood grain, disc brake, drum brake, willwood, original parts, american built, domestic, garage, garage sale, yard sale, hard to find, unique, inner fenders, solid axle, independent suspension, rotor, 3rd member, unlocking hubs, hubs, disc brakes swap, swap to a straight axle, suzuki, tacoma, 4Runners, 4runner, four runner, 22re, 22, engine, motor, tires, rims, wheels, burfield, chrome moly, solid axle, pumpkin, winch, winch mount, winch bumper, hubs, unlocking, locking, drive flange, dana 44, 44, dana 30, 30, dana 60, 60, dana 70, 70, corp 14, 14 bolt, spacers, 6 lug, 5 lug, 8 lug, 6 lug wheels, 5 lug wheels, 8 lug wheels, duel case, duel transfer case, duel transfercase, transfer case, transfercase, 466, 410, 529, 307, 588, gears, trail, trail, trail gear, axles seats, interior, Toyota solid axle, rotor, locking hubs, motor mounts, custom intakes, custom exhaust, bucket seat, bucket seat mounts, fiberglass dash, one piece clip, one piece fibergass, sales, Fabricate, build trailers, custom trailers, repair trailers, frame reinforce, crawler buggy, sliders, roll bar harness, bar stock, mild, .120, .090, .095, die bender, tube bender, fabrication tabs, step notch, shackle, drill tab, light tab, seat tab, light bar, roof rack, modification, weld bead, structural welding, Tire carrier, off road trailer, toy hauler, box trailer, flatbed, car hauler, race trailer, oxy acetylene, plate fenders, rock fenders, armor plate, stinger, cage hoop, shock hoop, tow bar, hitch, stubby, restoration, sheet metal, Custom built, MOTO, motorcycle, Baja, racing, rock crawl, weld, trailers, Built, 2wd spindles, Suspensions, Suspension Components, Lifted Spindles, Spindle Lift, kits, bolt on kits, available, rims and tires, Installation, 2WD. 4"" lift spindle, 4""lift, 6""lift, 8""lift, 10"" lift, custom tube, works, custom tube works, Nerf, light rack, off-road fabrication, Custom Fabricated Bumpers, cheap, project, automotive, free, fox, fox shock, coil over, smoothie bodies, two way bypass, three way bypass, 2way bypass, 3way bypass, off road shocks, off road cars, race truck, Lb, Sb, bed, long bed, short bed, utility, utility bed, 1/2 ton, 3/4 ton, 1 ton, short bed, long bed, swb, lwb, shortbox, box, box truck, fleetside, fleet, pick up, pickup, differential, rear differential, grill, cradle, motor mounts, bully dog, programmer, tuner, chip, power gain, truck programmer, rough country fabtech supper lift, bullet proof fox schocks, king schocks, performance shocks (off road wheels wheel rims rim tire tires- Mud Terrain) Off Road wheels",,,,
