,Price,Location,URL,Date,Title,condition,make / manufacturer,model name / number,part type,num image,text,bicycle frame material,bicycle type,frame size,wheel size,brake type,handlebar type,size / dimensions,electric assist,suspension,paint color,year manufactured
1248,1995.0,flagstaff,https://flagstaff.craigslist.org/bid/d/phoenix-bicycle-suspension-1000-watt/7464172977.html,2022-03-28 15:49,E Bicycle Suspension 1000 Watt Fat Tire Electric Hunting eBike 48 V, new,,,,20,"COGEBIKES.COM  Worth a trip to the valley.We can ship for $125.00.We have some of the best prices on electric pedal assist ebikes in the country.All with full warranty.We have many styles to choose from.Brand new top of the line electric front suspension of road , hunting mountain bike. ( We also have this model in the mid drive Bafang with hydraulic brakes available ) .This has the newest technology with the 1000 watt Bafang motor , hydraulic brakes and removable lithium ion Samsung 48 volt 17 ah battery pack with usb port for charging your phone.Good for up to 1000 charges.Comes with heavy duty front and rear racks. 4 "" fat tires for all terrain riding.Sand , snow , gravel , mud etc.Lots of power to get up those hills with 9 different pedal assist modes.Average top speed is 30  mph depending on rider weight.Will hold up to 350 lb rider.This bike is amazing.Average 60 to 80 miles on a single charge on level one assist. Aluminum frame.Come see why this is our top seller.Call me for more specific details of the bike and to take a test ride.You won't be disappointed.They are a blast to ride and a great way to start getting exercising again. Commute to work and save gas.$ 2095.00 OTD Ebike Bicycle    Atala Aventon Babboe Batavus Bearcraft Benno Beone BH Bianchi Bixs blix BMC Boardman Bottechia Budnitz Bulls Butchers & Bicycles Buzz Bicycles BTN BPN Cannondale Canyon CIOCC Civia Colnago Commencal Corratec Cube Bikes Dawes Day6 DCO De Rosa Del Sol Devinci Diamondback Dolan Ecells Electra Electric Bike Company EVO EUNORAU Factory Falkenjagd Felt Focus Frey Fuji Gazelle Gepida GHOST-bikes Giant Gitane Haibike Haro Hasa Head Hilite HP Juiced Rambo Quit Kat FLX Velotechnik IDWorx KHS Kildemoes Kona La Pierre Liv Look M2S Ebikes Marin Merida Micargi Miyata Montague Motobecane Moustache Olmo Olympia Omnium Opus Orbea Peugeot Pinarello PlanetX Polygon Priority Bicycles Pure Cycles R&A Cycles R+E Cycles Rad Power Bikes Raleigh Raymon Ribble Ridley Riese & Müller Rocky Mountain Roux Ruff Cycles S.A.M.’s Bike Company Saracen Savadeck Scapin Schindelhauer s Schwinn SCO Scott Specialized Stevens Sondor Storck Stradalli Taurus Tern Trek Trinx Univega Upland Urban Arrow Urwahn Van Dessel Vilano Walleräng WHEELER Whyte Wilier Winora Yuba Zinn Cycles Electric-Bike E-Bike ebike e bike bicycle", aluminum, mountain,,,,,,,,,
1249,1995.0,flagstaff,https://flagstaff.craigslist.org/bid/d/phoenix-full-suspension-1500-watt-52v/7464172697.html,2022-03-28 15:48,Full Suspension 1500 Watt 52v Ebike Electric Bike Fat Tire, new,,,,20,"COGEBIKES.COM  Worth a drive to the valley.We can ship for $125.00.We stock many different styles e bikes and have some of the best prices in the country.Brand new top of the line electric full suspension mountain or street bike .This has the newest technology 52 v with a powerful 1500 watt motor and removable lithium Samsung 14 ah battery pack.Good for up to 1000 charges.Bike is aprox. 65 lbs. Fat tires for all terrain riding.Sand , snow , mud , gravel. Lots of power to get up those hills with 5 different pedal assist modes.Average top speed is 25 to 35 mph depending on rider weight.Will hold up to 350 lb rider.Average 50 miles on a single charge on level one assist.19 "" aluminum frame.Call me for more specific details of the bike and to take a test ride.You won't be disappointed.They are a blast to ride and a great way to start getting exercising again. Commute to work and save gas.$ 1995.00 OTD   Atala Aventon Babboe Batavus Bearcraft Benno Beone BH Bianchi Bixs blix BMC Boardman Bottechia Budnitz Bulls Butchers & Bicycles Buzz Bicycles BTN BPN Cannondale Canyon CIOCC Civia Colnago Commencal Corratec Cube Bikes Dawes Day6 DCO De Rosa Del Sol Devinci Diamondback Dolan Ecells Electra Electric Bike Company EVO EUNORAU Factory Falkenjagd Felt Focus Frey Fuji Gazelle Gepida GHOST-bikes Giant Gitane Haibike Haro Hasa Head Hilite HP Juiced Rambo Quit Kat FLX Velotechnik IDWorx KHS Kildemoes Kona La Pierre Liv Look M2S Ebikes Marin Merida Micargi Miyata Montague Motobecane Moustache Olmo Olympia Omnium Opus Orbea Peugeot Pinarello PlanetX Polygon Priority Bicycles Pure Cycles R&A Cycles R+E Cycles Rad Power Bikes Raleigh Raymon Ribble Ridley Riese & Müller Rocky Mountain Roux Ruff Cycles S.A.M.’s Bike Company Saracen Savadeck Scapin Schindelhauer s Schwinn SCO Scott Specialized Stevens Sondor Storck Stradalli Taurus Tern Trek Trinx Univega Upland Urban Arrow Urwahn Van Dessel Vilano Walleräng WHEELER Whyte Wilier Winora Yuba Zinn Cycles Electric-Bike E-Bike ebike e bike bicycle", aluminum, mountain,,, disc (mechanical),,,,,,
1250,1995.0,flagstaff,https://flagstaff.craigslist.org/bid/d/phoenix-bicycle-full-suspension-folding/7464171394.html,2022-03-28 15:45,E Bicycle Full Suspension Folding 1000 Watt Electric eBike 48 Volt, new,,,,21,"COGEBIKES.COM  Worth a tip to the valley.We have some go the best prices on pedal assist e bikes in the country.All with full warranty.We have many styles of e bikes available.Perfect for campers with limited space.Folding fat tire bike.Hydraulic brakes.This has the newest technology with the 1000 watt Bafang motor and removable lithium ion Samsung 48 volt 21 ah battery pack.Good for up to 1000 charges. 4 "" fat tires for all terrain riding.Sand , snow , gravel , mud etc.Lots of power to get up those hills with 5 different pedal assist modes.Average top speed 27 mph depending on rider weight.Will hold up to 275 lb rider.Average 60 miles on a single charge on level one assist. 20 "" rims.Call me for more specific details of the bike and to take a test ride.You won't be disappointed.They are a blast to ride and a great way to start getting exercising again. Commute to work and save gas.$ 1995.00 OTD. 623- 512-5431   Atala Aventon Babboe Batavus Bearcraft Benno Beone BH Bianchi Bixs blix BMC Boardman Bottechia Budnitz Bulls Butchers & Bicycles Buzz Bicycles BTN BPN Cannondale Canyon CIOCC Civia Colnago Commencal Corratec Cube Bikes Dawes Day6 DCO De Rosa Del Sol Devinci Diamondback Dolan Ecells Electra Electric Bike Company EVO EUNORAU Factory Falkenjagd Felt Focus Frey Fuji Gazelle Gepida GHOST-bikes Giant Gitane Haibike Haro Hasa Head Hilite HP Juiced Rambo Quit Kat FLX Velotechnik IDWorx KHS Kildemoes Kona La Pierre Liv Look M2S Ebikes Marin Merida Micargi Miyata Montague Motobecane Moustache Olmo Olympia Omnium Opus Orbea Peugeot Pinarello PlanetX Polygon Priority Bicycles Pure Cycles R&A Cycles R+E Cycles Rad Power Bikes Raleigh Raymon Ribble Ridley Riese & Müller Rocky Mountain Roux Ruff Cycles S.A.M.’s Bike Company Saracen Savadeck Scapin Schindelhauer s Schwinn SCO Scott Specialized Stevens Sondor Storck Stradalli Taurus Tern Trek Trinx Univega Upland Urban Arrow Urwahn Van Dessel Vilano Walleräng WHEELER Whyte Wilier Winora Yuba Zinn Cycles Electric-Bike E-Bike ebike e bike bicycle", aluminum, folding,,, disc (hydraulic),,,,,,
1251,500.0,flagstaff,https://flagstaff.craigslist.org/bik/d/flagstaff-ws-48cm-cannondale-synapse/7472934843.html,2022-04-18 15:10,Ws 48cm Cannondale Synapse Road Bike, excellent,,,,0,"Excellent condition women's road bike. Bought roughly 10 years ago, rarely used in the last 5 years. 48 cm Cannondale Synapse.   Measurements with wheels on:  Height 36.5 Length 67 Width 16.5  Let me know if you have any questions!", aluminum, road, 48 cm, 700C, cantilever, drop,,,,,
1252,100.0,flagstaff,https://flagstaff.craigslist.org/spo/d/flagstaff-mountable-tow-package-hitch/7470862676.html,2022-04-18 14:36,"Mountable Tow Package: Hitch, Ball, Mounting Hardware Included", excellent,,,,3,"Excellent condition mountable trailer hitch/tow package.  All hardware for mounting included.  Companion hitch and ball included.  U-haul universal package. Designed to fit wide range of vehicles.  5,000 lb. towing capacity: Great for cars, trucks, vans and SUVs.  Excellent for everything from serious trailer hauling to secure bike rack mounting.  Center of mounting bolt hole to bolt hole measures 54"" with 1.25"" slot (bolt hole) variance.  (Can also be easily and safely modified to fit assorted widths using mounting plates - not included.)  CALL or TEXT preferred.  Asking only $100 for entire package. Cash only. No holds or trades.  Located near downtown Flagstaff.",,,,,,,,,,,
1253,50.0,flagstaff,https://flagstaff.craigslist.org/bop/d/flagstaff-yakima-bike-carrier-for-use/7464924874.html,2022-04-18 10:49,Yakima 2 bike carrier for use on a car-van-suv, good, Yakima,,,5,Good shape. Yakima 2 bike carrier for a van or car or SUV. Straps and buckles are in good shape. Cushions are in good shape. Rubber chain straps are in good shape. It is missing one rubber chain strap. Everything works as it should. Call or text.,,,,,,,,,,,
1254,25.0,flagstaff,https://flagstaff.craigslist.org/bop/d/flagstaff-bike-helmet-cycling-mountain/7466591192.html,2022-04-18 09:56,bike helmet cycling mountain bike mtg,,,,,7,Mountain bike helmet with visor. Straps and webbing work fine.,,,,,,,,,,,
1255,30.0,flagstaff,https://flagstaff.craigslist.org/bop/d/flagstaff-yakima-sprocket-rocket-bike/7472662313.html,2022-04-18 06:27,Yakima Sprocket Rocket bike roof rack,,,,,2,Yakima Sprocket Rocket bike roof rack.  The rack attaches to two round cross bars.  No lock.  Send your phone number.,,,,,,,,,,,
1256,10.0,flagstaff,https://flagstaff.craigslist.org/bop/d/flagstaff-new-bike-saddle-and-seat-post/7472654688.html,2022-04-18 06:05,New bike saddle and seat post,,,,,4,Basic seat and post.,,,,,,,,,,,
1257,2750.0,flagstaff,https://flagstaff.craigslist.org/mcy/d/sedona-03-ktm-exc-400/7472549805.html,2022-04-17 17:02,03 Ktm exc 400,,,,,2,Lightly used in good condition Ktm 400. Low miles on engine steering stabilizer electric start. Bike hauls ass.,,,,,,,,,,,
1258,19000.0,flagstaff,https://flagstaff.craigslist.org/rvs/d/flagstaff-1998-chevy-roadtrek-200/7472536695.html,2022-04-17 16:12,1998 Chevy Roadtrek 200 Versatile,,,,,0,"Roadtrek Chevy Versatile 200, 1998 Price: $19,000 Firm VIN: 1GBHG31R2V118753 Type: Class B RV Length: 20.5’ Fuel Type: Gas GVWR: 9500lbs Seats: 4 Sleeps: 4 Mileage: 207,000 Description: This awesome van/RV drives smoothly; comfortably cruises at 75-80 on cruise control; lots of headroom (+6’ clearance in the main part of the van); tons of storage; room to spread-out during inclement weather; higher mileage, yet well-maintained and serviced. With new tires we would load up the family and embark on a 5,000 mile road trip with no hesitation! About 15-17mpg. Second owners, purchased in 2018. All records are on file (from both owners). Since 2018, maintenance performed by Heath’s Automotive in Flagstaff, AZ.  Priced to sell and accounts for the actual condition (tires, minor repairs, cosmetic needs) Interior: •	Bathroom (toilet & shower) •	Queen size bed/ Dining area •	Two twin size beds/ smaller café table with seating for 4 •	Dometic 3-Phase Refrigerator •	Wedgewood 2-burner gas stovetop with Venture hood •	6 Gallon Suburban gas water heater •	Onan 2800 Generation (150 hrs) •	Frigid-Air Conditioner  •	Designated spaced and wired electrical for TV and microwave •	Front seat captain’s chairs swivel •	Lots of internal and exterior storage Exterior: •	Lots of storage •	Shower/water nozzle Maintenance: •	All vehicle maintenance records on hand. •	Improvements since 2018: o	Rear diff serviced o	Front rotors, breaks, and hubs replaced o	Master break cylinder replaced o	Rear drums serviced o	Replaced two piano hinges on exterior hatches o	Replaced toilet flush valve o	LED bulbs throughout o	Moved battery from inconvenient location to more convenient side rear hatch o	Added spare tire hitch mount with bike rack o	Replaced engine battery To-Do List to Continue Enhancements: •	New tires •	Suspected pulley squeak on very cold mornings (likely needs replaced); squeak ends when car starts •	Back hatch is cracked; repair fiberglass (currently repaired, but aestethics are not great) •	New shock in next 5-10,000 miles •	Minimal drip in outside shower faucet •	Observed some leaking during torrential downpour where the AC sits NADA Pricing: https://www.nadaguides.com/RVs/1998/Roadtrek/Versatile-200-Chevrolet/3027023/Values  Video of Interior (different vehicle, same year/model/trim): https://youtu.be/S9Xu6-d-wkk",,,,,,,,,,,
1259,1550.0,flagstaff,https://flagstaff.craigslist.org/bik/d/sedona-2018-scott-spark-940/7472501619.html,2022-04-17 14:14,***2018 Scott Spark 940***,,,,,0,"2018 Scott Spark 940  Has sat in garage for the past year, low miles.  Size- 54cm/Medium  29er Full Suspension   Great bike  show contact info", alloy, mountain, 54cm, 29 in,,,,,,,
1260,9000.0,flagstaff,https://flagstaff.craigslist.org/cto/d/flagstaff-2004-honda-element-ex-manual/7472502779.html,2022-04-17 14:14,2004 Honda Element EX Manual AWD,,,,,16,"2004 Honda Element EX Manual Transmission AWD 4 cyl engine 2.4 174,236 miles Power window's and locks Yakima Roof Rack Receiver Hitch (Used only for Bike Rack) Running Boards Original Element ""Cabana""  Rear Tent Moonroof New tires New Struts New Brakes New Clutch at 152K New Clutch Master Cylinder (last month) No oil leaks or mechanical issues  Comprehensive maintenance records Clean title Asking $9000",,,,,,,,,,,
1261,350.0,flagstaff,https://flagstaff.craigslist.org/hab/d/flagstaff-stationary-bike/7472449625.html,2022-04-17 11:38,Stationary Bike, like new, Sunny,,,7,"Sunny Synergy Pro Magnetic Indoor Cycling Bike  Ergonomically designed, this bike has a rounded multi-grip handlebar and 4-way adjustable seat that can help maintain your comfort and stability while you exercise.  Performance monitor, pulse monitor, device holder, weight rack and water bottle holder.  4 way adjustable seat and 2 way adjustable handle bars.  Heavy duty steel frame with 40lb fly wheel and emergency stop brake.  Clipped in and cages pedals.  Transportation wheels and floor stabilizers.   In fantastic condition. Comes with floor pad.    #cycle #bike #exercise #stationary #fitness",,,,,,,,,,,
1262,1100.0,flagstaff,https://flagstaff.craigslist.org/mat/d/flagstaff-honda-xr70r-dirtbike/7472350624.html,2022-04-17 06:47,Honda XR70R Dirtbike, good,,,,5,"1998 Honda XR70.  Runs great, no leaks.  Dirt bike, XR, CR, 50, 70, 80, 90, 100, Yamaha, Kawasaki,",,,,,,,,,,,
1263,400.0,flagstaff,https://flagstaff.craigslist.org/bik/d/cornville-specialized-ground-control/7472350437.html,2022-04-17 06:43,Specialized Ground Control,,,,,2,"Specialized Ground Control full suspension bike, XTR components, Raceface, Kore Call or text 928-281-five538", aluminum, mountain," 20""", 26 in,,,,,,,
1264,112.0,flagstaff,https://flagstaff.craigslist.org/sgd/d/full-garage-gym-squat-rack-dumbbells/7463276457.html,2022-03-26 11:36,"Full Garage Gym-Squat Rack, Dumbbells- Financing Available", new, BodyKore, G703,,4,"Full Garage Gym Setup- Squat Rack, Adjustable Bench, Dumbbells, Bumper Plates, Rower & More  _____________________________________________________________________________ Offered By: BodyKore Fitness Equipment- 949-503-9266- Text or call for more info _____________________________________________________________________________ We have a huge inventory of Commercial Fitness Equipment. Most of our equipment have lifetime warranties and are built for health clubs and commercial gyms. The same equipment you will use at 24 Hour Fitness, LA Fitness, Anytime Fitness, Chuze Fitness, Planet Fitness, Gold's Gym and more! Our state of the art equipment is offered at low low prices and we even offer Easy Financing! Garage Gym Equipment Package  Commercial Squat Cage and Adjustable Bench 5-50lb Rubber Dumbbell Set w/ Rack 300lb Rubber Olympic Grip Plate Set w/ Bar Choice of Rowing Machine or Air Bike  *Low Price of $4000! Or as low as $140/month  IN STOCK READY TO SHIP! This package doesn't work for you? No problem, Equipment packages are fully customizable. We have plenty of stock! .  ____________________________________________________________________________ Commercial Fitness Equipment: Smith Machines, Leg Press, Hack Squat, Squat Racks, Olympic Benches, Military Benches, Utility Benches, Flat Benches, Lat Machines, Seated Calf Raise, Back Hyperextension, Roman Chairs, Power Towers, Chin/Dip Tower, Vertical Knee Raises (VKR), Dual Adjustable Pulley Systems (DAPS), Plate Loaded Machines, Selectorized Strength Machines, Hip Abductor, Leg Extension, Cable Cross, Chest Press Functional Training Equipment: Group Training Rack Systems, Storage Racks, Crossfit Rigs, Olympic Lifting Platforms, Bumper Plates, Kettlebells, Wall Balls, Slam Balls, TRX, Suspension Trainers, Resistance Bands, Yoga Bands, Yoga Mats, Power Bags, Maces, Clubbells, Battle Ropes, Plyoboxes Cardio Equipment: Treadmills, Ellipticals, Steppers, Stepmills, Air runners, Manual Treadmills, Crosstrainers, Airbikes, Spin Bikes, Recumbant Bikes, Upright Bikes, Climbers, Rowers  _____________________________________________________________________ Financing available. 12 Months NO INTEREST on a 48 month term (on approved credit). Payments as low as $99 per month! FOR MORE PICTURES AND INFORMATION VISIT OUR WEBSITE www.bodykore.com PLEASE CONTACT US AT (949) 325-3088  Precor, Technogym, Rogue, Titan, lifefitness, woodway, star trac, nautilus, Deadlift, bumperplate, olympic bar, crossfit, cross fit, weightlifting, smith machine, squatrack, benchpress, gym equipment, treadmill, airdyne, assault, maces, clubbell, dumb bell, Concept 2, marpo BodyKore Fitness Equipment - QUALITY EQUIPMENT, BEST PRICES, EZ FINANCING! 💥💥💥 12 MONTH ZERO INTEREST WITH NO PRE-PAYMENT PENALTY We have a huge inventory of Commercial Fitness Equipment. Most of our equipment have lifetime warranties and are built for health clubs and commercial gyms. The same equipment you will use at 24 Hour Fitness, LA Fitness, Anytime Fitness, Chuze Fitness, Planet Fitness, Gold's Gym and more! Our state of the art equipment is offered at low low prices and we even offer Easy Financing! apply online : http://www.bodykore.com/finance BodyKore Fitness Equipment Phone: (949) 325-3088 Website: www.bodykore.com 📲 ☎️ Call or text 949-503-9266 for quick answers to your questions about this GARAGE GYM EQUIPMENT PACKAGE Check out some of our other equipment for your home gym:      Your message will always be answered by a real human — never an automated system. Kettlebell, Kettlebells, Olympic, Weights, Bench, Press, Squat, Resistance, Bands, Spin, Bike, Bikes, Spinning, Karate, Kung-Fu, Jiu Jitsu, Judo, Kickboxing, BJJ, JiuJitsu, MMA, Muay Thai, Muaythai, Kickboxing, Boxing, Gloves, Flat, Incline, Decline, Cable Machine, Cardio, Treadmill, Elliptical, Oliptical, Pull-Ups, Chin-Ups, Push-Ups, Chest, Arm, Legs, Bicep, Tricep, Shoulder, Gym Bells, Yoga Mats, Aerobics, Quadriceps, Hamstrings, Glutes, Abs, Stomach, Waist, Fat, Muscle, Body, Calves, Gravity Boots, Extension, Lats, Pulldown, Training, Intense, Extreme, Strength, Endurance, Bumper Plates, Olympic Rings, Appearance, Physical, Sports, Baseball, Basketball, Football, Martial Arts, Soccer, Track & Field, Power, Bodybuilding, Nutrition, Heavy, Bars, Tension, Gympak, Bodykore, Kore, Core, Yoga, Foam, Roller, Brake Pads, Pedal, Exercise, Startrac, Star Trac, Precor, Life Fitness, Lifefitness, Lifestride, Soloflex, Jump Rope, Forarm, Power, Blaster, Aerobics, Swimming, Cross Fit, Cross Kick, Apollo, Bodymasters, Steppers, Climbers, Strength Circuit Machines, Cable Station System, Rubber Flooring, Rubber Floor Mats, Smith Machine, Treadmill Belts, Replacement Parts, Medicine Balls, Punching Bags, Barbells, Racks, Rope, Attachments, Dip Belt, Workout Belt, Ab Straps, Thai Pads, Banana Bag, Kick Pad, Headgear, Power Systems, BOSU, tapout,forearm, bicep, arms, soloflex, body by jake, boflex, ab slider, lower back extension, lat pull down, Olympic rings, squat stands, squat racks, training ropes, climbing ropes, Power Racks, Bumper Plates, Rubber Flooring, Rubber Dumbbells, Cushbell and more!!! Ab / Back Equipment Flat and Olympic Benches Hyperextension Bench & Roman Chair Abdominal Equipment Back Equipment Inversion Tables Fitness Accessories Gym Flooring / Equipment Mats Jump Ropes Weight Training Accessories Door Gym Pull Up Bar Hand Strength & Forearm Cable Attachments Collars & Adapters Heart Rate Monitors Wrist, Ankle and Body Weights Scales & Body Fat Testers Squat Bar Pads Foam Product and Rollers Parts Fitness Exercise Gym Equipment Pull Up Bar, Chin Up Bar, Push up Bar and Dip Bars Reading Racks & Water Bottle Holders Exercise Mats Bosu® Ball Exercise Balls and Accessories Exercise Balls Bars & Collars Resistance Training Weight Pins & Leashes As Seen On TV Back Equipment Inversion Tables Door Gym Pull Up Bar Foam Equipment Packages Olympic Bumper Plates Bars GHDs Kettlebells Free Weight Equipment Medicine Balls Concept 2 Rowers Gymnastics Equipment Dumbbells Sandbags Pull-up Bars Training Accessories Plyometric Boxes D-Balls Mats Jump Ropes Climbing Ropes Flooring Bar Holders Gift Certificates Weight Storage home commercial treadmill treadmills elliptical ellipticals exercise bike bikes stepper steppers abcoaster gym equipment new used refurbished free weight dumbbells circuit strength selectorized Orange Co. Riverside Co. Newport Beach Life Fitness parabody tuff stuff repair service Product and Rollers Benches Flat and Olympic Benches Hyperextension Bench & Roman Chair Abdominal Equipment Back Equipment Boxing / Martial Arts Balazs Boxing Chin and Pull Up Bars TKO Fitness Accessories TKO Medicine and Stability Balls TKO Skip Jump Ropes TKO Vest and Ankle Weights TKO Weightlifting Belts and Straps Pull Up Bar, Chin Up Bar, Push up Bar and Dip Bars treadmill Commercial Fitness Equipment Commercial Ellipticals Cross Trainers Commercial Steppers Commercial Exercise Bikes Commercial Treadmills Commercial Rowing Machines Dumbbell Dumbbells / Weights Used Fitness Equipment Physical Therapy, Medical & Rehabilitation Equipment Aquatics Cardio Equipment Indoor Cycling Bikes and Spin Bikes Dumbbells / Weights Plates Dumbbells Barbell Sets Weight Trees Weight Training Accessories Wrist, Ankle and Body Weights Bars & Collars Hand Strength & Forearm Elliptical Trainers / Cross Trainers",,,,,,,,,,,
1265,100.0,flagstaff,https://flagstaff.craigslist.org/bop/d/flagstaff-surly-revelate-designs/7463212999.html,2022-03-26 10:01,Surly/Revelate Designs Mountain Frame Bag, good, Surly, Mountain Frame Bag," racks, fenders, bags",15,"For sale is a Surly/Revelate Designs Mountain Frame Bag “size #1” (XS/S).  Surly/Revelate makes these bags specifically for their bikes and gives them a sizing system to match, but I wasn’t running this on a surly, just a small/15” hard tail mountain bike. Dimensions of the bag are shown on the chart in the pictures. This bag fits some small and some extra small mountain frames.   Bag was used for some shorter trips. Clean inside and out. Some minor scuffing. No rips or tears. Zippers and Velcro all good.   Retails for $170. Asking $100. Local pickup Flagstaff AZ. Will ship in the US for $10.  Text RC at 608-575-656seven",,,,,,,,,,,
1266,75.0,flagstaff,https://flagstaff.craigslist.org/bik/d/flagstaff-kids-mountain-bike/7472281325.html,2022-04-16 19:38,Kids Mountain Bike, good, Kona, Makena,,6,Kona Makena 20” kids mountain bike.   1x8., aluminum, mountain, Small.  20”, 20 in, u-brakes,,,, none (rigid),,
1267,36000.0,flagstaff,https://flagstaff.craigslist.org/wan/d/williams-grand-design-imagine-22rbe/7472192586.html,2022-04-16 14:24,GRAND DESIGN IMAGINE 22rbe, like new,,,,7,The highest rated rv  This 1/2 ton or suv towable is fully optioned Extra insulation upgraded propane tanks 250 w solar package Heated lighted vibrating theater seats new foam queen bed Rear bath great storage Front lippert bike rack Comes w hitch and equalizer bars,,,,,,, 22,,,,
1268,40.0,flagstaff,https://flagstaff.craigslist.org/spo/d/grand-canyon-terrene-mcfly-mountain/7472191873.html,2022-04-16 14:22,Terrene McFly Mountain Bike Tires,,,,,5,"I have two Terrene McFly Mountain Bike Tires with the Tough Casing, in size 29x2.8.  They are tubeless compatible and great for distance cycling, bikepacking, or cross country on chunky terrain.  Each tire is $40 with the pair being $80.    I live at the Grand Canyon and can meet there, in Tusayan, or I make trips to Flagstaff every couple of weeks so let me know if you want to meet there.",,,,,,,,,,,
1269,149.0,flagstaff,https://flagstaff.craigslist.org/bik/d/flagstaff-excellent-large-commuter-bike/7472115975.html,2022-04-16 11:36,Excellent Large Commuter Bike,,,,,0,,,,,,,,,,,,
1270,1600.0,flagstaff,https://flagstaff.craigslist.org/bop/d/prescott-valley-2016-santa-cruz-nomad/7467194672.html,2022-04-16 07:38,2016 Santa Cruz Nomad CC XL Frame,,,,,0,"2016 Santa Cruz Nomad CC XL 27.5 Frame only  I bought this frame in November, used, built the bike, put less than 100 miles on it and realized it was not the bike for me. Dont get me wrong, The Nomad CC is top of the line, and a slick bike. I am just picky. It does have blemishes, scrapes, bumps and bruises. But man, this thing is clean! Comes with RaceFace BB and Cane Creek head set. Rear shock could possibly need a rebuild.",,,,,,,,,,,
1271,20.0,flagstaff,https://flagstaff.craigslist.org/bop/d/flagstaff-new-tasco-mountain-bike-gloves/7471988258.html,2022-04-16 07:21,New Tasco mountain bike gloves,,,, other,7,"Tasco Double Digits full finger gloves, size XL.  $20/pair.",,,,,,,,,,,
