,Price,Location,URL,Date,Title,num image,text,condition,make / manufacturer,part type,bicycle frame material,bicycle type,frame size,wheel size,model name / number,size / dimensions,brake type,electric assist,handlebar type,suspension,serial number
42732,260.0,seattle,https://seattle.craigslist.org/see/bop/d/seattle-ns-bikes-enigma-29er-wheelset/7460446281.html,2022-04-06 20:20,NS Bikes Enigma 29er Wheelset (New),6,"Brand new, never run. Can be run tubeless if so desired. I can tape it up and add the valve stems for +$20.  NS Bikes Rock & Roll aluminum 29"" rims are solidly built and lightweight. Read more about them here: https://nsbikes.com/enigma-dynamal-rock,204,pl.html  Hubs are 15x100 front, 12x142 rear (non-boost) with the Shimano HG-style freehub offering 5° (72 points) engagement.   Dusty from sitting around, but in brand new condition because, well, they're brand new. I had these as a new set but then ended up selling the bike and my new one isn't the same standard.", new, NS Bikes, wheels and wheel parts,,,,, Enigma, 29in,,,,,
42733,250.0,seattle,https://seattle.craigslist.org/see/bik/d/seattle-burley-tag-along-bikes-kazoo/7467858832.html,2022-04-06 12:54,2 Burley Tag Along Bikes (Kazoo and Piccolo) for sale!,4,"Selling 2 Burley Tag Along Bikes (""Trailercycles""). Very good condition. Single speed Kazoo (blue) and 7-speed Piccolo (green). Attachment rack included. Great for spring and summer family bike rides! Happy to sell separately. $250 each.",, Burley,, aluminum, other, other/unknown, other/unknown, Kazoo/Piccolo,,,,,,
42734,359.0,seattle,https://seattle.craigslist.org/sno/bid/d/marysville-evo-kids-mountain-bikes-24/7467848405.html,2022-04-06 12:29,"Evo Kids Mountain Bikes 24""",0,MTB style cockpit Alloy frame Shimano Tourney 7-speed shifting 24'' wheels Here at Marysville Bike Shop 1511 Grove St in Marysville 360-548-3311,,,, aluminum, mountain, 24, 24 in,,,,,,,
42735,5.0,seattle,https://seattle.craigslist.org/oly/tag/d/olympia-motormax-super-bikes-kawasaki/7466915195.html,2022-04-04 11:06,Motormax Super Bikes Kawasaki 1/24 scale,0,"Motormax Super Bikes Kawasaki motorcycle   I can also ship, but you would need to pay the shipping cost - I accept payments thru paypal  this is a landline phone, so please leave your phone number", new,,,,,,,,,,,,,
42736,110.0,seattle,https://seattle.craigslist.org/see/bik/d/renton-bikes/7456115374.html,2022-04-03 23:02,Bikes,6,I am cleaning up my garage. I do have two bicycles for sale both $110 and I don’t need them anymore because my kids already grow up. The length of the both bicycles are 53”. If you have any questions please call me or text me and my phone number is  show contact info .  Both of them are blue color and one of the bike brand name is a MAGNA and the other one is SCHWINN. See the pictures, good,,, alloy, bmx, Approx 38 inches, 16 in,,,, pedal assist,, other/unknown,
42737,150.0,seattle,https://seattle.craigslist.org/see/bik/d/seattle-20-rei-rev-20-kids-bikes/7466171003.html,2022-04-02 12:31,"20"" REI REV 20 Kids' bikes",2,Two REI Kids' bikes in great condition and ready to ride.  Probably no more than 15 miles on them before my kids outgrew them.   $150 each or both for $250.,, REI,, alloy, kids," 20""", 20 in, REV 20,,,,,,
42738,275.0,seattle,https://seattle.craigslist.org/see/bik/d/seattle-ecocross-hybrid-bamboo-bike/7454246522.html,2022-04-01 14:31,EcoCross Hybrid Bamboo Bike Frameset,12,"I have one in each size, 16"", 18"", and 20"". This is a brand new bike frameset (frame + fork) still in the manufacturer's original, unopened box. Fork is included!  The Greenstar Bikes EcoCross Hybrid Bamboo Frame is a multi-purpose frame that can be used for any number of bike builds: mountain bike, hybrid bike, comfort bike, even a road bike. Perfect for streets, trails and off-roading. The bamboo and recycled 6061 aluminum lugged frame delivers an ultra smooth ride by absorbing micro vibrations. This frame weighs only about 5 pounds. Stunningly available in black. See more details and specs at GreenstarBikes.com", new,,, composite, hybrid/comfort,,,,,,,,,
42739,90.0,seattle,https://seattle.craigslist.org/tac/bop/d/tacoma-bike-rack-56-yakima-bars-and/7458583213.html,2022-04-01 09:29,"Bike rack: 56"" Yakima bars and bike attachments for 2+ bikes",3,"The Yakima bars can be used for many rooftop setups. These are the same bars you can use with ski/snowboard, kayak/canoe, rooftop tent, roofrack and other attachments.  This particular bar and accessory package is for bikes, and I'm including the bed rail cleats in case you own a truck with bed rails that accept the same type on Tacoma trucks. Will knock $15 off if you don't want the cleats.  This setup was used in the bed of an 09 Tacoma   This kit comes with -56"" wide Yakima bars, which fit inside the bed width of at least a 2005-2011 (possibly also later gen) Toyota Tacoma -2 sets of bed rail cleats -one set of bike fork cleats. - One extra set of axle cleats/arms. Use these and buy 2 more rear tire tracks to turn this into a 4 bike rack.  Or, swap these out with the fork cleats so you don't have to take off your front tire. -one set of Yakima tire racks.  Good condition (see pics).  Can meet in Tacoma or Gig Harbor   $90 OBO     Keywords: roof rack",,,,,,,,,,,,,,
42740,1.0,seattle,https://seattle.craigslist.org/see/bik/d/seattle-schwinn-classic-bikes/7453111411.html,2022-03-31 11:30,SCHWINN CLASSIC BIKES,0,"SCHWINN CLASSIC BIKES, SELLING AS A PAIR. ONLY $100 FOR BOTH!",,,, other/unknown, road, 0, other/unknown,,, other/unknown,,, other/unknown,
42741,1500.0,seattle,https://seattle.craigslist.org/sno/spo/d/snohomish-new-bowflex-velocore-exercise/7452764351.html,2022-03-31 09:55,"NEW Bowflex Velocore Exercise Bikes with (22"" console)",0,"I WILL NOT RESPOND TO EMAILS THAT DO NOT INCLUDE YOUR NAME, BEST CONTACT PHONE NUMBER, AND LOCATION.  SORRY- TOO MANY SPAMMERS.  I have Three NEW Velocore 22 available. You choose, NEW IN BOX or NEW out of the box and assembled for you.  Brand New in open box unassembled (I opened the top of box to verify contents).  A JRNY 1 year membership comes with each bike.  Compare to $2400 at local big box store +tax.  Save over $900.  Picture in listing is of similar bike since mine is in the box.  Delivery negotiable.  Keys: home gym, cardio, weights, treadmill, peloton alternative,", new, Bowflex,,,,,, 100963,,,,,,
42742,125.0,seattle,https://seattle.craigslist.org/est/spo/d/mercer-island-lemond-spin-bikes/7465183771.html,2022-03-31 07:35,Lemond Spin Bikes,0,"I have 7 LeMond RevMaster spin bikes from a health club that we are selling. They are about 13 years old and used, but still have a lot of life left! No delivery.", good, LeMond,,,,,, RevMaster,,,,,,
42743,100.0,seattle,https://seattle.craigslist.org/est/for/d/issaquah-new-bike-bicycle-rack-new-in/7464973516.html,2022-03-30 14:21,New! 4-bike bicycle rack - new in box,3,"Brand new bike rack in unopened box. Holds 4 bikes for your family and riding buddies. Roadrunner model from Hollywood Racks. 5 point tie down system keeps bikes rigid, separated, and secure. Cash only.", new, Hollywood Racks,,,,,, Roadrunner - Holds 4 bikes,,,,,,
42744,65.0,seattle,https://seattle.craigslist.org/skc/bop/d/renton-thule-trunk-bike-rack-for-bikes/7464590455.html,2022-03-29 15:46,Thule Trunk Bike Rack for 2 bikes,2,Thule trunk bike carrier. Fits 2 bikes. In good shape. $65 obo,, Thule,,,,,,,,,,,,
42745,75.0,seattle,https://seattle.craigslist.org/see/bik/d/seattle-balance-bikes-for-toddler/7464457652.html,2022-03-29 11:02,Balance Bikes for toddler,0,"ENKEEO Balance Bike was designed to grow with your child. The handlebar (22”-24.8”) and seat (13.7”-17.7”) are both height-adjustable, enabling the balance bike to be ridden by 2 to 5 year old children (weight load up to 110.2 lbs). No need to keep buying new ones for about 3-4 years, unless you want to.  FAST LEARN: designed with no pedal, the balance bike will help your child develop essential bike skills such as balance, steering and coordination; provides a safe, easy and most efficient way for easier transition to pedal bikes DESIGNED FOR SAFETY: puncture-resistant EVA Foam tires - no need to ever inflate, help provide a smooth ride and PP wheel enhance stability; height-adjustable seat allows the feet to reach the ground easily; all materials are eco-friendly and non-toxic, safe for kids to use HIGH PERFORMANCE: constructed of anti-rust carbon steel, the sturdy bike supports up to 110.2lbs.; soft handlebar grips and a contour saddle seat ensure that your child rides in style and comfort ADJUSTABLE: the balance bike features adjustable handlebars (22"" - 24.8"") and seat height (13.7"" - 17.7""), ensuring a best fit for the child’ accommodates for children from 2 - 6 years old under 3.6ft / 110cm; can be adjusted while the child grows up LIGHTWEIGHT: weighing only 5.9lbs. it is easy to carry, perfect for riding exercise no matter the surface (on the playground, the lawn or trail); the lightweight bicycle frame design makes the bike easier to control for kids, ideal for children to start training",,,, other/unknown, kids, 12 in, 12 in,,,,,,,
42746,500.0,seattle,https://seattle.craigslist.org/sno/spo/d/lake-stevens-motus-fusion-spin-bikes/7452836729.html,2022-03-28 18:42,Motus m fusion spin bikes,6,Top notch spin bike.   Sells for 2500 new.   Precor.  Kayser. Lemond.  Schwinn.  Star trac, like new, Motus,,,,,, Fusion,,,,,,
42747,20.0,seattle,https://seattle.craigslist.org/est/bik/d/bellevue-handful-of-kids-bikes-striders/7464010190.html,2022-03-28 10:20,"Handful of kids bikes, striders, boy and girl",20,"I have a handful of bikes for sale. A few striders, a couple pedal bikes.  Striders are great for 2-4 yr olds.  The green pedal bike is probably good for a 3-5 yr old  The blue pedal bike is probably good for a 4-6 yr old   See measurements!  Will post here when items sell.",,,, steel, kids, Medium, 12 in,,,,,,,
42748,2500.0,seattle,https://seattle.craigslist.org/oly/wan/d/olympia-looking-for-scooters-bikes/7463932829.html,2022-03-28 08:02,"Looking for scooters, bikes, mopeds.....",0,"I am looking for weird mopeds, bicycles, mini bikes, scooters, motor scooters and motorcycles.....any condition top $$$$ paid.....text 36zero89zero9zer011....or simply respond to this ad.....Thanks!!!!",,,,,,,,,,,,,,
42749,75.0,seattle,https://seattle.craigslist.org/oly/bik/d/olympia-bikes-that-must-go-take-what/7454617078.html,2022-03-28 06:39,Bikes that must go.. take what ever,2,I have like 6 bikes that have to go today  March 6 th 2022,," Norco, Elite , etc",, other/unknown, other, 24-26, 26 in, Mix,,,,,,
42750,100.0,seattle,https://seattle.craigslist.org/oly/bik/d/olympia-got-three-bikes-that-have-to-go/7455471662.html,2022-03-28 06:40,I got three bikes that have to go asap!!!,2,Different condition bikes that need to go.. lets negotiate. I could do all three bikes between at least I would do is 50. I would like at least 75 for them. I live in Olympia right heart of downtown. All three of them are mountain bikes., fair, Various,, aluminum, mountain, 54, 24 in, Various/mix,, disc (mechanical), none, other/unknown, none (rigid), N/a
42751,110.0,seattle,https://seattle.craigslist.org/kit/bop/d/bremerton-bike-carrier-bikes/7451256194.html,2022-03-27 13:55,Bike Carrier 4 bikes,10,"Land Rover for 2"" receiver, carries 4 bikes or can be shortened for 2, heavy duty swings out so you can open tailgate, bikes can be locked on securily, two keys.", good, LandRover, other,,,,,,,,,,,
42752,50.0,seattle,https://seattle.craigslist.org/skc/bop/d/kent-gravity-rack-for-two-bikes/7456182586.html,2022-03-27 07:57,Gravity rack for two bikes,3,Save space with this heavy duty bike rack for two bikes. Lean against a solid wall and store your bikes. Great for apartment. In excellent condition!,,,,,,,,,,,,,,
42753,375.0,seattle,https://seattle.craigslist.org/est/bik/d/bellevue-rei-coop-drt-bikes-10-xxs-11s/7463463065.html,2022-03-26 21:00,"3 REI COOP DRT Bikes 1.0 XXS, 1.1S, 1.1S (price is per each)",0,"27.5"" REI COOP entry level mountain bike in excellent condition. DETAILED, adjusted, and ready to ride.  Aluminum frame, front suspension, disc brakes, and Shimano components. Perfect for younger kids ready for a larger bike wheel but with a smaller frame. Skip the 24-26"" wheel phase.   DRT 1.0 - Light Blue - XXSmall for 4'7"" to 5'0"" tall kids.   Front suspension Aluminum frame Disc brakes 27.5"" wheel x 2.1"" Kenda tire 24 speed 3 x 8 (front 42/34/24, rear 11-34)  Cash or Venmo only", excellent, REI,, aluminum, mountain, XXS, 27.5 in, DRT 1.0,, disc (hydraulic), none, flat, suspension fork (hardtail),
