,Price,Location,URL,Date,Title,num image,text,condition,make / manufacturer,model name / number,bicycle frame material,bicycle type,brake type,electric assist,frame size,handlebar type,suspension,wheel size,size / dimensions,serial number,part type
68,260.0,auburn,https://atlanta.craigslist.org/nat/wtd/d/buford-michelin-pilot-super-sport-tires/7472650753.html,2022-04-18 08:48,225/35/19 michelin pilot super sport tires,3,"Here I have a matching pair of michein tires with around 95% tread. We offer installation and services if interested.  I HAVE ALOT MORE TIRES IN ALL SIZES AND BRANDS. OVER 2500 TIRES IN STOCK. CONTACT ME WITH YOUR SIZE THROUGH TEXT OR A PHONE CALL. AT 4045383SEVEN11  WE ARE LOCATED RIGHT OFF OF FRIENDSHIP RD EXIT 8 OFF OF I985 AND CAN MEET FROM 7AM TO 9PM SEVEN DAYS A WEEK WITH SCHEDULED TIME. 857014 185/70/14 18570r14 1856014 185/60/14 18560r14 1957014 195/70/14 19570r14 1956014 195/60/14 19560r14 1956015 195/60/15 19560r15 1956515 195/65/15 19565r15 1856515 185/65/15 18565r15 2056015 205/60/15 20560r15 2056515 205/65/15 20565r15 2156515 215/65/15 21565r15 2057015 205/70/15 20570r15 2157015 215/70/15 21570r15 2056516 205/65/16 20565r16 2156016 215/60/16 21560r16 2156015 215/60/15 21560r15 2055516 205/55/16 20555r16 2056016 205/60/16 20560r16 2257516 225/75/16 22575r16 2155516 215/55/16 21555r16 2256016 225/60/16 22560r16 2357515 235/75/15 23575r15 2156516 215/65/16 21565r16 2356516 235/65/16 23565r16 2457516 245/75/16 24575r16 2154517 215/45/17 21545r17 2155517 215/55/17 21555r17 2156517 215/65/17 21565r17 2557016 255/70/16 25570r16 2155017 215/50/17 21550r17 2255517 225/55/17 22555r17 2657017 265/70/17 26570r17 2255516 225/55/16 22555r16 2657517 265/75/16 26575r16 2454518 245/45/18 24545r18 2755520 275/55/20 27555r20 2457016 245/70/16 24570r16 2756020 275/60/20 27560r20 2754018 275/40/18 27540r18 2656517 265/65/17 26565r17 1856514 185/65/14 18565r14 2357015 235/70/15 23570r15 2454520 24545r20 2455020 24550r20 2756020 27560r20 2555020 25550r20 255452025545r20 2157017 21570r17 2256017 22560r17 2355517 23555r17 2358516 23585r16 2457516 24575r16 1955515 19555r15 2155017 21550r172454017 24540r17 2354517 23545r17 2254518 22545r18 2554519 25545r19 2454019 24540r19 2855020 28550r20245/45/17 255/45/17 255/40/17 225/45/17 225/40/17 205/40/17 205/45/17 215/55/17 225/45/17 225/50/17 225/55/17 235/55/17 265/60/17 265/65/17 265/70/17 275/70/17  215/35/18, 215/40/18, 215/45/18, 225/40/18, 235/40/18, 225/45/18, 235/45/18, 245/35/18, 245/40/18, 255/35/18, 255/40/18, 245/45/18, 265/35/18, 265/40/18, 265/45/18, 275/35/18, 215/55/18, 225/50/18, 225/60/18, 235/60/18, 245/60/18 , 245/55/18, 255/55/18, 245/50/18, 265/50/18, 265/60/18, 275/70/18, 265/65/18, 255/65/18, 235/55/18, 275/65/18, 265/70/18, 255/70/18, 275/70/18, 235/50/18, 235/65/18, 225/55/18 245/40/19, 245/45/19, 215/35/19, 215/40/19, 225/35/19, 255/40/19, 245/35/19, 255/35/19, 225/40/19, 265/50/19, 265/40/19, 265/45/19, 265/35/19, 235/55/19, 235/50/19, 275/40/19, 275/35/19, 245/55/19 245/50/19, 225/45/19, 255/45/19, 265/35/19, 275/30/19, 275/35/19, 275/40/19 275/45/19, 285/30/19, 285/35/19, 285/40/19, 285/45/19, 295/30/19, 295,35,19, 305/30/19, 305/35/19, 315/30/19,  315/35/20 245 60 20, 255 50 20, 255 55 20, 265 50 20, 245 50 20, 235/55/20, 275/55/20, 275/60/20, 275/65/20, 285/50/20, 275/50/20, 245/45/20, 245/40/20, 235/50/20, 235/45/20, 235/40/20, 245/35/20, 245/40/20, 255/50/20, 255/45/20, 265/40/20, 265/45/20, 275/40/20, 275/45/20, 225/35/20, 225/40/20, 285/35/20, 285/35/20, 295/30/20, 295/35/20, 305/30/20, 305/35/20, 315/35/20, 335/25/20 255/35/21, 255/40/21, 265/30/21, 265/35/21, 265/40/21, 275/30/21, 275/35/21, 295/35/21, 295/40/21 245/30/22, 265/30/22, 285/40/22, 325/35/22, tires, suv, porche, honda, bmw, cars, mazda, lexus, mercedes ,toys, bikes, pool, summer, road trip, mechanic, automotive, repairhonda, bmw, cars, mazda, lexus, mercedes  Federal, Federal Couragia MT, Nitto, Nitto Terra Grappler, Nitto Mud Grappler, Nitto Exo Grappler AWT, Nitto Trail Grappler, Nitto Ridge Grappler, Radar Renegade R7, Kenda, Kenda KR29, Kanati Mud Hog, Maxxis Buckshot Mudder, Maxxis Bighorn, Mud Claw MT, Mud Claw Radial MT, Lexani Mud Beast, Lexani Mud Beast MT, Lionhart Lionclaw MT, Nankang Mud Star, Dick Cepek, Mastercraft, Thunderer Trac Grip MT, Achilles Desert Hawk XMT, Atturo Trail Blade MT, Milestar Patagonia MT, Fierce Attitude MT, Mickey Thompson, Hankook Dynapro, Kumho Road Venture MT, BF Goodrich, Cooper Discoverer STT Pro, Goodyear Wrangler, Gladiator X Comp Mt, Maxtrek, Suretrak, GT Radial Adventuro MT, Lexani, Lexani RBP Repulsor MT, Pit Bull, Interco, Super Swamper, Super Swampers, LTB, LTB's, Bogger, LTB, TSL, IROK, General Grabber, Comforser CF3000 MT, Antares Deep Digger MT, Powertrac Power Rover MT, Maxxis Trepador Radial, Maxxis Trepador Bias Ply, Maxxis Creepy Crawler, General Grabber X3, 205/55R16, 205 55 16, 205-55-16, P205/55R16, P205 55 16, P205-55-16, 205556, 215/60R16, 215 60 16, 215-60-16, P215/60R16, P215 60 16, P215-60-16, 225/60R16, 225 60 16, 225-60-16, P225/60R16, P225 60 16, P225-60-16, 235/75R15, 235 75 15, 235-75-15, P235/75R15, P235 75 15, P235-75-15, 265/70R17, 265 70 17, P265-70-16, P265/70R17, P265 70 17, LT265-70-16, LT265/70R17, LT265 70 17, LT265-70-16, 195/65R15, 195 65 15, 195-65-15, 195/60R15, 215/60R16, 215 60 16, 205/55R16, 205 55 16, 225/60R16, 225 60 16, LT265/75R18, 245/70R16, 245 70 16, 245-70-16, P245/70R16, P245 70 16, P245-70-16, LT245/70R16, LT245 70 16, LT245-70-16, 225/50R17, 265 75 18, 225 50 17, 37 13.5 20, 37x13.50R18LT, 37 13.50 18, 37 13.5 18, LT37x13.50R17, 37 13.50 17, 37x1350x17, 37 13.5 17, 37x12.50R17LT, 37 12.50 17, 37 12.5 17, 36x15.50R20LT, 36 15.50 20, 36 15.5 20, 205/50R16, 235/50R18, 265/70R16, 205 50 16, 235 50 18, 265 70 16, LT255/85R16, 255 85 16, LT275/70R18, 275 70 18, LT285/60R20, 285 60 20, LT305/55R20, 305 55 20, LT285/70R17, 285 70 17, LT325/60R18, 325 60 18, LT325/50R20, 225/60R16, 215/60R16, 205/55R16, P235/75R15, P265/70R17, 195/65R15, 195 60 15, 215/65R16, 215 65 16, P215/55R17, 215 55 17, P275/55R20, 275 55 20, P275/65R18, 275 65 18, LT245/75R16, 245 75 16, LT265/75R16, 265 75 16, 245/65R17, 275/70R18, 275/60R15, 245 65 17, 275 70 18, 275 60 15, 36x15.50R15LT, 36 15.50 15, 36 15.5 15, 35x13.50R20LT, 35 13.50 20, 35 13.5 20, 35x12.50R20LT, 35 12.50 20, 35 12.5 20, 35x12.50R18LT, 35 12.50 18, 35 12.5 18, 35x12.50R17LT, 235 75 15, 265 70 17, 195 65 15, 315/35R17, 28x10.50R15, 245/45R20, 315 35 17, 28 10.50 15, 28 10.5 15, 245 45 20, 325 50 20, LT305/70R16, 305 70 16, LT305/65R17, 305 65 17, LT375/50R18, 375 50 18, LT285/75R16, 285 75 16, LT295/65R18, 295 65 18, LT375/55R16, 375 55 16, LT265/70R17, 265 70 17, LT225/75R16, 225 75 16, LT235/85R16, 235 85 16, LT285/75R16, 285 75 16, LT245/75R17, 245 75 17, LT215/85R16, 215 85 16, LT285/70R17, 195 60 15, 215 65 16, 215 55 17, 35 12.50 17, 35 12.5 17, 35x12.50R15LT, 35 12.50 15, 35 12.5 15, 33x12.50R20LT, 33 12.50 20, 33 12.5 20, 33x12.50R18LT, 33 12.50 18, 33 12.5 18, 33x12.50R17LT, 33 12.50 17, 275/60R20, LT315/75R16, 305/35R18, 275 60 20, 315 75 16, 305 35 18, 205 40 16, 205 60 16, 185 65 14, LT275/70R17, 275 70 17, LT305/60R18, 305 60 18, LT375/55R16, 375 55 16, LT255/75R17, 255 75 17, LT275/65R18, 275 65 18, LT315/70R15, 315 70 15, LT265/70R17, P275/55R20, P275/65R18, LT245/75R16, 285 70 17, LT265/75R18, 265 75 18, 275/60R15, 275 60 15, 275/60R20, 275 60 20, 225/70R16, 225 70 16, 265/70R16, 265 70 16, 42x14.50R17LT, 42 14.50 17, 35x12.50R15, 285/65R20, 225/70R14, 35 12.50 15, 35 12.5 15, 285 65 20, 225 70 14, 33 12.5 17, 33x12.50R16.5LT, 33 12.50 16.5, 33 12.5 16.5, 33x12.50R15LT, 33 12.50 15, 33 12.5 15, 32x11.50R15LT, 32 11.50 15, 32 11.5 15, 31x10.50R16.5LT, 31 10.50 16.5, 31 10.5 16.5, 275 55 20, 275 65 18, 245 75 16, 305/35R20, LT325/65R18, 35x12.50R20, 305 35 20, LT 325 65 18, 35 12.50 20, 35 12.5 20, 265 70 17, LT345/55R17, 345 55 17, LT245/75R17, 245 75 17, LT265/75R16, 265 75 16, LT235/85R16, 235 85 16, LT265/75R16, 265 75 16, LT215/85R16, 215 85 16, LT265/75R16, LT265/70R17, LT225/75R16, 42 14.5 17, 42x13.50R20LT, 42 13.50 20, 42 13.5 20, 42x13.50R18LT, 42 13.50 18, 42 13.5 18, 42x13.50R17LT, 42 13.50 17, 42 13.5 17, 35x12.50R17, 265/70R15, 33x12.50R15, 35 12.50 17, 35 12.5 17, 265 70 15, 33 12.50 15, 33 12.5 15, 31x11.50R15LT, 31 11.50 15, 31 11.5 15, 31x10.50R15LT, 31 10.50 15, 31 10.5 15, 30x9.50R15LT, 30 9.50 15, 30 9.5 15, 29x9.50R15LT, 29 9.50 15, 29 9.5 15, 27x8.50R14LT, 265 75 16, 265 70 17, 225 75 16, 215/70R15, P225/60R17, 195/50R15, 215 70 15, 225 60 17, 195 50 15, LT245/70R17, 245 70 17, LT245/75R16, 245 75 16, LT345/55R16, 345 55 16, LT285/70R15, 285 70 15, LT325/60R15, 325 60 15, LT225/75R16, 225 75 16, LT285/60R16, LT235/85R16, LT285/75R16, LT245/75R17, 38.5x14.50R20LT, 38.5 14.50 20, 38.5 14.5 20, 38x14.00R24LT, 38 14.00 24, 38 14 24, 38x15.50R20LT, 38 15.50 20, 38 15.5 20, 38x15.50R18LT, 38 15.50 18, 38 15.5 18, 38x15.50R15LT, 235 85 16, 285 75 16, 245 75 17, 225/70R16, 255/50R17, 235/70R16, 225 70 16, 255 50 17, 235 70 16, 27 8.50 14, 27 8.5 14, LT395/70R16, 395 70 16, LT395/65R18, 395 65 18, LT325/80R16, 325 80 16, LT375/60R18, 375 60 18, LT305/70R18, 305 70 18, LT285/65R20, LT275/65R20, LT245/70R17, 265/65R18, LT 275 65 20, LT 245 70 17, 265 65 18, 285 60 16, LT315/55R16, 315 55 16, LT235/75R15, 235 75 15, LT225/75R15, 225 75 15, LT245/65R15,245 65 15, LT35/12.50R24, 35-1250-24, 35-12.50-24, 37/13.50R24, 37-1250-24, 38/13.50R24, 40/15.50R24, 40-15.50-24, 40-1550-24, LT215/75R15, LT205/75R15, 205 75 15, LT195/75R15, 195 75 15, 31x10.50R15, LT215/85R16, LT285/70R17, 38 15.50 15, 38 15.5 15, 37x14.00R24LT, 37 14.00 24, 37 14 24, 37x13.50R22LT, 37 13.50 22, 37 13.5 22, 37x13.50R20LT, 37 13.50 20, 31 10.50 15, 31x10.5x 15, 215 85 16, 285 70 17, 32x11.50R15, 245/70R17, 255/70R16, 32 11.50 15, 32 11.5 15, 245 70 17, 255 70 16, 285 65 20, LT285/75R18, 285 75 18, LT325/65R18, 325 65 18, LT315/70R17, 315 70 17, LT275/65R20, 275 65 20, LT315/75R16, 315 75 16, LT305/70R17, 305 70 17,  31x10.50x15, 31x10.50x17, 31x10.50x18, 31x10.50x20, 31x1050x15, 31x1050x17, 31x1050x18, 31x1050x20, 31 10.50 15, 31 10.50 17, 31 10.50 18, 31 10.50 20, 31 1050 15, 31 1050 17, 31 1050 18, 31 1050 20, 31/10.50R15, 31/10.50R17, 31/10.50R18, 31/10.50R20, 31/1050R15, 31/1050R17, 31/1050R18, 31/1050R20, LT31x10.50x15, LT31x10.50x17, LT31x10.50x18, LT31x10.50x20, LT31x1050x15, LT31x1050x17, LT31x1050x18, LT31x1050x20, LT31 10.50 15, LT31 10.50 17, LT31 10.50 18, LT31 10.50 20, LT31 1050 15, LT31 1050 17, LT31 1050 18, LT31 1050 20, LT31/10.50R15, LT31/10.50R17, LT31/10.50R18, LT31/10.50R20, LT31/1050R15, LT31/1050R17, LT31/1050R18, LT31/1050R20 33x12.50x15, 33x12.50x17, 33x12.50x18, 33x12.50x20, 33x1250x15, 33x1250x17, 33x1250x18, 33x1250x20, 33 12.50 15, 33 12.50 17, 33 12.50 18, 33 12.50 20, 33 1250 15, 33 1250 17, 33 1250 18, 33 1250 20, 33/12.50R15, 33/12.50R17, 33/12.50R18, 33/12.50R20, 33/1250R15, 33/1250R17, 33/1250R18, 33/1250R20, LT33x12.50x15, LT33x12.50x17, LT33x12.50x18, LT33x12.50x20, LT33x1250x15, LT33x1250x17, LT33x1250x18, LT33x1250x20, LT33 12.50 15, LT33 12.50 17, LT33 12.50 18, LT33 12.50 20, LT33 1250 15, LT33 1250 17, LT33 1250 18, LT33 1250 20, LT33/12.50R15, LT33/12.50R17, LT33/12.50R18, LT33/12.50R20, LT33/1250R15, LT33/1250R17, LT33/1250R18, LT33/1250R20 33x12.50x16.50, 33x1250x16.50, 33 12.50 16.50, 33 1250 16.50, 33/12.50R16.50, 33/1250R16.50, LT33x12.50x16.50, LT33x1250x16.50, LT33 12.50 16.50, LT33 1250 16.50, LT33/12.50R16.50, LT33/1250R16.50, 33x12.50x1650, 33x1250x1650, 33 12.50 1650, 33 1250 1650, 33/12.50R1650, 33/1250R1650, LT33x12.50x1650, LT33x1250x1650, LT33 12.50 1650, LT33 1250 1650, LT33/12.50R1650, LT33/1250R1650, 33x12.50x16.5, 33x1250x16.5, 33 12.50 16.5, 33 1250 16.5, 33/12.50R16.5, 33/1250R16.5, LT33x12.50x16.5, LT33x1250x16.5, LT33 12.50 16.5, LT33 1250 16.5, LT33/12.50R16.5, LT33/1250R16.5, 33x12.5x16.5, 33x125x16.5, 33 12.5 16.5, 33 125 16.5, 33/12.5R16.5, 33/125R16.5, LT33x12.5x16.5, LT33x125x16.5, LT33 12.5 16.5, LT33 125 16.5, LT33/12.5R16.5, LT33/125R16.5, 35x12.50x15, 35x12.50x17, 35x12.50x18, 35x12.50x20, 35x1250x15, 35x1250x17, 35x1250x18, 35x1250x20, 35 12.50 15, 35 12.50 17, 35 12.50 18, 35 12.50 20, 35 1250 15, 35 1250 17, 35 1250 18, 35 1250 20, 35/12.50R15, 35/12.50R17, 35/12.50R18, 35/12.50R20, 35/1250R15, 35/1250R17, 35/1250R18, 35/1250R20, LT35x12.50x15, LT35x12.50x17, LT35x12.50x18, LT35x12.50x20, LT35x1250x15, LT35x1250x17, LT35x1250x18, LT35x1250x20, LT35 12.50 15, LT35 12.50 17, LT35 12.50 18, LT35 12.50 20, LT35 1250 15, LT35 1250 17, LT35 1250 18, LT35 1250 20, LT35/12.50R15, LT35/12.50R17, LT35/12.50R18, LT35/12.50R20, LT35/1250R15, LT35/1250R17, LT35/1250R18, LT35/1250R20 35x13.50x15, 35x13.50x17, 35x13.50x18, 35x13.50x20, 35x1350x15, 35x1350x17, 35x1350x18, 35x1350x20, 35 13.50 15, 35 13.50 17, 35 13.50 18, 35 13.50 20, 35 1350 15, 35 1350 17, 35 1350 18, 35 1350 20, 35/13.50R15, 35/13.50R17, 35/13.50R18, 35/13.50R20, 35/1350R15, 35/1350R17, 35/1350R18, 35/1350R20, LT35x13.50x15, LT35x13.50x17, LT35x13.50x18, LT35x13.50x20, LT35x1350x15, LT35x1350x17, LT35x1350x18, LT35x1350x20, LT35 13.50 15, LT35 13.50 17, LT35 13.50 18, LT35 13.50 20, LT35 1350 15, LT35 1350 17, LT35 1350 18, LT35 1350 20, LT35/13.50R15, LT35/13.50R17, LT35/13.50R18, LT35/13.50R20, LT35/1350R15, LT35/1350R17, LT35/1350R18, LT35/1350R20, 35x14.50x15, 35x14.50x17, 35x14.50x18, 35x14.50x20, 35x1450x15, 35x1450x17, 35x1450x18, 35x1450x20, 35 14.50 15, 35 14.50 17, 35 14.50 18, 35 14.50 20, 35 1450 15, 35 1450 17, 35 1450 18, 35 1450 20, 35/14.50R15, 35/14.50R17, 35/14.50R18, 35/14.50R20, 35/1450R15, 35/1450R17, 35/1450R18, 35/1450R20, LT35x14.50x15, LT35x14.50x17, LT35x14.50x18, LT35x14.50x20, LT35x1450x15, LT35x1450x17, LT35x1450x18, LT35x1450x20, LT35 14.50 15, LT35 14.50 17, LT35 14.50 18, LT35 14.50 20, LT35 1450 15, LT35 1450 17, LT35 1450 18, LT35 1450 20, LT35/14.50R15, LT35/14.50R17, LT35/14.50R18, LT35/14.50R20, LT35/1450R15, LT35/1450R17, LT35/1450R18, LT35/1450R20,36x12.50x15, 36x12.50x17, 36x12.50x18, 36x12.50x20, 36x1250x15, 36x1250x17, 36x1250x18, 36x1250x20, 36 12.50 15, 36 12.50 17, 36 12.50 18, 36 12.50 20, 36 1250 15, 36 1250 17, 36 1250 18, 36 1250 20, 36/12.50R15, 36/12.50R17, 36/12.50R18, 36/12.50R20, 36/1250R15, 36/1250R17, 36/1250R18, 36/1250R20, LT36x12.50x15, LT36x12.50x17, LT36x12.50x18, LT36x12.50x20, LT36x1250x15, LT36x1250x17, LT36x1250x18, LT36x1250x20, LT36 12.50 15, LT36 12.50 17, LT36 12.50 18, LT36 12.50 20, LT36 1250 15, LT36 1250 17, LT36 1250 18, LT36 1250 20, LT36/12.50R15, LT36/12.50R17, LT36/12.50R18, LT36/12.50R20, LT36/1250R15, LT36/1250R17, LT36/1250R18, LT36/1250R20 36x13.50x15, 36x13.50x17, 36x13.50x18, 36x13.50x20, 36x1350x15, 36x1350x17, 36x1350x18, 36x1350x20, 36 13.50 15, 36 13.50 17, 36 13.50 18, 36 13.50 20, 36 1350 15, 36 1350 17, 36 1350 18, 36 1350 20, 36/13.50R15, 36/13.50R17, 36/13.50R18, 36/13.50R20, 36/1350R15, 36/1350R17, 36/1350R18, 36/1350R20, LT36x13.50x15, LT36x13.50x17, LT36x13.50x18, LT36x13.50x20, LT36x1350x15, LT36x1350x17, LT36x1350x18, LT36x1350x20, LT36 13.50 15, LT36 13.50 17, LT36 13.50 18, LT36 13.50 20, LT36 1350 15, LT36 1350 17, LT36 1350 18, LT36 1350 20, LT36/13.50R15, LT36/13.50R17, LT36/13.50R18, LT36/13.50R20, LT36/1350R15, LT36/1350R17, LT36/1350R18, LT36/1350R20,37x12.50x15, 37x12.50x17, 37x12.50x18, 37x12.50x20, 37x1250x15, 37x1250x17, 37x1250x18, 37x1250x20, 37 12.50 15, 37 12.50 17, 37 12.50 18, 37 12.50 20, 37 1250 15, 37 1250 17, 37 1250 18, 37 1250 20, 37/12.50R15, 37/12.50R17, 37/12.50R18, 37/12.50R20, 37/1250R15, 37/1250R17, 37/1250R18, 37/1250R20, LT37x12.50x15, LT37x12.50x17, LT37x12.50x18, LT37x12.50x20, LT37x1250x15, LT37x1250x17, LT37x1250x18, LT37x1250x20, LT37 12.50 15, LT37 12.50 17, LT37 12.50 18, LT37 12.50 20, LT37 1250 15, LT37 1250 17, LT37 1250 18, LT37 1250 20, LT37/12.50R15, LT37/12.50R17, LT37/12.50R18, LT37/12.50R20, LT37/1250R15, LT37/1250R17, LT37/1250R18, LT37/1250R2037x13.50x15, 37x13.50x17, 37x13.50x18, 37x13.50x20, 37x1350x15, 37x1350x17, 37x1350x18, 37x1350x20, 37 13.50 15, 37 13.50 17, 37 13.50 18, 37 13.50 20, 37 1350 15, 37 1350 17, 37 1350 18, 37 1350 20, 37/13.50R15, 37/13.50R17, 37/13.50R18, 37/13.50R20, 37/1350R15, 37/1350R17, 37/1350R18, 37/1350R20, LT37x13.50x15, LT37x13.50x17, LT37x13.50x18, LT37x13.50x20, LT37x1350x15, LT37x1350x17, LT37x1350x18, LT37x1350x20, LT37 13.50 15, LT37 13.50 17, LT37 13.50 18, LT37 13.50 20, LT37 1350 15, LT37 1350 17, LT37 1350 18, LT37 1350 20, LT37/13.50R15, LT37/13.50R17, LT37/13.50R18, LT37/13.50R20, LT37/1350R15, LT37/1350R17, LT37/1350R18, LT37/1350R20,37x12.50x16.50, 37x1250x16.50, 37 12.50 16.50, 37 1250 16.50, 37/12.50R16.50, 37/1250R16.50, LT37x12.50x16.50, LT37x1250x16.50, LT37 12.50 16.50, LT37 1250 16.50, LT37/12.50R16.50, LT37/1250R16.50, 37x12.50x1650, 37x1250x1650, 37 12.50 1650, 37 1250 1650, 37/12.50R1650, 37/1250R1650, LT37x12.50x1650, LT37x1250x1650, LT37 12.50 1650, LT37 1250 1650, LT37/12.50R1650, LT37/1250R1650,37x12.50x16.5, 37x1250x16.5, 37 12.50 16.5, 37 1250 16.5, 37/12.50R16.5, 37/1250R16.5, LT37x12.50x16.5, LT37x1250x16.5, LT37 12.50 16.5, LT37 1250 16.5, LT37/12.50R16.5, LT37/1250R16.5,38x12.50x15, 38x1250x15, 38 12.50 15, 38 1250 15, 38 12.5 15, 38x12.5x15, 38-12.50-15, 38-1250-15, 38-12.5-15, 38/12.50R15, 38/1250R15, 38/12.5R15, LT38x12.50x15, LT38x1250x15, LT38 12.50 15, LT38 1250 15, LT38 12.5 15, LT38x12.5x15, LT38-12.50-15, LT38-1250-15, LT38-12.5-15, LT38/12.50R15, LT38/1250R15, LT38/12.5R15, 38x13.50x15, 38x13.50x17, 38x13.50x18, 38x13.50x20, 38x1350x15, 38x1350x17, 38x1350x18, 38x1350x20, 38 13.50 15, 38 13.50 17, 38 13.50 18, 38 13.50 20, 38 1350 15, 38 1350 17, 38 1350 18, 38 1350 20, 38/13.50R15, 38/13.50R17, 38/13.50R18, 38/13.50R20, 38/1350R15, 38/1350R17, 38/1350R18, 38/1350R20, LT38x13.50x15, LT38x13.50x17, LT38x13.50x18, LT38x13.50x20, LT38x1350x15, LT38x1350x17, LT38x1350x18, LT38x1350x20, LT38 13.50 15, LT38 13.50 17, LT38 13.50 18, LT38 13.50 20, LT38 1350 15, LT38 1350 17, LT38 1350 18, LT38 1350 20, LT38/13.50R15, LT38/13.50R17, LT38/13.50R18, LT38/13.50R20, LT38/1350R15, LT38/1350R17, LT38/1350R18, LT38/1350R20, 38x14.50x15, 38x14.50x17, 38x14.50x18, 38x14.50x20, 38x1450x15, 38x1450x17, 38x1450x18, 38x1450x20, 38 14.50 15, 38 14.50 17, 38 14.50 18, 38 14.50 20, 38 1450 15, 38 1450 17, 38 1450 18, 38 1450 20, 38/14.50R15, 38/14.50R17, 38/14.50R18, 38/14.50R20, 38/1450R15, 38/1450R17, 38/1450R18, 38/1450R20, LT38x14.50x15, LT38x14.50x17, LT38x14.50x18, LT38x14.50x20, LT38x1450x15, LT38x1450x17, LT38x1450x18, LT38x1450x20, LT38 14.50 15, LT38 14.50 17, LT38 14.50 18, LT38 14.50 20, LT38 1450 15, LT38 1450 17, LT38 1450 18, LT38 1450 20, LT38/14.50R15, LT38/14.50R17, LT38/14.50R18, LT38/14.50R20, LT38/1450R15, LT38/1450R17, LT38/1450R18, LT38/1450R20 15"", 15 inch, 16"", 16 inch, 16.5"", 16.5 inch, 16.50"", 16.50 inch, 17"", 17 inch, 18"", 18 inch, 19"", 19 inch, 20"", 20 inch, 21"", 21 inch, 22"", 22 inch, 23"", 23 inch, 24"", 24 inch, 26"", 26 inch, 28"", 28 inch",,,,,,,,,,,,,,
69,1.0,auburn,https://columbusga.craigslist.org/snw/d/albany-motorcycle-atv-and-small-engine/7466202040.html,2022-04-18 07:58,"Motorcycle, ATV, and small engine Repair",9,"Been working on motorcycles for a long time now, for personal use or for friends and family. I can mostly work on any bike, from doing routine maintenance to engine rebuilds. Vintage motorcycles and dirt bikes are my bread and butter. Also willing to work on ATVs or anything with a small engine like mopeds, lawn mowers, weed wackers, chainsaws, etc. Shop rate is $45/hour. Call or text me at  show contact info",,,,,,,,,,,,,,
70,495.0,auburn,https://atlanta.craigslist.org/nat/bik/d/marietta-1950-schwinn-panther-balloon/7472631779.html,2022-04-18 07:21,1950 Schwinn Panther Balloon Tire with Delta Jet Rocket Headlight!,12,"Got the frame, fenders, chainguard and rack as a lot. This is an old repaint. Added an excellent vintage crank arm / chain sprocket with new Schwinn reproduction brick style pedals. New Cushy chrome 3 spring saddle. Correct vintage Wald handlebars. Schwinn approved waterslide decals. Schwinn S-2's with vintage Schwinn Typhoon Cord tires  This antique would be a great candidate to fully restore as the old repaint has kept it rust free.   Or have the coolest cruiser on the beach.  Lots of other vintage bikes for sale.  Prop rental available.  Cash only. Local only. No shipping  Call or text Mike", good, Schwinn, Panther, steel, cruiser, coaster, none," 18 """, cruiser, none (rigid), 26 in,,,
71,300.0,auburn,https://atlanta.craigslist.org/nat/bik/d/atlanta-raleigh-talon-ladies-21-spd/7472615289.html,2022-04-18 03:23,Raleigh Talon Ladies 21 spd Hybrid Ready2Ride fits 5'7-5'11,17,Got this for my mom and she isn't going to ride bikes so we don't need it!  Made in USA Weinmann Wheels  Shimano GS Shifters  Extra padded seat with shocks    Everything works well  show contact info,,,, steel, hybrid/comfort,,, 19in,,, 26 in,,,
72,725.0,auburn,https://atlanta.craigslist.org/eat/bik/d/lithonia-cannondale-jekyll-full/7472602648.html,2022-04-18 00:47,Cannondale Jekyll Full Suspension Mountain Bike,0,,,,,,,,,,,,,,,
