,Price,Location,URL,Date,Title,condition,make / manufacturer,model name / number,part type,num image,text,bicycle frame material,bicycle type,frame size,wheel size,brake type,handlebar type,size / dimensions,electric assist,suspension,paint color,year manufactured
1197,145.0,flagstaff,https://flagstaff.craigslist.org/bop/d/sedona-topeak-dual-touch-bike-stand/7471896228.html,2022-04-15 20:14,Topeak Dual-Touch Bike Stand 2 Bikes, excellent, Topeak, Dual-Touch Bike Stand, other,14,Topeak Dual-Touch Bike Stand: 2-bike   $ 145.00 Each Bike Stand or $ 275.00 for Both ......  MAX WEIGHT CAPACITY18 kg / 39.7 lb (Per Hook) 72 kg / 158.7 lb (Per Stand)  SIZE320 x 44 x 18 cm / 126” x 17.3” x 7.1” (Open) 190 cm / 74.8” (Folded)  WEIGHT 5 kg / 11.02 lb,,,,,,,,,,,
1198,200.0,flagstaff,https://flagstaff.craigslist.org/bik/d/flagstaff-quality-used-bikes-for-sale/7461047507.html,2022-04-15 09:29,Quality Used Bikes for sale!,,,,,0,"Hello, I run a quality used bike shop (www.flagstaffbikes.org), and carry a large range of bikes. All my bikes come in good working condition. Email me with your height and the type of bike you’re looking and I’ll let you know what I have available.  Cheers, Adam", other/unknown, other, all sizes, other/unknown,,,,,,,
1199,295.0,flagstaff,https://flagstaff.craigslist.org/bik/d/rimrock-brand-new-2022-framed-freestyle/7467301293.html,2022-04-14 21:09,2 brand new 2022 framed freestyle bikes, new, framed,,,2,2 brand new framed 2022 bikes never been used 1 black slick 1 white polished 295 each obo or poss trade ? Take them both for a package price 928 three 00 eight 270, aluminum, bmx, 20, 20 in, caliper, bmx,,,,,
1200,10.0,flagstaff,https://flagstaff.craigslist.org/bop/d/flagstaff-kona-bikes-saddle/7471301919.html,2022-04-14 12:13,Kona Bikes saddle,,,,,0,,,,,,,,,,,,
1201,2295.0,flagstaff,https://flagstaff.craigslist.org/sgd/d/electric-the-mid-drive-ebike-that/7468107372.html,2022-04-07 06:55,ELECTRIC! The Mid-drive eBike that Shreds! CyberBike eMountain Bikes!, new, Cyberbike,,,15,"Introducing the New 2022 Cyberbike Electric Mountain Bikes   Riders agree: Nothing comes close to Cyberbike's combination of performance, value, style, and quality.  See the Cyberbike Mullet Pro in action HERE! (and here, by popular demand, is last year's intro featuring Division 1 Collegiate Mountain Racer Corey Jackson on the first edition Cyberbike) Order online for fast delivery at www.Cyberbike.com All 2022 Cyberbikes are in stock and ready to shred, Order yours before they're sold out!  More mid-drive power than ever Awesome new color graphic display Easier to ride, lower standover frame, the lowest of any mid-drive eMTB New, structurally superior, mountain ready rear suspension linkage The best brakes in the business, even Quad-piston brakes on some models! Massive brake rotors up to 220mm 34mm gold tube forks on some models up to 140mm travel Wider range of models  A proper e-Mountain bike needs to be mid-drive and have full suspension, it's as simple as that. Until now, if you wanted an electric mountain bike to tackle rugged trails, your choices have been heavy, low-quality, fat tire, hub-motor beach bikes, or legacy brands charging $4000 or more for low-power eBikes without full suspension.   Whether your knees are tired or you just want to shred, there is simply no better choice for performance and value than Cyberbike. An American company with great customer support: Cyberbike, USA. The mountains are calling. Will you answer?  Cyberbike eBikes come all with the quietest and most powerful motor in its class, with a long range (65 miles and more) battery, and powerful e-spec hydraulic disk brakes that will be there when you need them. A lightweight package with 500 watts of power, top-of-the-line battery range, and quality components, all for the price of an inexpensive yet stellar bike! You'll get so much more than other eBikes with the CyberBike, it's the real e-MTB experience for the adventurous rider. Performance, specs, and quality components throughout, and the best warranty in the industry, from an American company with experienced American mechanics on call for all your tech support needs.  54 volt/500 watt climbing power with 13Amp hour Li-Ion battery and only 52 lbs means you'll get power and tons of battery range. Now with available throttle! Now from only $2495 Note: Owning and riding comes with risks. Wear proper protection, properly maintain and check your bike, and ride within your limits. By purchasing our products you agree to take full responsibility for the ownership of your bike, including the above and all other reasonable precautions for yourself or anyone you allow to ride your bike.",,,,,,,,,,,
1202,125.0,flagstaff,https://flagstaff.craigslist.org/bik/d/clarkdale-bikes-parts-art-mountain-bike/7455806147.html,2022-04-04 13:46,"BIKES, PARTS, ART, MOUNTAIN BIKE, BEACH CRUISER, SCHWINN, GIANT",,,,,17,"BIKES, PARTS, ART, MOUNTAIN BIKE, BEACH CRUISER, SCHWINN, GIANT  DESCRIPTION SELLING AS ONE LOT, NOT INDIVIDUALLY.  One Large lot of used bicycles. 21- plus bikes, full and partial. rims, tires, forks, frames, etc. I am a metal artist and going through my yard and thinning out items I do not need or have immediate plans for, before a possible move. These bikes have been sitting outside for awhile, have rust on some of them, a few are aluminum frame, most are steel, many aluminum and steel wheels also go with the lot. I had plans on making a giant outdoor bike sculpture out of the parts, but do not have the time while remodeling before selling. If you are creative and would like to make something out of these to be creative, you cant go wrong.   SPECIFICATIONS Various brands, mountain, street, kids, ladies, beach cruiser, etc.  USES AND IDEAS Art sculptures for indoor or out doors, tables, lamps, gears and pulleys, invent your own bike, etc.  TERMS PHONE CALLS ONLY ! Human interaction is not an inconvenience. ALL TEXTS and EMAILS are considered FRAUDULENT and WILL be IGNORED. I do not need an agency’s help in selling ANY item. ALL Sales Final. There are no expressed or implied warranties or uses for a particular purpose of any kind, unless particular manufacturer of an item offers a warranty, I do not!  LOCATION This item is located in Cottonwood, Arizona. 1 1/2 hours north of Phoenix on I-17, Camp Verde exit # 287, take Hwy 260 towards Cottonwood, it’s a 10 minute drive from I-17. Delivery may be available depending on final selling price, distance, circumstances, etc.   PHONE CALLS ONLY  My phone number is partially spelled out to reduce spammers.   nine28-three01-44two6  MOVING, MUST SELL ASAP  ********** ASKING $125  OBO. CASH ONLY **********   NOTE: If the ad is up, item is still available.", other/unknown, other, all sizes, other/unknown,,,,,,,
1203,200.0,flagstaff,https://flagstaff.craigslist.org/bik/d/flagstaff-bikes-for-refurbishment/7466475978.html,2022-04-03 10:14,Bikes for refurbishment,, Various,,,6,Several mountain bikes ready for some refurbishment. Will make a good deal if interested in all of them., other/unknown, mountain, Various, 26 in,,,,,,,
1204,2450.0,flagstaff,https://flagstaff.craigslist.org/bik/d/flagstaff-salsa-cutthroat-apex/7472995419.html,2022-04-18 17:52,Salsa Cutthroat Apex 1, good, Salsa, Cutthroat Apex 1,,13,"For sale! Hot pink 2019 Salsa Cutthroat Apex 1.  THE GOOD  - Carbon fiber.  - Tubeless 29ers.  - Versatile from geometry and 2.5"" tire clearance (peanut butter bud, no problem)  - New tires (seen in photos).  - Extra pair of brand new tires, still in packaging (Maxxis Ardent).  - Deity flats.  - Everything in working order and red 2 shred.  THE BAD  - Front tire has manufacturer's defect (warped). Very slight sway from side to side when you roll it. Not sure if you'd notice it if you didn't look for it. New set of tires are included, so you can leave it or swap it if you want.  - Bike has lots of desert dings and scratches! I've done my best to include these in the photos.  THE WHY  - Moving, with too many bikes! Accepting best offer!  Located 10 min. north of Flagstaff in Fort Valley.", carbon fiber, gravel, L, 29 in,,,,,,,
1205,500.0,flagstaff,https://flagstaff.craigslist.org/wan/d/flagstaff-buying-small-engine-projects/7472863687.html,2022-04-18 12:44,Buying small engine projects,,,,,0,"I buy project quads (no Chinese), riding mowers, golf carts, snow mobiles, quality brand chainsaws, air compressors and other small engine tools  go carts, mini bikes . I pay cash or will haul off for free.",,,,,,,,,,,
1206,12000.0,flagstaff,https://flagstaff.craigslist.org/for/d/flagstaff-suzuki-strom-650/7472846861.html,2022-04-18 12:13,Suzuki V-Strom 650, new,,,,15,"Selling my practically brand new 2018 V-Strom 650, with Super low Miles 3323, (just past break-in) and one of the best extended warranties that's fully transferable! This bike has been meticulously maintained and is the best one you'll find for sale. I've put nearly 17 grand into it in parts and labor. Unfortunately, I just can't ride anymore so my loss is your gain. I've babied this bike and no expense has been spared on it. Below is a list of all the aftermarket parts, which are the best you can find for these bikes. If you have any questions please let me know. Test rides will only happen with cash in hand and a valid MC license. I also have some gear that I may throw in depending on the offer. I also have a ton of extra parts that go with it. This is the most comfortable and versatile bike I've owned that didn't cost 30k. I've had two of these and they are bulletproof I put over 100,000 miles on the last one without any major issues. It has plenty of power for cruising on the highway and is much sportier than it looks. Easily ride two-up, without a care. and it's comfortable on long-distance trips. I averaged around 60mpg on the highway and was much better in town. I'm sure there's something I'm missing but come and take a look and you'll agree it's a great bike. ABS Option, with Multiple traction control settings  Outback mototek crashbars  Outback mototek large skid plate  Oxford touring heated grips with an intelligent controller.  Rox anti-vibration bar risers  Paddle grip throttle controller  BMW wide grip off-road footpegs  Givi monokey top box large fits full-face helmet and jacket.  Givi mounting plate  Added third brake light  Eastern beaver brake light wiring harness  Happy trails center stand  Baha designs smart lighting controller, with dimmer functions, and a secondary relay.  Wired for auxiliary lights  Auxiliary light tube clamps  Cyclops led high beam and low beam  Cetek batter tender jump port  Extra sets front and rear brake pads  Heavy-duty outdoor-rated cover",,,,,,,,,,,
1207,775.0,flagstaff,https://flagstaff.craigslist.org/bik/d/flagstaff-serotta-colorado-crl-road/7472779379.html,2022-04-18 10:11,Serotta Colorado CRL Road Bike 63 cm,,,,,0,,,,,,,,,,,,
1208,100.0,flagstaff,https://flagstaff.craigslist.org/spo/d/flagstaff-yakima-bike-rack-trunk-rack/7463674425.html,2022-04-18 09:56,"Yakima bike rack, trunk rack", like new,,,,0,"Yakima Hangout 2 Bike Rack:  Super simple and built to last, the new HangOut offers grab-and-go bike carrying convenience for almost any vehicle. The adjustable strap system and QuickTrigger hub make installation easy, and the padded feet and coated metal buckles protect your vehicle’s paint. Integrated StableCradles keep your bikes secure and make loading and unloading a piece of cake. When you aren’t off adventuring, the HangOut folds flat for compact storage.  Specs:  Color	Black Vehicle Service Type	Passenger Car Material	Metal Brand	YAKIMA Item Dimensions LxWxH	23 x 21 x 10 inches Item Weight	14.5 Pounds Folding	Yes  Cash only.",,,,,,,,,,,
1209,2400.0,flagstaff,https://flagstaff.craigslist.org/bik/d/flagstaff-2021-norco-fluid-fs-20-full/7467522255.html,2022-04-18 08:13,2021 Norco Fluid FS 1 20 / Full suspension 20in bike, excellent,,,,5,"Great opportunity to score a slightly used 2021 Norco Fluid FS 1 20.   This is arguably one of the best full suspension 20 inch Mountain bikes on the market. Rad Geometry and has all the good parts Shimano brakes / shifting,10 speed transmission. SDG saddle and handlebars. Suspension and Dropper post specifically tuned for kids weight.  Fox rear shock 100mm travel  Manitou J-Unit 20"", Expert 120mm travel   This bike was well taken care of and slightly used by my daughter.   For all the specs : https://www.norco.com/bikes/2021/youth/youth-trail/fluid-fs-youth/fluid-fs1-2/  Cost $3200 new   Bike is ready to ride.  Norco , specialized ,Trek, yeti , Santa Cruz  Pivot , kids bike , kids mountain bike, Full suspension , 20 in , 20in , 20 inch.  Bike , sale. Kids full suspension bike.  Downhill , enduro, DH , YT , commencal , Fox", aluminum, mountain,,, disc (hydraulic),,,,,,
1210,1200.0,flagstaff,https://flagstaff.craigslist.org/mpo/d/flagstaff-1968-honda-scrambler-90/7466176848.html,2022-04-17 17:23,1968 Honda SCRAMBLER 90,,,,,12,"Very Rare CL-90 Scrambler in Candy Red. Second year for HONDA's first Off-Road(vs. trail bikes) capable 90cc Motorcycle, based on the famous SUPER 90 street bike, with the 8hp engine! This bike, like it's street cousin, can do an honest 65mph in 4th gear! Still has the original 8hp Carburetor with it's correct intake manifold and air-cleaner boot. Sadly, it's missing the original engine and exhaust, as well as the air-cleaner and seat. Tank also needs new badges and knee-pads. Fortunately, all of these missing parts(including engine) are commonly available new or used on ebay, and all are still made to this day, for sale in the Asian markets(search for Super 90 and CM-200 parts)! Everything there is all original, right down to the tires and grips. The chromed fenders are both straight, but starting to get tarnished. It has the rear passenger foot-pegs too. In storage for almost 20 years. I was going to restore it(they sell for over $2,400), but I'll never have time to finish it. Good rolling project bike. I'll help you load. Asking $1,200 or best offer. Trade considered, but only if you include pictures.",,,,,,,,,,,
1211,2800.0,flagstaff,https://flagstaff.craigslist.org/bik/d/flagstaff-2021-canyon-ultimate-like-new/7472548235.html,2022-04-17 17:00,2021 Canyon Ultimate (Like New), like new, Canyon, Ultimate CF SL 8,,7,"2021 Canyon Ultimate CF SL 8 in XS (~52cm, use the online bike size calculator from Canyon to see if this fits you: https://www.canyon.com/en-us/road-bikes/race-bikes/ultimate/cf-sl/ultimate-cf-sl-8/2861.html)  This bicycle was purchased Oct 2021 and has been wall decoration during the Flagstaff winter. Now, I'm relocating and need to downsize my bicycle collection. My unfortunate timing is your gain.   FAQ:   Q: How much did you pay for this brand new? A: The price on Canyon.com is $2900. Tax and shipping brought my take-home cost to $ 3,234.27.  Q: What components are on the bicycle? A: It's identical to what you see the Canyon website: https://www.canyon.com/en-us/road-bikes/race-bikes/ultimate/cf-sl/ultimate-cf-sl-8/2861.htm (i.e., 1-piece bar+stem, full ultegra, GP5000's, DT Swiss PR1600s). I'll throw in a pair of pedals to get you riding ASAP.  Q: Any Damage? A: Minor scuff on the rear derailleur. See picture  Q: Any carbon damage? Ever been crashed? A: Nope!  Q: Will this fit me? How tall are you? A: I'm 5'7""   Q: Will this bicycle make me the envy of all my roadie friends? A: Absolutely!  Q: I want it. How do I pay you? A: Respond to this listing; cash or Venmo is accepted.", carbon fiber, road, XS (~52cm), 700C, caliper,,,,,,
1212,400.0,flagstaff,https://flagstaff.craigslist.org/bik/d/flagstaff-trek-hybrid-fx-bike-bright/7462574506.html,2022-04-17 09:00,"Trek Hybrid FX 1 bike, bright blue, small frame with extras",,,,,0,,,,,,,,,,,,
1213,260.0,flagstaff,https://flagstaff.craigslist.org/bik/d/flagstaff-vintage-80s-bianchi-tourist/7461789261.html,2022-04-16 13:47,Vintage 80’s Bianchi Tourist Mixte step through size 48.5, good, Bianchi, Tourist,,4,Vintage Bianchi Tourist mixte step through bike for sale. Size is about a 48.5cm. Great for anybody 5’5”ish and under. Steel frame. Fenders. New rear tire and grips. She runs smooth and is surprisingly fast. One of my favorite bikes. But it’s just too small., steel, cruiser, 48.5 ish, 27 in,,,,,,,
1214,185.0,flagstaff,https://flagstaff.craigslist.org/bik/d/humboldt-its-spring-and-ive-got-bikes/7459978929.html,2022-03-18 13:47,It's Spring and I've got bikes, good, Trek, 700,,7,"Okay, as the add says, I've got bikes. They're all bike shop quality. This is my retirement hobby now for about 15 years. I'm just over an hour from NAU and I bring the bikes to you. Feel free to ask questions. The bikes listed will match up with the pictures. Also, if you don't see what you're looking for, I have others.   Fuji Gran Tourer/ SS.  $185 Trek 700.      $185 Trek 700.     $185 Quattro Assi.    $280 Centurion/ Nishiki SS.    $195 Windsor International. $225 Gary Fisher Joshua F 2.   $320", steel, road, Large, 700C,,,,,,,
1215,50.0,flagstaff,https://flagstaff.craigslist.org/bop/d/flagstaff-saris-the-boss-bike-stand/7471243589.html,2022-04-14 10:22,"Saris - The Boss bike stand, perfect condition",,,,,7,"Holds & stabilizes by the rear axle, uses soft, rubber dipped fingers.  Lightweight, folds flat, very portable.  Fits bikes with tires from 20"" to 29"".",,,,,,,,,,,
