,Price,Location,URL,Date,Title,bicycle frame material,bicycle type,condition,frame size,wheel size,num image,text,make / manufacturer,model name / number,electric assist,brake type,handlebar type,suspension,engine hours (total),length overall (LOA),propulsion type,year manufactured,paint color,size / dimensions,serial number
4085,175.0,redding,https://redding.craigslist.org/bik/d/redding-bikes/7472893745.html,2022-04-18 13:43,Bikes, aluminum, hybrid/comfort, good, Medium, 25 in,4,2 Bikes for sale. The green Mongoose has a bike rack on the back. 18 speed. The blue Shimano Motiv is 21 speed. Both are hybrid bikes and good condition.,,,,,,,,,,,,,
4086,30.0,redding,https://redding.craigslist.org/bik/d/redding-two-kids-bikes/7466814070.html,2022-04-18 06:29,two kids bikes, steel, kids,, small, 12 in,7,I am selling 2 nice little girl bikes both are 12 in one is pink and it will need a new back tire soon comes with new training wheels asking 15 dollars for it the white one is in good shape asking 30 dollars for it both need air in tires call 356-6426,,,,,,,,,,,,,
4087,60.0,redding,https://redding.craigslist.org/bik/d/redding-trek-bikes/7472230433.html,2022-04-16 16:12,3 Trek Bikes, alloy, gravel, good, small and kids, 24 in,3,2 kids Trek 220 bikes with 24” tires. Could use tune ups for better shifting but ready to ride. $60 each or $100 for both. Both have new seats.   Trek 7.2 adult size small with a 15” frame. 700 tires. Ready to ride. This was ridden by an adult. $250  Take all 3 bikes for $300., Trek, 220 and 7.2,,,,,,,,,,,
4088,80.0,redding,https://redding.craigslist.org/bik/d/redding-mountain-bikes/7471256016.html,2022-04-16 15:07,2 mountain bikes, aluminum, mountain,, Large, 24 in,2,Have two nice mountain bikes for sell both are ready to go no issues just taking up space. Text David @  show contact info  asking $50 each or bottom for $70,,,,,,,,,,,,,
4089,40.0,redding,https://redding.craigslist.org/bik/d/redding-accesories-for-bikes/7457767974.html,2022-04-02 15:19,Accesories for Bikes, other/unknown, other, excellent, unknown, other/unknown,0,"Bike Accessories For Sale......... Incline Enduro Helmet by Serfas: Orange & Black.   New price $70.00 -             ASKING    $ 35.00 (Hardly used.)    Rechargeable Head Lamp, Elume 1200 by Serfa:  ASKING     $40.00   Rechargeable  Tail Light ,Thunderbolt by Serfas:   ASKING    $ 20.00    Please. Cash Only.",,,,,,,,,,,,,
4090,2500.0,redding,https://redding.craigslist.org/bik/d/shasta-vintage-raliegh-pro-campagnolo/7461204005.html,2022-03-31 16:28,VINTAGE - Raliegh Pro - Campagnolo Road Bikes, steel, road,, 24.5, 24 in,2,"Two matching Raliegh Professional road bikes. They are in barn find condition (well preserved, no rust or pitting and paint is nice, just dusty from being stored for 30+ years on the wall in my garage). They will need to be cleaned up & tuned/serviced. Purchased by my dad between 1972-1974 in Manhattan Beach, CA. Both have Mavic Rims with Robergel double butted spokes, Sew up tires, hand pump and Camagnolo headsets, cranks, wheel hubs, pedals and seat posts. Metallic blue & grey hand built at the Raleigh factory. $2500 for both obo. May be willing to split if offer is favorable.", Raleigh, Professional,,,,,,,,,,,
4091,2500.0,redding,https://redding.craigslist.org/atq/d/shasta-vintage-raliegh-campagnolo-road/7461207270.html,2022-03-31 16:28,Vintage - Raliegh/Campagnolo road bikes,,, excellent,,,2,"Two matching Raliegh Professional road bikes. They are in barn find condition (well preserved, no rust or pitting and paint is nice, just dusty from being stored for 30+ years on the wall in my garage). They will need to be cleaned up & tuned/serviced. Purchased by my dad between 1972-1974 in Manhattan Beach, CA. Both have Mavic Rims with Robergel double butted spokes, Sew up tires, hand pump and Camagnolo headsets, cranks, wheel hubs, pedals and seat posts. Metallic blue & grey hand built at the Raleigh factory. $2500 for both obo. May be willing to split if offer is favorable.", Raliegh, Professional,,,,,,,,,,,
4092,525.0,redding,https://redding.craigslist.org/bop/d/redding-infinity-bike-frame-only-of/7464643043.html,2022-03-29 18:28,Infinity Bike Frame Only 1 of 3 Bikes ever Made  Square Tube Aluminum,,,,,,4,"Infinity Bike Frame Only 1 of 3 Bikes ever Made  Square Tube Aluminum  about 64""in Length   This was a letter from Infinity Bikes:     According to our president this was one of three sample built in the early 2000's. No production was ever produced and this was most likely purchased through some sort of liquidation. It is an adult sized ""trike""(One wheel in the front, two in the rear) Hope this helps a little bit.  Regards,  Scott McGregor Quality Control   Infinity Cycle Works Action Traders ltd.",,,,,,,,,,,,,
4093,4000.0,redding,https://redding.craigslist.org/bik/d/redding-pedego-bikes/7464506309.html,2022-03-29 12:36,PEDEGO e-bikes, other/unknown, road, excellent, 24 and 28 inch, 28 in,4,"Two PEDEGO e-bikes for sale $2000 each 3 years old, 400 miles, excellent condition 1) Interceptor III 24 inch step thru with 48V battery 2) City Commuter 28 inch with 48V battery  Includes helmets, lock and cable, travel pack  Great for biking the river trail- we have enjoyed these but need to move please call Rick at  show contact info", PEDEGO,, pedal assist,,,,,,,,,,
