,Price,Location,URL,Date,Title,bicycle frame material,bicycle type,condition,frame size,wheel size,num image,text,make / manufacturer,model name / number,electric assist,brake type,handlebar type,suspension,engine hours (total),length overall (LOA),propulsion type,year manufactured,paint color,size / dimensions,serial number
4095,100.0,redding,https://redding.craigslist.org/bik/d/redding-huffy-cranbrook/7472900963.html,2022-04-18 13:58,Huffy Cranbrook, other/unknown, cruiser,, 26 in, other/unknown,4,Huffy Cranbrook bikes $100 each obo,,,,,,,,,,,,,
4096,4500.0,redding,https://redding.craigslist.org/bik/d/redding-2021-yeti-sb165-medium-full/7472824059.html,2022-04-18 11:32,2021 Yeti sb165 Medium Full Suspension Mountain Bike, carbon fiber, mountain,, Medium, 27.5 in,7,"Selling my 2021 Yeti sb165. This bike has been super fun and hoping to find it a good home. Bikes in great condition and has been well maintained. Frame size Medium carbon frame Fox 38 performance fork Dhx2 coil Dt swiss 1900 wheels Sram G2 brakes Slx derailleur Gx cranks, shifter, cassette Race face carbon handlebars Odi grips Wtb yeti colab saddle Lev dropper post Fox dropper lever Maxxis Assegai and dhr2 Fox xl bolt-on mudguard Notable damage is surface scratches shown in photos. Otherwise flawless. No pedals", Yeti, Sb165,,,,,,,,,,,
4097,6500.0,redding,https://redding.craigslist.org/mpo/d/palo-cedro-2006-honda-st1300/7472678782.html,2022-04-18 07:07,2006 Honda ST1300,,, like new,,,2,"This is my really nice bike in great condition and runs excellent. Many of these bikes have hit 300k miles, very dependable.  All maintenance and upgrades done by Honda dealership with records. The exhaust upgrade was 2,000 alone. Sounds better, more power, better mileage. No disappointments here. Call Bruce five30-549-431nine", honda st1300, st 1300,,,,,,,,,,,
4098,185.0,redding,https://redding.craigslist.org/bik/d/redding-new-14-inch-toddler-bike-with/7471894214.html,2022-04-17 20:07,New 14 Inch Toddler Bike with Training Wheels for Boys and Girls Age 3, steel, kids, new, 14 inch, 14 in,3,"BMW 14 Inch Toddler Bike with Training Wheels for Boys and Girls Age 3-7 online $329, New in the box only $185   Color Red  BMW KIDS - Global exclusive authorization; Patented products quality under controlled; Legal global BMW LOGO on the steel bike frame DURABLE DESIGN: Strong and long last printing frame and accessories, allow this bike to company with your kids for years RIDING EASY AND SAFE - Detachable training wheels, rubber Inflatable tires for the front and rear wheels, smooth chain and efficient double brake system (A rear coaster brake which reverses the pedals to stop, and a front caliper brake which like adult bikes) on BMW kids bike to offer an easy and safe riding to the little riders 3-7 years old RIDING COMFORTABLE - Textured Grips, Soft and adjustable EVA seat, adjustable handle bar, rubber Inflatable tires give a wonderful riding experience to riders when cycling, even when run on uneven roads", Rastar, BMW,, coaster,,,,,,,,,
4099,85.0,redding,https://redding.craigslist.org/bik/d/redding-bike-rack/7472522286.html,2022-04-17 15:24,Bike Rack, other/unknown, other,, Cm, other/unknown,4,Locking bike rack for 4 bikes. I’ll throw in the lock for the hitch as well.  My vehicle got wrecked and no longer need $85 obo,,,,,,,,,,,,,
4100,175.0,redding,https://redding.craigslist.org/spo/d/redding-yakima-bike-rack/7472459304.html,2022-04-17 12:06,Yakima Bike Rack,,, excellent,,,0,Yakima bike rack Solid strong steel Holds four  bikes in excellent condition and well-maintained., Yakima,,,,,,,,,,,,
4101,50.0,redding,https://redding.craigslist.org/bop/d/redding-stolen-bikes-two-jinx-bikes/7460172616.html,2022-03-19 05:50,Stolen Bikes: Two Jinx Bikes Stolen in Chico,,, good,,,0,"White Jinx Bike Stolen in 2015. Black (Graphite) Jinx Bike Stolen in 2019. If you own either of these, my friend will reward you for the return of her bike.  She had the first one stolen, then owned another of the same model for years, then that one was stolen.    Specialized Jynx Sport 650b  2015 (white) and 2016 (black)  24 speed 27.5” x 2.0” tires by Fastrak Aftermarket rear cargo rack  I am posting this for my friend, who has long-since given up.  I don’t.  You can contact me via calls or texts at 5 3 0, sis four sis, 6 2 8 6.  It can take a long time for a stolen bike to surface.  My dad had a bike stolen in Santa Barbara when he lived there in 1982, and 7 years ago (2014), the police called him to say they found a frame with the correct serial number on it.  Just the frame, sitting in a shed behind an abandoned house.   Don’t give up.",,,,,,,,,,,,,
4102,115.0,redding,https://redding.craigslist.org/bik/d/shasta-lake-new-royalbaby-girls-bike/7466998959.html,2022-04-16 15:45,New RoyalBaby Girls Bike, steel, kids,, 16 inch, 16 in,2,"New in the box Girls 16"" Royal Baby Kids Bike  Jenny ""Pink""  only.......$115     1. Easy to put together! 95% of the bike is assembled. Save your headache to install the front wheel and brake compared with 85% bikes. Assembly tools and an easy-to-follow instructions are included. 2. Safer riding! Front caliper brake and rear coaster brake offer double safer; Wide 2.125” pneumatic tires add more stability; Sturdy steel frame,Crank; Non-slip resin pedal; Enclosed chainguard. 3. Easier to Ride! Never-bent training wheels; Safety grips and handbrake; Royalbaby exclusive brake lever allows little riders brake efficiently. As the grip dimensions are shortened by 10% to fit a kid’s strength. 4. Amazing design and color! Cute and charming, stylish and unique. The basket, bell and DIY decal add extra fun to the ride. Soft seat comes with a handle, which makes the bike easier to grab during teaching or loading.", Royal Baby, Jenny,,,,,,,,,,,
4103,375.0,redding,https://redding.craigslist.org/bik/d/anderson-sweet-ride/7465876185.html,2022-04-16 13:53,sweet ride, composite, gravel, like new, 52 cm, 27.5 in,2,"Solid sweet ride (bought new 2 yrs ago) on this upgraded bike.  Ridden 100 miles.  Elderly person has too many bikes.    UPGRADES:  New tires - Specialized 38s with smooth center line and side-gripping nubs.  Extra rear 36-cog ring  added to the cassette.  Great all-around bike, but not a mountain traveler.  I’m 5’6” with a long inseam and this should be perfect for 5’6” to about 5’l0” or more.  Cro-moly frame; carbon fork.  Non-brand stamped by manufacturer.  The shown accessories are not included.  Crank 48/36, cassette 12/36.",,,, cantilever, drop, none (rigid),,,,,,,
4104,50.0,redding,https://redding.craigslist.org/bik/d/lakehead-mongoose-and-thruster-kids/7460107469.html,2022-03-18 19:58,2 Mongoose and 1 Thruster Kids Bikes, other/unknown, bmx, good, 54 cm, 20 in,7,"I have 3 kids bikes for sale 1 is a Pink Bike, My kids now have cars and are in the Army so they don't need these anymore. 2 Mongoose and 1 Thruster, All need new inner tubes and possibly new tires. They all need a bath. They have been sitting in my garage for a few years now. My kids barely used them So for the most part they are like new, just dirty. Im asking $50 on each but im not really firm on it. If you get all 3 ill make you a deal. Im not interested in any trades,", Mongoose,, none, caliper, bmx,,,,,,,,
4105,1.0,redding,https://redding.craigslist.org/grd/d/anderson-dixie/7471631614.html,2022-04-15 09:17,Dixie!!,,, excellent,,,12,"My lil bit of Dixie! 🦄  She’s about 16 years old and 14-14.1h. Super cute! One of a kind this gal, She’s been my project for the last year. Before I got her she sat in a pasture for about 5-6 years. Figuring her out had been a bit of a challenge but, we finally got it.  HER NEEDS: She needs consistency. 6-7 days working. She needs to be doing something. More than a two day break she’ll get sassy.   Highly suggest loading her up and taking her out a couple times a month. Will keep the barn and buddy sourness at bay.   Light lunging before you get on is suggested to make sure she is focused on you.   Little about Dixie: She is a one person horse. Once she trusts you and knows you won’t let her get away her fits she’ll do what you ask. She needs a confident rider. Someone as stubborn as her. You CANT give in to her or she’ll walk all over you. She’s a very smart girl and she WILL test you.  But, once you get to that point with her that y’all are a team she’s absolutely phenomenal.   Her Fits: can consist of buck, kickin out, and rearing. As long as she’s consistently worked and worked before bein ridden, her fits wont be present.   She can go either way western, English, my personal favorite bareback. She’s been exposed to so many things. She loves barrels. She’s loves working her brain. I’ve worked a couple cows on her and she did well. I’ve thrown a rope off her just on a dummy, doesn’t even phase her. She’s been around tractors, 4 wheelers, dirt bikes, dogs, goats, chickens, a donkey, gun shots from afar, compound bow bein shot and kids. She does well with everything! She’s absolutely bombproof.  I could go on and on about this sweet stubborn girl. Call/text or email for more info & price!!",,,,,,,,,,,,,
4106,2500.0,redding,https://redding.craigslist.org/pts/d/round-mountain-custom-frame-55-chevy/7471529309.html,2022-04-15 05:17,"custom frame 55 chevy truck, Trans",,, like new,,,3,"87 Chevy frame re worked to 114'' WB , 4'' Lift Kit,  ,  R4 Trans,  powder coated , new remount res. shocks, new bushings and mounts, alm wheels and rollers. real nice stuff  All Like New. $2500 OBO,  Trades OK,  Boats,  Bikes, 5000 gal water tank, heavy equipment , fire wood ,  handy man labor, or ?   call  John   show contact info    thanks", Chevy,,,,,,,,,,,,
4107,1200.0,redding,https://redding.craigslist.org/mcy/d/redding-1999-yz400/7471419452.html,2022-04-14 16:48,1999 YZ400,,,,,,6,"Pink in Hand but never ridden.  I purchased this under the impression it only needed a carb clean.  I had a shop do that and also put in a timing chain and new tensioner.  Then I was informed that it needed a new cylinder/piston as the compression was low once it warmed up.  I got quoted number that I wasn't willing to pay for a complete rebuild so I'm offering it up for someone who knows more than me.  It will not run at this time as the top end was just put back after last tear apart when I told them to stop.  So I have not even road this bike but I'm sure it'll work for someone.  Looks like new tires and everything else is complete.  Open to running trades that I don't have to work on? Kids bikes/atv's, cars, trucks,???",,,,,,,,,,,,,
4108,20.0,redding,https://redding.craigslist.org/bop/d/redding-shimano-m520-spd-pedals-clipless/7458602469.html,2022-04-13 06:44,Shimano M520 SPD Pedals clipless,,, excellent,,,0,"Excellent working condition  Perfect for peloton indoor cycling spin bikes road or mountain bikes If you can read this, they are available here in Redding  Paid $60 Asking $20 Call or text  show contact info  wrk cell   Fluorine-coated binding claws allow for easy entry and release  Pedals are dual-sided for easy entry and feature strong, durable CrMo spindles with 8mm Allen wrench mounts  Low-maintenance sealed bearing cartridge axles  Dual-sided tension adjustment  Technical Specs Best Use	 Mountain Biking Indoor Cycling Pedal Design	 Clipless Cleat Design	 2-hole SPD Compatible	 Yes Material(s)	 Chromoly spindle Weight	 380 grams Clip less clip-less bike bicycle   Shimano M520 SPD Pedals clipless", shimano, M520 SPD Pedals clipless,,,,,,,,,,,
4109,17669.0,redding,https://redding.craigslist.org/hvd/d/elk-grove-2020-kioti-ck2510-manual/7470685476.html,2022-04-13 06:01,2020 KIOTI CK2510 MANUAL TRACTOR Unknown,,, new,,,22,"2020 KIOTI CK2510 MANUAL TRACTOR UNKNOWN Call California Custom at (916) 694-0373 ext 266 https://calcustomtrailers.com/dx1inventory/289401eb-3754-4c4d-81e7-abbc0136ce76 California Custom Trailers & Power Sports $17,669 InfoStock #: 00072VIN: VL9200072Condition: NewType: TractorsDrivetrainOdometer: 0 MILES2020 KIOTI CK2510 MANUAL TRACTOR UNKNOWN Call California Custom at (916) 694-0373 ext 266 https://calcustomtrailers.com/dx1inventory/289401eb-3754-4c4d-81e7-abbc0136ce76$17,669 **Prices listed are the MSRP or sale price and do not include any taxes, fees, or installed accessories.     KEYWORDS: HAULMARK, HAULMARK TRAILER, HAULMARK TRAILERS, PJ, PJ TRAILER, PJ TRAILERS, TRAILERS, DUMP TRAILER, DUMP TRAILERS, DUMP, EQUIPMENT HAULER, EQUIPMENT HAULERS, EQUIPMENT, HAULER, HAULERS, EQUIPMENT MOVER, EQUIPMENT MOVERS, CAR HAULER, CAR HAULERS, CAR MOVER, CAR MOVERS, CAR, CARS TILT TRAILER, TILT TRAILERS, TILT CAR HAULER, TILT CAR MOVER, TILE EQUIPMENT HAULER, TILT EQUIPMENT MOVER, TILT, CARGO TRAILER, CARGO TRAILERS, CARGO HAULER, CARGO HAULERS, CARGO, UTILITY TRAILER, UTILITY TRAILERS, UTILITY, TOY HAULER, TOY HAULERS, TOY, HAULER, MOVER, MOTORCYCLE TRAILER, MOTORCYCLE TRAILERS, MOTORCYCLE HAULER, MOTORCYCLE HAULERS, ENCLOSED TRAILER, ENCLOSED TRAILERS, OPEN TRAILER, OPEN TRAILERS, ENCLOSED, OPEN, FLAT DECK, FLAT DECK, DOVE TAIL, DOVETAIL, DECK OVER, DECKOVER, SINGLE AXLE, DOUBLE AXLE, TANDEM AXLE, DUAL AXLE, SINGLE AXLES DOUBLE AXLES, TANDEM AXLES, DUAL AXLES, HAULMARK, PJ, PASSPORT, TRANSPORT, EDGE, FLEX, TRAILER PART, TRAILER PARTS, PART, PARTS, BALL MOUNT, BALL, MOUNT, TRAILER HITCH, HITCH, HITCH PIN, HITCH PINS, HITCHES, RECEIVER, RECEIVERS, COUPLER, COUPLERS GRAVEL, DIRT, ROCK, ROCKS CAR, BIKE, BIKES, TRACTOR, TRACTORS, LANDSCAPE, LANDSCAPING, BUSINESS, SERVICE, SERVICES WELD, WELDED, WELDING, FIX, FIXING, FIXED, WHEEL, WHEELS, TRAILER WHEELS, TRAILER WHEEL, TIRE, TIRES, TRAILER TIRE, TRAILER TIRES, AXLE, AXLES, TRAILER AXLE, TRAILER AXLES, FENDER, FENDERS, TRAILER FENDER, TRAILER FENDERS, LIGHT, LIGHTS, TRAILER LIGHT, TRAILER LIGHTS, LOCK, LOCKS, TRAILER LOCK, TRAILER LOCKS, TOW, TOWING, TRAILER TOWING, TOWING TRAILERS, WIRE, WIRES, TRAILER WIRE, TRAILER WIRING, TRAILER WIRES, WIRE HARNESS, TRAILER WIRE HARNESS, BRAKES, BRAKE ADAPTER, BRAKE ADAPTERS, BRAKE CONTROLLER, BRAKE CONTROLLERS, CONTROLLER, BRAKE, FEATHERLITE, FEATHERLITE DEALER, FEATHERLITE TRAILERS, FEATHERLITE TRAILER, FEATHERLITE UTILITY, FEATHERLITE CAR HAULER, FEATHERLITE CARHAULER, PJ, PJ TRAILER, PJ TRAILERS, TRAILERS, DUMP TRAILER, DUMP TRAILERS, DUMP, EQUIPMENT HAULER, EQUIPMENT HAULERS, EQUIPMENT, HAULER, HAULERS, EQUIPMENT MOVER, EQUIPMENT MOVERS, CAR HAULER, CAR HAULERS, CAR MOVER, CAR MOVERS, CAR, CARS TILT TRAILER, TILT TRAILERS, TILT CAR HAULER, TILT CAR MOVER, TILE EQUIPMENT HAULER, TILT EQUIPMENT MOVER, TILT, CARGO TRAILER, CARGO TRAILERS, CARGO HAULER, CARGO HAULERS, CARGO, UTILITY TRAILER, UTILITY TRAILERS, UTILITY, TOY HAULER, TOY HAULERS, TOY, HAULER, MOVER, MOTORCYCLE TRAILER, MOTORCYCLE TRAILERS, MOTORCYCLE HAULER, MOTORCYCLE HAULERS, ENCLOSED TRAILER, ENCLOSED TRAILERS, OPEN TRAILER, OPEN TRAILERS, ENCLOSED, OPEN, FLAT DECK, FLAT DECK, DOVE TAIL, DOVETAIL, DECK OVER, DECKOVER, SINGLE AXLE, DOUBLE AXLE, TANDEM AXLE, DUAL AXLE, SINGLE AXLES DOUBLE AXLES, TANDEM AXLES, DUAL AXLES, HAULMARK, PJ, PASSPORT, TRANSPORT, EDGE, FLEX, TRAILER PART, TRAILER PARTS, PART, PARTS, BALL MOUNT, BALL, MOUNT, TRAILER HITCH, HITCH, HITCH PIN, HITCH PINS, HITCHES, RECEIVER, RECEIVERS, COUPLER, COUPLERS GRAVEL, DIRT, ROCK, ROCKS CAR, BIKE, BIKES, TRACTOR, TRACTORS, LANDSCAPE, LANDSCAPING, BUSINESS, SERVICE, SERVICES WELD, WELDED, WELDING, FIX, FIXING, FIXED, WHEEL, WHEELS, TRAILER WHEELS, TRAILER WHEEL, TIRE, TIRES, TRAILER TIRE, TRAILER TIRES, AXLE, AXLES, TRAILER AXLE, TRAILER AXLES, FENDER, FENDERS, TRAILER FENDER, TRAILER FENDERS, LIGHT, LIGHTS, TRAILER LIGHT, TRAILER LIGHTS, LOCK, LOCKS, TRAILER LOCK, TRAILER LOCKS, TOW, TOWING, TRAILER TOWING, TOWING TRAILERS, WIRE, WIRES, TRAILER WIRE, TRAILER WIRING, TRAILER WIRES, WIRE HARNESS, TRAILER WIRE HARNESS, BRAKES, BRAKE ADAPTER, BRAKE ADAPTERS, BRAKE CONTROLLER, BRAKE CONTROLLERS, CONTROLLER, BRAKE TRANSPORT TRAILER, TRAILER PARTS, AXLES, WEIGHT, CARGO, LANDSCAPE, DUMP, UTILITY, GRAVEL, MOVING, SACRAMENTO TRAILER SALES, UN-LADEN WEIGHT, CAMPERS, RACKS, TONNEAU LIDS, BUMPERS, TOOL BOXES, EQUIPMENT TRAILER, CAR HAULER, TOY HAULER. MOTORCYCLE TRAILER, GRAVEL, MOVING, PJ TRAILERS, TRAILER SALES, UN-LADEN WEIGHT, RACKS, BUMPERS, TOOL BOXES, EQUIPMENT TRAILER, CAR HAULER, TOY HAULER. MOTORCYCLE TRAILER, TRAILER PARTS, AXLES, WEIGHT, CARGO, LANDSCAPE, DUMP, UTILITY, GRAVEL, MOVING, SACRAMENTO, TRAILER SALES, TOOL BOXES, EQUIPMENT, TRAILER, CAR HAULER, TOY HAULER. MOTORCYCLE TRAILER, GRAVEL, MOVING, PJ TRAILERS, TRAILER SALES, BUMPERS, TOOL BOXES, EQUIPMENT TRAILER, CAR HAULER, TOY HAULER. MOTORCYCLE TRAILER, CHARMAC, CHARMAC HORSE TRAILER, CARSON, CARSON DUMP TRAILER, CARSON UTILITY TRAILER, POLARIS, ATV, GALT, SACRAMENTO, HERALD, LODI, WALNUT GROVE, MODESTO, MERCED, TURLOCK, VACAVILLE, FAIRFIELD, DIXON, NATOMAS, LOCKE, COURTLAND, CLOVIS, IONE, JACKSON, SUTTER CREEK, PIONEER, ELK GROVE, WEST SACRAMENTO,", KIOTI, CK2510 MANUAL TRACTOR,,,,,,,,,,,
4110,180.0,redding,https://redding.craigslist.org/bop/d/red-bluff-dual-bicycle-swagman-bike/7462416746.html,2022-04-11 09:41,Dual Bicycle SWAGMAN 2 Bike Rack Hitch Carrier,,, new,,,0,"Swagman Sitkka 2 bike hitch carrier #64687  large and also supports fat bikes also, 40 lbs per bike.  Both 1 1/4 and 2 inch Hitches are supported.  Built in key lock and keys included.  It is new, and has never been used, just dusty! I have priced this at HALF PRICE @ $180  A video review and more information can be found on the following links.  https://www.etrailer.com/tv-review-swagman-sitkka-2-bike-rack-s64687.aspx  https://www.walmart.com/ip/Swagman-SWG64687-Sitkka-2-Bike-Rack-Locking/268943454", Swagman, 64687,,,,,,,,,,,
4111,145.0,redding,https://redding.craigslist.org/bik/d/redding-new-customized-huffy-cranbrook/7468787913.html,2022-04-08 14:12,New Customized Huffy Cranbrook, other/unknown, cruiser,, 26, 26 in,0,"New Customized Huffy Cranbrook  I recently bought this cranbrook to turn into a motorized bike. Turns out on a other beach cruiser motorized bike build. I prefer mountain bikes for the hand brakes and easier to pedal gears.   Beach cruiser pedal brakes are kinda fun to do sideways or aggressive skids though.  It was sold to me as red by Walmart. Its kind of a red, pink, neon orange kinda color. But yes mostly red.   I never rode this bike. Not one bit.  Its possible my cat peed against the side of it against the wheels but probably not. Nothing a good soapy washing couldent clear up.  Its customized,   different handlebars name brand on them is fmf sport they are 650cm long lightweight strong and mountain bike style instead of the stock beach cruiser wide style.  I put new mongoose upgraded alloy pedals 9/16 size bolts. put Teflon tape on the threads so they stay in placer firmer and can be undone easily when you choose to.   I'm including red vans cult flangless grips still new in box.  I didn't believe in huring walmarts earnings for my mistake in buying a returning a beach cruiser. I'm just breaking even here. Heres my rundown of the costs.  100 Bike 15 fmf sport handlebars 15 Mongoose Pedals 15 New In Box Vans Cult Flangless  Red Grips Total: 145 I'm breaking even, Id like to. The price is firm. These are all new parts.  I assembled it very carefully as I was intending it to be a high speed motorized bike. Still you should double check all the tightness of bolts yourself before riding.   Ill include the original Huffy shipment Box, The owner manual as well.  I'm in redding near mercy hospital area.",,,,,,,,,,,,,
4112,7995.0,redding,https://redding.craigslist.org/bod/d/sacramento-2006-sea-doo-a-unknown/7468395595.html,2022-04-07 16:40,2006 Sea-Doo N/A Unknown,,,,,,4,"Specialty Motorsports address:    721 N B Street Sacramento CA, 95811phone:      ☎ (916) 441-1418 text:       Text (916) 441-1418 for more details  link:       https://www.sacspecialtymotorsports.com/dx1inventory/01e49791-620b-44a5-b69b-ae5f0140e86c  contact:    Sales  2006 SEA-DOO N/A UNKNOWN InfoType: WatercraftStock #: SEA87L506VIN: YPV00387L506DetailsCondition: UsedDrivetrainHours: 82Description 2006 SEADOO GTX LIMITED SEGTX A LUXURY OFF-ROAD VEHICLE YOU'LL ACTUALLY TAKE OFF THE ROAD. Roughing it is relative on the GTX and GTX SC. Packed with two powerful engine options, luxury to spare and smooth maneuverability. A top-notch boat that takes riding to a new place. Like your favorite camping spot. Or a little island hopping.    2004 2005 2006 2007 2008 2009 2010 2011 2012 2013 2014 2015 2016 2017 2018 2019 || Used || 2006 SEADOO GTX || Motorcycle || Sport Bikes || UTV || Used Sportbikes || Sport Bike || Bad Credit || Specialty Motorsports address:    721 N B Street Sacramento CA, 95811phone:      ☎ (916) 441-1418 text:       Text (916) 441-1418 for more details  link:       https://www.sacspecialtymotorsports.com/dx1inventory/01e49791-620b-44a5-b69b-ae5f0140e86c  contact:    Sales", Sea-Doo, N/A,,,,, 82, 0, power, 2006,,,
4113,6795.0,redding,https://redding.craigslist.org/bod/d/sacramento-2004-yamaha-waverunner-fx140/7468395597.html,2022-04-07 16:40,2004 Yamaha WaveRunner® FX140 3 Seat,,,,,,4,"Specialty Motorsports address:    721 N B Street Sacramento CA, 95811phone:      ☎ (916) 441-1418 text:       Text (916) 441-1418 for more details  link:       https://www.sacspecialtymotorsports.com/dx1inventory/26b470de-e379-4cc0-8faa-ad6701420e1b  contact:    Sales  2004 YAMAHA WAVERUNNER® FX140 3 SEAT InfoType: WatercraftStock #: YAM85J304VIN: YAMA2685J304DetailsCondition: UsedDrivetrainTransmission: Direct Drive From EngineHours: 243Description WaveRunner® FX140243 Hours 140 HP  This WaveRunner brings the family closer than a therapist ever could. Perhaps the PWC that's made the most significant impact in the last 10 years is the FX140, the WaveRunner that ushered in a new generation of watercraft. Equipped with the revolutionary MR-1 engine, the FX140 won Popular Mechanics' Design and Engineering award as the world's first four-stroke personal watercraft. Designed for families who seek exceptional performance, comfort and handling and the versatility to tow a skier or wakeboarder, this four-stroke WaveRunner offers hours of fun whether you're riding alone, two-up or three-up. If you can't decide which WaveRunner is right for you, and the High Output WaveRunners have more performance than you need, the FX140 is always a great bet, as well as a great value. No wonder it's been deemed ""the WaveRunner most likely to make every family weekend more memorable.""   2004 2005 2006 2007 2008 2009 2010 2011 2012 2013 2014 2015 2016 2017 2018 2019 || Used || 2004 YAMAHA FX140 || Jet ski // Motorcycle || Sport Bikes || UTV || Used Sportbikes || Sport Bike || Bad Credit || Specialty Motorsports address:    721 N B Street Sacramento CA, 95811phone:      ☎ (916) 441-1418 text:       Text (916) 441-1418 for more details  link:       https://www.sacspecialtymotorsports.com/dx1inventory/26b470de-e379-4cc0-8faa-ad6701420e1b  contact:    Sales", Yamaha, WaveRunner FX140,,,,, 243, 0, power, 2004,,,
4114,2200.0,redding,https://redding.craigslist.org/mcy/d/cottonwood-1983-honda-magna-v65vf-1100c/7468320821.html,2022-04-07 13:41,1983 Honda Magna V65[VF-1100c]-Angry Lenny-,,,,,,0,,,,,,,,,,,,,,
4115,30.0,redding,https://redding.craigslist.org/bop/d/redding-bike-adapter-bar/7464414111.html,2022-04-07 13:39,Bike adapter bar,,,,,,0,This is an adjustable bike extender/adapter bar to allow bikes of various size (or male/female) to load onto a bike rack.  Brand new!!  Make is UBar.  Call Susan at  show contact info .,,,,,,,,,,,,,
4116,120.0,redding,https://redding.craigslist.org/bik/d/cottonwood-yakima-tailgate-pad-like-new/7467922313.html,2022-04-06 15:12,Yakima Tailgate Pad - Like New, other/unknown, mountain,, 61” Large, other/unknown,4,Yakima Tailgate Pad for Mountain Bikes:) Like New Only $120  Full Size Truck, Yakima,,,,,,,,,,,,
