,Price,Location,URL,Date,Title,num image,text,condition,make / manufacturer,model name / number,bicycle frame material,bicycle type,brake type,electric assist,frame size,handlebar type,suspension,wheel size,size / dimensions,serial number,part type
26,150.0,auburn,https://atlanta.craigslist.org/atl/bik/d/peachtree-corners-bikes-his-hers/7468568792.html,2022-04-16 08:46,2 Bikes His & Hers,9,"1- Vintage Girl's Huffy 314 bike. 24"" wheel in like new condition.  2- Royce Union, 700 Series, 21 speed all Shimano, 26"" wheel, size  medium.  Bikes have been kept inside and are in excellent condition.  They can be purchased seperatly.", excellent," Royce Union, Huffy", See description, aluminum, hybrid/comfort, caliper,," 26"" and 24""",, none (rigid), 26 in,,,
27,500.0,auburn,https://atlanta.craigslist.org/nat/mpo/d/gainesville-wanted-non-running-dirt/7464711696.html,2022-04-16 07:01,Wanted non-running dirt bikes and street bikes,0,Looking for bikes that do not run. Dirt or Street. I don't buy anything from China. Text me with pictures and prices.  show contact info,,,,,,,,,,,,,,
28,4800.0,auburn,https://atlanta.craigslist.org/sat/mcy/d/lagrange-kawasaki-bikes/7471848041.html,2022-04-15 19:58,2009/2014 Kawasaki Bikes,12,Blue-2009. Asking 3800.00 Damage on light. No other issues. Believe 248cc. Clear title. Ready to ride.    White 2014 Asking 4800.00. No damages. Excellent condition. Beleive 299cc. Clear title. Ready to ride.   No trades so don’t ask.   Can text 706.616.8645.,,,,,,,,,,,,,,
29,50.0,auburn,https://atlanta.craigslist.org/nat/bik/d/acworth-pair-of-bikes-good-shape-50-each/7471746691.html,2022-04-15 15:56,"Pair of bikes, good shape, $50 each",4,"Asking $50 for one or $100 for both. Both in pretty good shape. They should both ride beautifully once they're tuned up at a bike shop.  Red is 24"", blue is 26""  Must pick up in Acworth.",,,, other/unknown, mountain,,, medium,,, 26 in,,,
30,50.0,auburn,https://atlanta.craigslist.org/nat/bik/d/cumming-kids-bikes-20-boys-girls-bmx/7464725140.html,2022-04-14 15:35,"2 Kids Bikes 20""; Boys, Girls; BMX, Mountain, Bicycle, Kent",10,"1. 20"" Kent 2 Cool BMX Girls Bike (Compare to $98 at Walmart); Used less than an hour like new condition: $40  Any girl would love riding this 2 Cool Bike out with her friends because it's an awesome mix of style and fun. This girls' bike features a durable steel frame with a drop bar to make mounting and dismounting the bike a breeze. It has both a rear foot brake plus dual hand brakes to give the rider improved control over her bike. This 20-inch girls' bike includes single-speed gearing and plastic pedals that will provide her with plenty of power to ride on flat surfaces and small hills. Steel BMX handlebars provide exceptional steering capability. This fun girl's bike comes with a colorful padded seat that will provide a comfortable place to sit while she rides.  Kent 20 In. 2 Cool BMX Girl's Bike, Satin Purple:  Durable steel frame with a drop bar Single speed bike Rear foot brake plus dual hand brakes Wheels/tires: 20"" wheels and tires Steel BMX handlebars Colorful padded seat Kent BMX bike includes a kickstand Dimensions: 55""L x 26""W x 36""H Recommended Age: 8 to 12 Years  2. 20"" Hyper Bike Boys Shocker Mountain Bike (Compare to $138 to Walmart) good condition; $40  Ride off the pavement in the Hyper Bicycles 20"" Boys Shocker Mountain Bike in Black. This kids mountain bike features a lightweight aluminum frame that lets users ride harder for longer. The Shocker includes both rear suspension for a smooth ride on any surface and alloy rims with front and rear linear pull breaks for the ability to stop and go as you please. It features 7 speeds, ensuring versatility in the ride. The bike has comfortable twist shifters with a rear derailleur, allowing riders to change the gears quickly and smoothly. Designed with your comfort in mind, it features a deluxe padded seat, gripped handlebars, and resin platform pedals. This mountain bike has a sleek, black design with blue accents that provides a modern look. The bike can be ridden on a variety of surfaces, allowing for flexibility in where you go with it. Perfect for your off road adventure or weekend leisurely rides, the Hyper Shocker Mountain Bike will help make your rides more enjoyable.  Hyper Bicycles 20"" Boys Shocker Mountain Bike, Kids, Black  Frame: Steel full-suspension with front suspension forks Speed: 7 speed bike has consistent twist shifters with rear derailleur Brakes: Front and rear linear pull brakes Wheels: 20"" spoked Rider Height: 4'2"" - 5'0"" Max Rider Weight: 135 lbs", excellent, Kent,, other/unknown, bmx,,, Medium,,, 20 in,,,
31,115.0,auburn,https://atlanta.craigslist.org/nat/bik/d/cleveland-autobike-bicycle-automatic/7460217963.html,2022-04-14 09:43,Autobike Bicycle Automatic Shifting bike bikes rare,0,"I have an original AUTOBIKE AUTOMATIC Shift SHIFTING BIKE,$115. It is in Great shape.  Were in CLEVELAND NEXT TO HELEN GA.",,,, steel, cruiser,,, 19.5,,, 26 in,,,
32,1234.0,auburn,https://atlanta.craigslist.org/atl/bik/d/fayetteville-buy-sell-trade-80s-90s-bmx/7460807316.html,2022-04-14 07:53,Buy/Sell/Trade 80s/90s BMX/freestyle Bikes,0,,,,,,,,,,,,,,,
33,1799.0,auburn,https://atlanta.craigslist.org/nat/snd/d/lebanon-ace-hardware-in-woodstock-kids/7470917649.html,2022-04-13 16:41,"Ace Hardware in Woodstock Kids Dirt Bikes , Go karts",24,"We are your 1 Stop shop for Kids Atvs, Dirt Bikes, Go Karts, Scooters, UTVS, Parts, Service, Financing, 115 Colony Center Dr. Woodstock, GA 30188   Come on down and view our showroom! what better way to experience   Brand New 200cc  Kids Go Karts.   Affordable FUN The new 200 Wolf kid's go-kart with a 196cc powerplant. The 200 Wolf comes standard with an automatic CVT tranny with reverse so it's easy to maneuver in tight spots. The Wolf go kart sits on an independent front suspension with a a swing-arm rear setup and big 16 inch all-terrain tires with hydraulic rear disc brakes for excellent handling on rough, rugged trails. This mini sized go-kart is specifically designed for kids and features high-back seats, over-the-shoulder safety harnesses, a padded brush guard cage and fully enclosed floor pan to keep little ones safe and secure while riding. The driver's seat is adjustable to ensure a proper fit for kids of all sizes. Plus, a keyed ignition and built-in speed governor make it easy for parents to control when the kids ride and how fast they go! And finally, high-mounted overhead front facing lights help maximize visibility for optimum safety.    SPECIFICATIONS Model: WOLF 200 Engine: Four-stroke, Single-cylinder, Forced Air-cooled OHV Displacement: 196cc Compression Ratio 8.5:1 Power: 4.0kw Bore/ Stroke φ68*54mm Start Type: Keyed Electric Start Ignition: CDI Transmission: Automatic w/ Reverse Final Drive: Chain Battery: 12V 4Ah Fuel Capacity: 0.48 gal. Max Speed: 35 MPH Brakes (front/rear): Hydraulic Disc / Hydraulic Disc Tires (front/rear): 145/70-6 /16 x 8-7 Wheels: Steel Suspension (front/rear): Independent with coil-over shocks / Swing arm with dual coil-over shocks Dry Weight: 287 lbs. Gross Weight: 360 lbs. Max Loading: 330 lbs. Distance to Pedals: 31.5 - 34 inches (seat adjustable) Height to Seat: 9 inches Ground Clearance: 6.3 inches Wheelbase: 49 inches Dimensions (LxWxH): 67x44x47 inches Shipping Carton Dimensions (LxWxH): 69x45x25 inches EPA Certified - NOT CARB LEGAL Features: Engine Kill Switch, Headlights, Tool Kit, Dual safety harnesses, Integrated side rails and padded top brush guard cage, Enclosed floorpan, Emergency Brake and Canopy. Configurations And Specifications Subject To Change Without Notice. 90 day warranty. 770-924-5091  CALL ACE  WE OFFER FIANCING 90 DAYS SAME AS CASH , NO CREDIT CHECK.  WE OFFER 3-5 YEARS ON OUR UTVS, BUGGIES, STRET BIKES, ATVS,  SEE YOU SOON.     Affordable FUN the full-size XTR 250 Dirt Bike comes with all the same great features found on more expensive Japanese bikes at less than half the price! Comparable to the Suzuki DR-Z, Kawasaki KLX, Yamaha XT or TT-R, and Honda CRF motorcycles, the XTR 250 comes standard with electric and kick start, front and rear disc brakes, and enhanced suspension. Built over a heavy-duty steel twin-spar frame, boasts big 54mm inverted forks up front and an adjustable mono shock in the rear along with a full-size 21 inch front wheel that provides excellent ground clearance and makes navigating obstacles and off-road trails a breeze. Make no mistake, with a 36.6 inch tall seat, this is a serious dirt bike! And it's got a serious 250cc 4-stroke engine and manual 5-speed tranny for a power combination best suited to experienced riders. Just feather the clutch, twist the throttle and put the power on the ground! Heavy-duty spoke rims wrapped in aggressive knobby tires are perfect for climbing over rocks and downed trees, clawing through muddy terrain and scrambling up hills. You won't find a more capable motorcycle for exciting off-road trail riding action for the price! CARB Approved. Comes in NEW colors: blue, green, red, blue and classic black.    Financing OAC programs 90 days same as cash. only $40.00 Down .  turbopowersports.com Dirt bikes and ATVs for all ages, Dirt Bikes, colors and type of dirt bikes and ATVS . Affordable Fun Need gifts for your kids? we have the 49cc 70cc 110cc  Vespa, Moped, Motorcycle, Motor Scooter, Scooter, Scooters Motorized Bicycle, Pre-Owned Scooters, Piaggio Scooters, Genuine Scooters, Vespa Scooters, moped, vespa scooter, piaggio scooter, aprilia scooter, motoguzzi, bsa, Norton, royal enfield, triumph Bonneville, triumph thruxton, genuine buddy scooter, genuine stella scooter, genuine blur scooter, kymco like scooter, kymco super 8 scooter, kymco agility scooter, kymco people scooter, sym wolf 150, sym hd 200 hd200, sym fiddle scooter lance cali classic scooter, lance Havana scooter, lance pch scooter, lance cabo scooter, Honda ruckus scooter, Honda elite scooter, Honda grom scooter, Yamaha zuma scooter, Yamaha riva scooter, Yamaha vino scooter, café racer, royal enfield, Suzuki gsxr gsx r , Honda cbr, ysr, Honda rebel 250, 50cc scooter moped, 125cc scooter moped, 250cc scooter moped, tao tao scooter, tank scooter, bms scooter, flyscooter flyscooters, znen scooter, ssr motorsports, ssr scooter, Italian scooter, electric scooter, electric moped, trike, three wheel scooter, sprint scooter, vespa p200, stella scooter, mini bike, pit bike, dirt bike, endure bike, zero motorcycle, scooter Genuine Buddy, Stella, Vespa, Honda, Yamaha, Piagio, Vino, Ruckus 50 125 SYM, Vespa, Buddy, Scooter, Scooter repair, Classic, 250, 150,Genuine Scooter service LX PX Rally, Lambretta, Motorcycle, Scooter, Training, Lessons, Classes, Course, Instruction, School, Los Angeles, M1, DMV, Honda, Rebel, Nighthawk, CB, 250, CB250, 300, CB300, 350, CB350, Suzuki, GS, GN, 125, GS250, GN125, GN250, Kawasaki, Ninja, Eliminator, Vulcan, 500, EN500, Yamaha, Star, Sym, Vespa, Piaggio, Kymco, Aprilia, Buddy, PCX, Metropolitan, Benelli, Peugeot, Hyosung, Zuma, Majesty, Ducati Honda Harley Davidson Zuma Metropolitan Scooter Vespa Kawasaki Suzuki Ruckus Panigale Yamaha YCFR1 CBR GXR 49CC 50CC 125CC 149CC 150CC ATV PIT BIKE GO KART GROM pocketbike pocketbikes pocket bike pocket bikes Super Bike Dirt Bike dirtbike superbike xr xr50 50cc 70cc 90cc 100cc 110cc 125cc 150cc Pit Bike pitbikes Honda Yamaha Go Cart GoCart GOPED ,DIRT BIKE,DIRT, MINI BIKE, POCKET BIKE, YSR, GOKART, 50, STUNT BIKE, STUNT, SICK BIKE, SDG,BBR ATV crf50 crf Chopper Min    Are you looking for a discounted Scooter in *San Diego* *Redlands* *El Cajon* *Riverside* *San Bernardino* *Moreno Valley* *Corona* *Chino* Ontario* *Rancho* *Cucamongo* *Rialto* *Fontana* *Hemet* *Palm Springs* *Morongo Valley* *Yucca Valley* *Palm Desert* *Desert Hot Springs* *Apple Valley* *Coasta Mesa* *Pomona* *Anaheim* *Irvine* *Long Beach* *Torrance* *Los Angeles* *Santa Monica* *Pasadena* *Chula Vista* *Carlsbad* *Chula Vista* *Coronado* *Del Mar* *El Cajon* *Encinitas* *Escondido* *Imperial Beach* *La Mesa* *Lemon Grove* *National City* *Oceanside* *Poway* *San Diego* *San Marcos* *Santee* *Solana Beach* *Vista* Escondido* Carlsbad* our special deals on our scooters will save you from having to drive as far to get a great deal. Susanville, Sacramento, clovis, grass valley,Stockton, Plattsburg, Pittsburgh, Overton Nevada,  SCOOTERS, DIRT BIKES, GO KARTS, STREET BIKES, BUGGIES, BMS KANDI COOLSTER  APOLLO, TGB, CFMOTO, HISUN, ODES, UTVS, ATVS, KIDS ATVS, SERVICE, PARTS, Brighton Michigan, Livingston County, Michigan, Ellen wood GA 30294 ZIP CODE 54904 Little Rock AR 72201 Stockton 95202 Fort Collins 80524 Spring field MO 65721 Order Online at turbopowersports  it's ok to contact this poster with services or other commercial interests Sedalia 65301, 65340, Marshall 30188 https://www.google.com/search?gs_ssp=eJzj4tTP1TcwKiowTVZgNGB0YPDiSUxOVchILEopTyxKBQBvIAg6&q=ace+hardware&rlz=1C1CHBF_enUS943US944&oq=ace+har&aqs=chrome.1.69i59j46i199i291i433i512j0i433i457i512j69i57j0i402j69i60l3.4167j0j7&sourceid=chrome&ie=UTF-8  https://www.acehardwarestorewoodstockga.com/",,,,,,,,,,,,,,
34,1699.0,auburn,https://atlanta.craigslist.org/atl/snd/d/lebanon-kids-dirt-bikes-and-go-karts-at/7470781238.html,2022-04-13 12:24,Kids Dirt Bikes and Go karts at Woodstock ACE Hardware store,15,"Welcome to ACE HARDWARE in Woodstock come on down to see our new line of dirt bikes and go karts . We have been serving our customers for 25 years! We Offer Financing from 5 Years to 90 Days same as cash.  Not Only have we developed our own brand, WE HAVE PARTS. We spent the Last 4 Years Developing our Dirt Bike Line. From 70cc 110cc 125cc 250cc  Affordable FUN XTR 110 MINI PIT BIKE is an awesome, fully automatic dirt bike perfect for kids and youth! With no clutch to wrestle, little ones can start building riding skills without having to shift! This Mini Pit Bike is powered by a low-maintenance, 4-stroke 110cc engine that produces over 8 horsepower and is capable of moving loads of over 132 pounds.  A smaller frame and low 25 inch seat height keep this motorcycle small enough for kids to maneuver easily while the off-road knobby tires and full suspension mean it can easily handle rugged terrain on the trails. Front and rear disc brakes provide supreme control and excellent stopping power. Electric start. Choice of several colors    Store Hours -  The Helpful Place Daniel Ace Hardware 115 Colony Center Dr Woodstock, GA 30188 Come visit us online @ http://www.acehardware.com/mystore/index.jsp?store=03885&cid=localstore03885  Accepted Payment Methods: Debit Card Sunday	 	11:00 AM	 – 	5:30 PM Monday	 	8:00 AM	 – 	6:00 PM Tuesday	 	8:00 AM	 – 	6:00 PM Wednesday	 	8:00 AM	 – 	6:00 PM Thursday	 	8:00 AM	 – 	6:00 PM Friday	 	8:00 AM	 – 	6:00 PM Saturday	 	8:00 AM	 – 	6:00 PM    Affordable FUN XTR 110 MINI PIT BIKE is an awesome, fully automatic dirt bike perfect for kids and youth! With no clutch to wrestle, little ones can start building riding skills without having to shift! This Mini Pit Bike is powered by a low-maintenance, 4-stroke 110cc engine that produces over 8 horsepower and is capable of moving loads of over 132 pounds. A smaller frame and low 25 inch seat height keep this motorcycle small enough for kids to maneuver easily while the off-road knobby tires and full suspension mean it can easily handle rugged terrain on the trails. Front and rear disc brakes provide supreme control and excellent stopping power. Electric start. Choice of several colors  Wheelbase 41.33 inches Dirt Bike Dimensions L60 x W29 x H38 inches Height to seat 32 inches Min ground clearance 9 inches Carton Dimensions L53 x W15 x H26 inches  NOT FOR SALE IN STATE OF CALIFORNIA - NOT CARB APPROVED  Average delivery time for most of the nation: 7-10 business days after ordering. Have questions before you decide? Call us at 714.888.5114 or text 714.888.5114 ... licensed dealer offering local pickup or shipping nation wide.     FIANACING ON APPROVED CREDIT.  turbopowersports com 24/7 in stock now.  ORDER NOW AT 714-888-5114 ORDER, Financing OAC AS LOW 3.9 APR  California Number 1 on line dealer turbopowersports.com Dirt bikes and ATVs for all ages. We're the largest Chinese brand dealer in California selections of colors and type of dirt bikes and ATVS . Affordable Fun Need gifts for your kids? we have the 49cc 70cc 110cc Vespa, Moped, Motorcycle, Motor Scooter, Scooter, Scooters Motorized Bicycle, Pre-Owned Scooters, Piaggio Scooters, Genuine Scooters, Vespa Scooters, moped, vespa scooter, piaggio scooter, aprilia scooter, motoguzzi, bsa, Norton, royal enfield, triumph Bonneville, triumph thruxton, genuine buddy scooter, genuine stella scooter, genuine blur scooter, kymco like scooter, kymco super 8 scooter, kymco agility scooter, kymco people scooter, sym wolf 150, sym hd 200 hd200, sym fiddle scooter lance cali classic scooter, lance Havana scooter, lance pch scooter, lance cabo scooter, Honda ruckus scooter, Honda elite scooter, Honda grom scooter, Yamaha zuma scooter, Yamaha riva scooter, Yamaha vino scooter, café racer, royal enfield, Suzuki gsxr gsx r , Honda cbr, ysr, Honda rebel 250, 50cc scooter moped, 125cc scooter moped, 250cc scooter moped, tao tao scooter, tank scooter, bms scooter, flyscooter flyscooters, znen scooter, ssr motorsports, ssr scooter, Italian scooter, electric scooter, electric moped, trike, three wheel scooter, sprint scooter, vespa p200, stella scooter, mini bike, pit bike, dirt bike, endure bike, zero motorcycle, scooter Genuine Buddy, Stella, Vespa, Honda, Yamaha, Piagio, Vino, Ruckus 50 125 SYM, Vespa, Buddy, Scooter, Scooter repair, Classic, 250, 150,Genuine Scooter service LX PX Rally, Lambretta, Motorcycle, Scooter, Training, Lessons, Classes, Course, Instruction, School, Los Angeles, M1, DMV, Honda, Rebel, Nighthawk, CB, 250, CB250, 300, CB300, 350, CB350, Suzuki, GS, GN, 125, GS250, GN125, GN250, Kawasaki, Ninja, Eliminator, Vulcan, 500, EN500, Yamaha, Star, Sym, Vespa, Piaggio, Kymco, Aprilia, Buddy, PCX, Metropolitan, Benelli, Peugeot, Hyosung, Zuma, Majesty, Ducati Honda Harley Davidson Zuma Metropolitan Scooter Vespa Kawasaki Suzuki Ruckus Panigale Yamaha YCFR1 CBR GXR 49CC 50CC 125CC 149CC 150CC ATV PIT BIKE GO KART GROM pocketbike pocketbikes pocket bike pocket bikes Super Bike Dirt Bike dirtbike superbike xr xr50 50cc 70cc 90cc 100cc 110cc 125cc 150cc Pit Bike pitbikes Honda Yamaha Go Cart GoCart GOPED ,DIRT BIKE,DIRT, MINI BIKE, POCKET BIKE, YSR, GOKART, 50, STUNT BIKE, STUNT, SICK BIKE, SDG,BBR ATV crf50 crf Chopper Min  Are you looking for a discounted Scooter in *San Diego* *Redlands* *El Cajon* *Riverside* *San Bernardino* *Moreno Valley* *Corona* *Chino* Ontario* *Rancho* *Cucamongo* *Rialto* *Fontana* *Hemet* *Palm Springs* *Morongo Valley* *Yucca Valley* *Palm Desert* *Desert Hot Springs* *Apple Valley* *Coasta Mesa* *Pomona* *Anaheim* *Irvine* *Long Beach* *Torrance* *Los Angeles* *Santa Monica* *Pasadena* *Chula Vista* *Carlsbad* *Chula Vista* *Coronado* *Del Mar* *El Cajon* *Encinitas* *Escondido* *Imperial Beach* *La Mesa* *Lemon Grove* *National City* *Oceanside* *Poway* *San Diego* *San Marcos* *Santee* *Solana Beach* *Vista* Escondido* Carlsbad* our special deals on our scooters will save you from having to drive as far to get a great deal. Susanville, Sacramento, clovis, grass valley,Stockton, Plattsburg, Pittsburgh, Overton Nevada,",,,,,,,,,,,,,,
35,949.0,auburn,https://dothan.craigslist.org/snd/d/arlington-new-atvs-dirt-bikes-go-karts/7470658481.html,2022-04-13 05:50,New ATVs | Dirt Bikes |Go-Karts Golf Carts Scooters & More Sale !!!!!!,18,"FREE SHIPPING! Only at 360Powersports.com  CALL NOW 469-217-7070  SHOP OUR IN-STOCK ITEMS TODAY!   https://www.360powersports.com/in-stock/  360 Powersports is your one-stop-shop Atvs, dirt bikes, go-karts, scooters, utvs, side by side.  TAKING CARE OF BUSINESS ONE CUSTOMER AT A TIME!     Use this code at check out to save $25 Buy1Save25     HUGE SALE ON ALL PRODUCTS!!  Free shipping right to you!   Fast & Financing With Flexible Monthly Payments!     WE ALSO OFFER FULLY ASSEMBLED AND TESTED SERVICE AT A ADDITIONAL COST. WE HIGHLY RECOMMEND YOU GET IT FULLY ASSEMBLED AND TESTED SO WHEN YOU RECEIVE YOUR UNIT YOU JUST GAS & GO.      ATVS 110cc Beginner ATVs - $949 125cc Kids Mid-Size ATVs - $1299 Adult ATVs - starting at $1999  Dirt Bikes Kids Dirt Bikes starting at $399.95  Mid size Dirt Bikes starting at $929 Full-Size Dirt Bikes - starting at $1309  Go-Karts & UTVs Kids Go-Kart - starting at $1379 Adult GoKarts & UTVs starting at $2649  Golf carts (Gas)  Gas Powered Golf Carts starting at $6250     Golf carts (Electric)   Electric golf Carts starting at $7950  360 Powersports is one of the nation’s largest power sports dealers across the USA. We are the HIGHEST RATED online dealer on Google and many other rating platforms! We are NOT the lowest dirt cheap price on the internet and nor do we strive to be. When purchasing a vehicle with us you will get value and customer service including our 360 Care, Tech Support, assigned Rep, fast delivery, and more! We carry all parts and all products come with industry-leading warranties! Most of our products come with speed governors, remote kill switches, factory-tested & heat-cycled engines, and much more!   **Fast 5-10 Day Shipping Right To You Free shipping!      Shop Now At www.360Powersports.com To Receive The Best Customer Service At The Lowest Prices  OR Call Us At 469-217-7070 To Place Your Order!     Keywords: MOTORCYCLE, MOTORCYCLES, HONDA, YAMAHA, KAWASAKI, DIRT BIKE, DIRT BIKES, ATV, ATVS, GO-KART, GO-KARTS, POLARIS. atv, atvs, kids atv, 4 wheeler, 4-wheeler, 4-wheelers, quad, kid quad, mini quad, quads, go-kart, go-karts, gokart, gokarts, go kart, go karts, gocart, go cart, dune buggy, dune buggie, dune buggies, sand rail, dirt bike, pit bike, moped, scooter, enduro, motorcycle, mini bike, monkey bike, doodle bug, dirtbike, pitbike, coolster, roketa, honda clone, gy6, taotao, bashan, kandi, kinroad, dongfang, chinese, china, parts, repairs, clearance, budget, wholesale, sale, 49cc, 50cc, 70cc, 80cc, 90cc, 110cc, 125cc, 150cc, 170cc, 180cc, 200cc, 250cc go-kart, batman, jaguar, recon, hunter, rancher, shark, rapidity, viper, t-rex, cazador utv, utvs, polaris copy, crazor, avenger, sxs, ninja bike, Kawasaki, Polaris SCOOTER, SCOOTERS, MOTORCYCLE, MOTORCYCLES, HONDA, YAMAHA, KAWASAKI, DIRT BIKE, DIRT BIKES, ATV, ATVS, GO-KART, GO-KARTS, POLARIS. atv, atvs, kids atv, 4 wheeler, 4-wheeler, 4-wheelers, quad, kid quad, mini quad, quads, go-kart, go-karts, gokart, gokarts, go kart, go karts, gocart, go cart, dune buggy, dune buggie, dune buggies, sand rail, dirt bike, pit bike, moped, scooter, enduro, motorcycle, mini bike, monkey bike, doodle bug, dirtbike, pitbike, coolster, roketa, honda clone, gy6, taotao, bashan, kandi, kinroad, dongfang, chinese, china, parts, repairs, clearance, budget, wholesale, sale, 49cc, 50cc, 70cc, 80cc, 90cc, 110cc, 125cc, 150cc, 170cc, 180cc, 200cc, 250cc go-kart, batman, jaguar, recon, hunter, rancher, shark, rapidity, viper, t-rex, cazador utv, utvs, polaris copy, crazor, avenger, sxs, ninja bike, Kawasaki, Polaris, cazador, electric golf carts , enforcer golf carts",,,,,,,,,,,,,,
36,90.0,auburn,https://atlanta.craigslist.org/nat/bik/d/marietta-bike-rack-for-four-bikes/7470398508.html,2022-04-12 14:08,Bike Rack for four bikes,0,Fits two inch receiver hitch. Heavy duty. Made by Thule., good, Thule, Four Bike, other/unknown, other, none, none, any, other/unknown, none (rigid), 27 in,,,
37,1400.0,auburn,https://atlanta.craigslist.org/atl/bik/d/atlanta-2trek-road-bikes-56cm-105/7470342870.html,2022-04-12 12:30,2trek Road bikes 56cm 105 component/,3,Two Trek Road bike 56cm Full shimano 105 components! 1400 for both. Or 800 a Peace call or text kevin  show contact info  ASAP !!! Making room for a New Bike, excellent,,, carbon fiber, road, caliper, none, 56cm, drop, none (rigid), 700C,,,
38,300.0,auburn,https://gadsden.craigslist.org/bik/d/boaz-mini-motor-bikes/7468381848.html,2022-04-07 18:07,Mini motor bikes,6,"Very lights used, can go down to $250 per bike", like new, Real tree, Unknown, other/unknown, other, other/unknown, other," 54 cm, medium", other/unknown, other/unknown, other/unknown,, Unknown,
