,Price,Location,URL,Date,Title,condition,make / manufacturer,model name / number,num image,text,bicycle frame material,bicycle type,frame size,wheel size,part type,serial number,suspension,brake type,handlebar type,electric assist,size / dimensions
5666,200.0,cosprings,https://cosprings.craigslist.org/bik/d/colorado-springs-single-speed-commuter/7470903103.html,2022-04-13 14:16,single speed commuter, excellent, Civilian, Ramble,3,"""Ramble"" single speed commuter by Civilian Bikes (CVLN). Excellent condition. Front porteur rack. Alloy fenders. Steel frame. Cork grips. Velo saddle. Seat tube length: 23inch / 58.4cm. XL frame size. (I'm 6'1"" and this bike is a great fit for me).  See more specs here: http://www.bikeroar.com/products/civilian/ramble-2012/specs  Cash only.", steel, road," 58cm, XL", 700C,,, none (rigid), caliper, cruiser, none,
5667,200.0,cosprings,https://cosprings.craigslist.org/bop/d/colorado-springs-thule-two-bike-car/7467567806.html,2022-04-13 12:22,Thule Two Bike Car Rack - 2 Inch Hitch, good, Thule, Bicycle Rack,3,"Thule 2 Bike Car Rack  Selling because I have other ways to transport my bicycles now Used but in good condition, everything still works on it and is in solid condition.  Very sturdy build Holds two bicycles with front wheels off and attached via a quick-release clamp Comes with a key that locks the rack to the car and an additional cable that can lock the bikes to the rack Mounts to the car with a 2in-hitch receiver Will consider reasonable offers Local pick up - cash, Venmo, or PayPal only",,,,, other,,,,,,
5668,140.0,cosprings,https://cosprings.craigslist.org/bop/d/colorado-springs-packing-and-shipping/7465025508.html,2022-04-13 11:12,Packing and shipping bicycles anywhere in the US,,,,3,"Your bike will be professionally packed and boxed. Shipping in the continental United States by Fedex insured most bikes boxed shipped for $140 total. 29r, fat tire bikes and  E bikes bikes can cost more to ship, contact for quote.  Can ship worldwide for additional cost.",,,,,,,,,,,
5669,3200.0,cosprings,https://cosprings.craigslist.org/bik/d/colorado-springs-specialized-works/7461057559.html,2022-04-13 08:51,Specialized S-Works Enduro, good, Specialized, S-Works Enduro,12,"This bike is incredible!  It has faithfully carried me through some amazing adventures and has plenty more to offer.    This is a 2015 Specialized S-Works 29” Enduro, top of the line build.  It’s hard to describe how capable and fun this bike is.  Sadly it’s time for me to let go.    It weighs only 30.2 lbs without pedals (with a coil), which makes climbing far nicer than expected.    Build Specs:   Frame Size: Medium (Carbon front triangle, aluminum rear triangle - factory spec) Front Fork: Rock Shox 160mm Pike Rear Shock: Ohlins TTX 22M Coil Shock 163mm Travel (480 and 457lb springs included along with stock - Cane Creek DB AIR Inline - 155mm) Brakes: Sram Guide RS front and rear Cranks: S-Works FACT Carbon 175mm Drivetrain: SRAM XX1 1x11 w/32t chainring Handelbar: Renthal Fatbar Seatpost: KS LEV with upgraded paddle lever Wheelset: Roval Traverse SL Tires: Maxxis DHF front and rear 60-70% Tread left  Lots of extras: rim plugs, extra coil, stock rear shock, decals, boost wheel adapters, etc.  This bike has plenty of “character” with scrapes throughout.  No dents, dings, or carbon issues.  This frame was made incredibly well and continues to hold up.  Cable and frame wear points have been reinforced with frame tape and electrical tape.  This thing is ready to ride for years to come.    For more detailed specs here is the Vital MTB breakdown: https://www.vitalmtb.com/product/guide/Bikes,3/Specialized/S-Works-Enduro-29,15201#product-specs   There are some small changes, but overall the builds is very close to this listing.  $3200 OBO, please email me if interested.", carbon fiber, mountain, Medium, 29 in,,, frame and fork (full suspension), disc (hydraulic),,,
5670,225.0,cosprings,https://cosprings.craigslist.org/bik/d/colorado-springs-huffy-road-bike/7467503086.html,2022-04-12 22:38,Huffy road bike, like new, Huffy,,3,"Got the bike as a Christmas present, now that I’m moving, I cannot take it with me. Ridden less than 50 miles! Purchase of the bikes comes with a seat cushion ($20) rear and head lights ($30 combined) and a helmet (30). Bike itself brand new is $270 plus tax.  Selling at $225 for the whole package", steel, mountain, 67 inches x 39, 26 in,,,,,,,
5671,1000.0,cosprings,https://cosprings.craigslist.org/pts/d/pueblo-classic-dyno-bicycles/7470507141.html,2022-04-12 15:40,CLASSIC DYNO BICYCLES, like new, Dyno,,3,"FOR SALE: A pair of Classic Dyno Bicycles. One is a Mens 1999 Dyno Deuce Flame Bike and the other a Womens 2001 Dyno Glide Deluxe. Neither of the bikes have 10 miles on them and selling as a pair only.  Phone calls only please, NO texts or emails.",,,,,,,,,,,
5672,1200.0,cosprings,https://cosprings.craigslist.org/bik/d/colorado-springs-rad-mission/7470457943.html,2022-04-12 13:59,Rad Mission 1,,,,3,"Hey! Looking to sell my Rad Mission 1 High Step. I bought it last spring, put about 100 miles on it, and it’s been in storage since. There’s nothing wrong with it, I just upgraded bikes. I’m including the fenders, rear rack, seat post, new seat, and cheap milk crate on the back if you want that. The bike is a blast to ride. Perfect commuter or to explore the various trails around town. I bought everything for $1500, i’m looking to get $900 OBO", other/unknown, other, High Step, 26.5 in,,,,,, throttle,
5673,1000.0,cosprings,https://cosprings.craigslist.org/bik/d/colorado-springs-electric-assist-hybrid/7470425897.html,2022-04-12 12:57,Electric assist Hybrid/touring bike, good, Motobecane, Elite,0,"I built this touring bike from a $500 2014 Motebcane Elite 38c x700 tires . Nothing fancy but a solid bike. Has a brand new dolphin style 13 amp hour 48 volt lithium battery, and a 500 watt Bafang geared rear hub motor with plenty of power to run up steep hills at full speed. Has a throttle assist with cruise control. It's not new but has plenty of life on it and the new battery should be good for 900 cycles . One of the fastest and most comfortable hybrid touring bikes you will find for this price. I set it up for bike hiking the bike paths of Colorado but it will also cruise all over town and with a huge 52 tooth front sprocket it has plenty of top end speed.  Range is about  30 miles with pedaling. Disk brakes, saddle bags, and custom grips and very comfortable seat make it a great bike for getting places.   three 03-eight 77-two224.", aluminum, hybrid/comfort," medium to large 20""", 700C,,, suspension fork (hardtail), disc (mechanical), cruiser, throttle,
5674,150.0,cosprings,https://cosprings.craigslist.org/bik/d/pueblo-bike-hitch-mount-rack/7470317313.html,2022-04-12 09:46,Bike hitch mount rack, good,,,2,Bike hitch mount rack  $75 obo  Bike rack mounts to 1 or 2 inch trailer hitch receiver.  It is configurable to carry 1  3-wheel or 2 2-wheel bikes.  A built-on security cable to secure the bikes to the rack is included., steel, other, adjustable, other/unknown,,,,,,,
5675,75.0,cosprings,https://cosprings.craigslist.org/bop/d/woodland-park-yakama-bike-rack/7470268079.html,2022-04-12 08:13,Yakama bike rack, excellent, Yakama, Rim ROC,9,"For sale is a Yakama Rim ROC bicycle rack for your 2"" hitch receiver.  As you can see, you can hang your bikes either way for transportation.  The pictures speak for themselves as to condition.  It has been so long since I've used this that I can't really remember how many times I did.  Let me know I can answer any questions....happy to do so!",,,,, other,,,,,,
5676,600.0,cosprings,https://cosprings.craigslist.org/bik/d/woodland-park-build-cannondale-mountain/7470253554.html,2022-04-12 07:40,Build a Cannondale mountain bike, excellent, Cannondale, Super V,6,"Being offered is a Cannondale Super V frame and swingarm ready to be built into a custom mountain bike.  I have all the parts and pieces you will need to build a complete mountain bike, depending on what exactly you are wanting to build.  The price is for the frame and swingarm only.  Please contact me for a complete build solution and I will walk you through your potions and prices.  Both parts are aluminum with the swingarm being freshly powder coated.  The cable stays have been modified to switch from squeeze rim brakes to hydraulic front and rear.  For a full description of what is possible with this build, search the web for ""Cannondale Uber V"" and see for yourself.  I am happy to answer any questions you have.  If a build is not in your wheelhouse, I also have finished bikes for sale.", aluminum, mountain, Large, 26 in,,, frame and fork (full suspension), hydraulic rim brakes,,,
5677,1000.0,cosprings,https://cosprings.craigslist.org/bik/d/colorado-springs-jamis-bicycle/7459558788.html,2022-04-12 04:55,Jamis Bicycle, excellent, Jamis, Parker,11,"This bike is the all around go to bike, perfect for absolutely any riding condition. Comes with air pump and unbreakable bike lock!  These bikes sell for around $3,000.00  Price just reduced 40% from $1000 down to $600. Don't pass this deal up!  Call or text anytime day or night!  LOCAL SALES ONLY PLEASE!!! CASH, PAYPAL, AND CASHAPP 0NLY PLEASE!!! ABSOLUTELY NO CHECKS!! 🚫🙅", aluminum, hybrid/comfort, 15.5, 18 in,,, frame and fork (full suspension), disc (hydraulic), riser, none,
5678,179.0,cosprings,https://cosprings.craigslist.org/fod/d/colorado-springs-24-volt-36v-42v-48v/7470204791.html,2022-04-12 03:09,__24 volt 36v 42v 48v Golf Cart Battery Charger EZGO Club Car Yamaha__, new, Club Car EzGo Western Yamaha, PowerWise Delta-q PowerDrive,20,"!!! Golf Cart Chargers with Built-In Battery Rejuvenator !!! ****ALL CHARGERS ARE NEW****  KEEP YOUR BATTERIES FULLY CHARGED WHEN NOT IN USE - All our SMART CHARGERS have a Maintenance Mode feature - will automatically keep your batteries charged during the winter months or any time you retire your golf cart for extended periods of time.  REVERSE PULSE TECHNOLOGY - All our SMART CHARGERS will desulfate/rejuvenates your batteries every time you charge them.  NEW 36 Volt, 42 Volt & 48 Volt Automatic Desulfating Battery Chargers For - Club Car - Cushman - E-Z-GO - Bad Boy - Star - Taylor Dunn - Tomberlin - Yamaha - Western - Scissor Lifts - Electric Bikes - Scooters - Mobility - Floor Scrubber  ****FREE 2 DAY SHIPPING**** CALL: (442) 444-1045 SPECIFICATIONS: 36-VOLT CHARGERS NEW 36 Volt 5 Amp - Fully Automatic SMART CHARGER with Built-in Desulfator (36V5AD) NEW 36 Volt 20 Amp - Fully Automatic SMART CHARGER with Built-in Desulfator (36V20AD) NEW 36 Volt 25 Amp - LESTRONIC II Fully Automatic Battery Charger - Lester Electrical (36V25A) 42-VOLT CHARGERS NEW 42 Volt 6 Amp - Fully Automatic Battery Charger (42V6A) (Very low stock)  48-VOLT CHARGERS NEW 48 Volt 5 Amp - Fully Automatic SMART CHARGER with Built-in Desulfator (48V5AD) NEW 48 Volt 17 Amp - Fully Automatic SMART CHARGER with Built-in Desulfator (48V17AD) STARTING FROM: $179.95 DESCRIPTION: Intelligent Fully Automatic Battery Charger, featuring a trickle charge and pulse mode, which is kinder to your batteries. Most of our chargers have a built-in Desulfator, which will significantly prolong the life of your batteries, help charge them faster and provide maximum performance and power.  Featuring a digital readout of the voltage and current, informing you of the status throughout the entire charging process. Operates on standard household power (110VAC 60 Hz).  Unless otherwise requested, all our chargers come pre-configured with a connector plug that is compatible with your golf cart. Please verify that the connector you see in the picture matches the receptacle on your golf cart (see pictures). Please note: We carry every charger/connector plug combination so if you do not see the combination for your cart, it's just that we did not post a picture; we have every combination in stock.  SMART CHARGER FEATURES: MAINTENANCE MODE (AUTOMATIC STOP / RESTART): Automatically stops charging when the batteries are fully charged and continues monitoring the battery's voltage and restarts charging automatically when it detects a preset voltage drop, replenishing energy with pulse current. It can be connected to the batteries for an extended period of time BUILT-IN BATTERY DESULFATOR/REJUVENATOR/RECONDITIONER/REGENERATOR Designed to help batteries charge faster and provide maximum performance and power. Prevents new batteries from becoming sulfated and rejuvenates older good working batteries by automatically dissolving harmful sulfation, by using safe high-frequency pulse technology. Patented WAVE Technology increases battery efficiency, extends battery life by 2-3 times and keeps batteries from failing prematurely due to suffocating sulfate crystals, hence reducing early battery replacement costs OVERCHARGE PROTECTION: Never worry about overcharging, as the charger automatically stops when batteries reach set voltage. Should you have a bad battery or batteries, the charger will safely and optimally charge the batteries without overcharging the good batteries EXTENDS THE WORKING LIFE OF YOUR BATTERIES: The Smart Charging characteristics of our Desulfating Battery Charger will dramatically increase the life of the batteries ELECTRICITY SAVINGS: Rejuvenated batteries charge quicker and reduce electricity consumption NO SPARK CHARGING, REVERSE POLARITY AND SHORT CIRCUIT PROTECTION: Prevents the output leads from sparking due to accidental reverse connection or short circuit DIGITAL AMP/VOLTMETER: Displays charge VOLTAGE, CURRENT and other useful information such as battery test and protection codes COMPACT AND CONVENIENT & EFFICIENT Small and light, adopting switch-mode technology aka Switching Power Supply. This is different from Linear Power used in traditional chargers. More than 85% of electrical energy is transferred to battery chemical energy, during the charging process, compared with 40% for conventional chargers. This technology is applicable for all battery types (wet, maintenance-free, VRLA, AGM, Gel etc.) HIGH TEMPERATURE PROTECTION If the charger gets too hot, it will automatically lower its temperature or switch off to protect the charger itself CONNECTOR PLUGS: All chargers come pre-configured with a Connector Plug of your choice, i.e. Club Car, E-Z-GO, Star, Taylor Dunn, Tomberlin, Western, Yamaha, Scissor Lifts, Floor Scrubbers and More. Please make sure the plug matches the one for your cart, (see connector plug pictures above).  CALL: (442) 444-1045",,,,,,,,,,, 36 Volt 42 Volt 48 Volt
5679,25.0,cosprings,https://cosprings.craigslist.org/bop/d/usaf-academy-racor-plb-2r-bike-rack/7470119807.html,2022-04-11 18:16,"Racor - PLB-2R, Bike Rack, Garage Wall Stand", good, Racor,,0,"Used Racor Gravity Bike Rack The Racor Gravity Bike Rack conveniently holds two bikes and up to 100lbs. The Gravity Bike Rack is freestanding and easy to assemble, so you can safely and securely store two bikes along the wall and immediately start saving space in the garage or in your home. At just 20lbs, the Gravity Bike Rack can be easily moved and repositioned. Independent adjustable arms accommodate men's and women's road and mountain bikes and keep them level.  Store up to two bikes securely Move and reposition the lightweight bike rack Rest it against any wall without bolts, screws, or fasteners Steel construction epoxy finish  See on Amazon for $80 https://www.amazon.com/Racor-PLB-2R-Gravity-Bike-Stand/dp/B000077CPK/ref=sr_1_28?keywords=2+bike+wall+rack&qid=1640318420&sr=8-28",,,,,,,,,,,
5680,3300.0,cosprings,https://cosprings.craigslist.org/mcy/d/canon-city-1998-yamaha-xt-225/7470118770.html,2022-04-11 18:09,1998 Yamaha XT 225,,,,3,"Like new, all new paint, all black. This bike is flawless. Has 5200 miles and is electric start. These bikes are rare. This one is perfect and street legal. Great little summer commuter or dirt bike. Please text only. I do not check email.",,,,,,,,,,,
5681,450.0,cosprings,https://cosprings.craigslist.org/pts/d/woodland-park-thule-roof-basket-system/7470071998.html,2022-04-11 16:14,THULE Roof Basket System, good, Thule, 690XT M.O.A.B. Safari,5,"Thule 690XT M.O.A.B Safari Roof Basket - 44”X39”X6-1/2” The Roof Rack System includes: (2) Evo Wingbars - 55” wide (these are the Load Bars/Cross Bars) and (4) Thule Rapid Traverse Foot Packs. Keys Included.  This is a complete roof basket system - ideal for carrying a spare tire, cooler, lawn chairs, fishing poles, etc. Additional accessories are available for carrying kayaks, bikes, etc.",,,,,,,,,,, 44”X39”X6-1/2”
5682,44500.0,cosprings,https://cosprings.craigslist.org/cto/d/colorado-springs-toyota-tacoma-trd-off/7469627524.html,2022-04-10 16:28,"Toyota Tacoma TRD OFF ROAD,  2017 low miles, 6spd, super clean, all the parts",,,,24,"Selling my 2017 Tacoma TRD OR, 4d 6sp. Has everything for 2017 with moonroof and tech package. TRD Pro wheels were ordered original and installed new.  Not being daily driven now, final mileage give or take a test drive and a car wash and fuel tank fill up to the buyer.  Low miles, 278XX and 30k service complete with tire rotation and alignment.  I have my service records.   I need something bigger but I've already installed complete suspension +2"" adjustable front remote reservoirs including  spc adjustable upper control arms, new leafs and rear roadmaster active suspension to keep a load stable when hauling bikes or moto. Also installed  Includes sprint booster which makes driving the manual even more smooth and easy.  As is pictured Snug Top with power, LED, and liner with Toyota bed mat.  I installed a new battery in January just in case.  Michelin tires installed at approximately 9300mi and rotated every other oil change and with suspension install.  Also factory installed are xenon headlights and led fogs. Vinyl protection installed when new on everything but the roof including hood blackout.  Really, REALLY love driving this little baby Taco but I don't go offroad and it seems I need to drive slow and carry bikes more than I need to go over, thru or around ALL the things. Do you need a bike rack?  This can be discussed.  Asking $45k obo clean title in hand.  Msg or call with questions or for more pics and to meet in person to see the vehicle.  Private sale, I can't take trades at the moment. And while I appreciate it wholesale offers just aren't bringing enough to the table.  Thank you.",,,,,,,,,,,
5683,75.0,cosprings,https://cosprings.craigslist.org/mpo/d/colorado-springs-lockhart-philips/7457891591.html,2022-04-10 15:13,Lockhart Philips motorcycle stand,,,,2,Was used on a CBR 600 but will fit many bikes $75,,,,,,,,,,,
5684,3200.0,cosprings,https://cosprings.craigslist.org/bik/d/colorado-springs-road-bike-kestrel/7469550138.html,2022-04-10 13:27,Road Bike: Kestrel Legend SL (Super Light), like new, Kestrel, Legend SL,6,"CARBON! FULL DURA-ACE!  The Kestrel Legend SL (Super Light) is constructed using the highest grade 800K Ultra high-modulus carbon fiber in a one-piece mold structure. Complimenting the sophisticated frame design is Shimano's top tier Dura Ace group set for professional level performance. This bike was Kestrel's flagship machine with full Dura-Ace build and carbon everything. Weight is sub 16 pounds. Darn light for a size 62! This is one screaming machine in phenomenal condition!  Specs: - Carbon frame and fork - Full Dura-Ace Group-set (11 Speed) - Weight: 15.6 Pounds (w/out pedals) - Size: 62cm (XL) - Components:   * Shifters/Brake Levers: Shimano Dura-Ace   * Derailleurs: Shimano Dura-Ace    * Crankset: Shimano Dura-Ace Compact (2x11)      + 175mm crank arms      + Chainrings: 34/50    * Chain: Shimano Dura-Ace    * Brakes: Shimano Dura-Ace Rim Brakes (Side-Pull)    * Cassette: Shimano Dura-Ace, 11-28    * Stem: Oval Concepts, 0-5 degree rise, 130mm    * Handlebar: Oval Concepts Carbon    * Seatpost: Oval Concepts Carbon    * Wheel-set: Oval Concepts 946 Carbon Clincher      + Oval Concepts 900 cartridge bearing hub-set       + 22mm wide, 15mm internal, 50mm depth      + Bladed spokes      + Oval Concepts 9mm skewers    * Tires: Continental Grand Prix 4000, size 23mm    * Saddle: Oval Concepts    * Current model URL: https://www.kestrelbicycles.com/bikes/road/legend-sl-shimano-dura-ace", carbon fiber, road, 62cm, 700C,,,, cantilever, drop, none,
5685,1400.0,cosprings,https://cosprings.craigslist.org/bik/d/usaf-academy-bike-yamaha-cross-connect/7469131971.html,2022-04-09 12:06,E-Bike Yamaha Cross Connect, like new, Yamaha, Cross Connect,5,"Yamaha Cross Connect mid-drive e-bike. Class 1. Like new condition. Less than 400 miles. Purchased Feb. 2019. Price new $2999.00 plus tax. I replaced the original 700 x 35 tires with 700 x 42 for better gravel trail riding (Santa Fe Trail) The original tires are included. I replaced the original bell with one a little louder. The Brooks saddle shown in the pictures is not included, I’ve moved this from bike to bike over the past 30+ years.  There is absolutely not a thing that needs to be done to this bike, For complete details visit yamahabicycles.com. e-bikes are the hottest category in the bike industry and the pandemic has limited supply. I can guarantee you will not be disappointed. This is an outstanding buy! Reply by email or phone  show contact info", aluminum, other, 56.5-Large, 700C,,, suspension fork (hardtail), disc (hydraulic), flat, pedal assist,
5686,999.0,cosprings,https://cosprings.craigslist.org/wan/d/colorado-springs-needed-performance-lt1/7468984545.html,2022-04-09 07:15,needed performance Lt1 gen 2 stuff,,,,0,"looking for performance lt1 gen 2 parts or other c4 corvette stuffAlso 3800 race car parts.  Have some cash, also have lots of motorcycles, and parts to trade like modern 2 stoke dirt bikes , street bobbers, yzf300 street race bikes.",,,,,,,,,,,
