,Price,Location,URL,Date,Title,bicycle frame material,bicycle type,brake type,condition,electric assist,frame size,handlebar type,make / manufacturer,suspension,wheel size,num image,text,model name / number,part type,serial number,size / dimensions
3014,200.0,hanford,https://hanford.craigslist.org/bik/d/avenal-two-vintage-bikes-fixed-gear/7464172376.html,2022-03-28 15:52,Two vintage bikes fixed gear cruisers murray Higgins, steel, cruiser, drum, good, none, medium, cruiser, Murray Higgins, none (rigid), 20 in,9,Two vintage bikes fixed gear cruisers  200 takes both one is a 1991 Murray grey blue no seat. Other is a Higgins sears and ro buck dont know year has fenders and a schwinn seat old. Both worked great berfore siting both still roll great selling as is will not separate. Serious inquiries only email only thanks for looking.,,,,
3015,350.0,hanford,https://hanford.craigslist.org/bik/d/avenal-schwinn-ss-road-bike-carbon/7472556412.html,2022-04-17 17:33,schwinn SS road bike carbon aluminum, aluminum, road, caliper, good, none, xs, flat, schwinn, suspension fork (hardtail), 700C,8,"Schwinn SS road bike carbon aluminum , this is not a Walmart schwinn,  this was one of schwinns top quality bikes, carbon fork , main stays, and fsa carbon crank. Asking $350 Comes with two sets of tires . Continental gator skins and cycle cross tires. Great bike for woman or man 5ft to 5ft 7"" show contact info", ss,,,
3016,800.0,hanford,https://hanford.craigslist.org/bik/d/hanford-marin-mountain-bike-excellent/7469694223.html,2022-04-10 19:07,Marin Mountain Bike - Excellent Condition, aluminum, mountain, hydraulic rim brakes, like new, none, XL frame, other/unknown, Marin,, 700C,4,"2021 XL frame San Anselmo DS bike for sale.  Excellent condition; only ridden a few times on neighborhood bike rides (not due to bike function; I am a liesure rider and would prefer a cruiser).  Purchased locally at Fulton Bike Works.  See link below from Marin Bikes.  Cash, Venmo, PayPal, or CashApp only.   https://www.marinbikes.com/bikes/2022-san-anselmo-ds2", San Anselmo,,,
3017,8999.0,hanford,https://hanford.craigslist.org/snd/d/hanford-yamaha-banshee-for-sale/7465785693.html,2022-04-01 13:35,YAMAHA BANSHEE FOR SALE!!,,,,,,,,,,,0,,,,,
3018,12345.0,hanford,https://hanford.craigslist.org/wad/d/hanford-wanted-motorhomes-fifth-wheels/7462543526.html,2022-03-24 16:07,WANTED  Motorhomes Fifth Wheels & Travel Trailers.,,,,,,,,,,,0,,,,,
3019,1.0,hanford,https://hanford.craigslist.org/wad/d/hanford-wanted-classic-cars/7462530590.html,2022-03-24 15:34,WANTED Classic Car's,,,,,,,,,,,0,,,,,
3020,1.0,hanford,https://hanford.craigslist.org/mcd/d/lathrop-harley-davidson-superstore/7462336084.html,2022-03-24 08:56,"HARLEY DAVIDSON SUPERSTORE FINANCING AVAILABLE HUGE INVENTORY RV, BOAT",,,,,,,,,,,0,,,,,
3021,30.0,hanford,https://hanford.craigslist.org/bop/d/hanford-bike-parts/7469211805.html,2022-04-09 13:45,Bike parts,,,,,,,,,,,17,"Handlebars are $30,  Heavy Duty tire tubes 20""and 26"" $10 each and  Tires are $40 per pair.",,,,
3022,8000.0,hanford,https://hanford.craigslist.org/snw/d/lemoore-ltr-450/7468778735.html,2022-04-08 13:54,ltr 450,,,,,,,,,,,0,,,,,
3023,4449.0,hanford,https://hanford.craigslist.org/mcd/d/visalia-2022-ttr-230/7468246940.html,2022-04-07 11:15,2022 TTR 230,,,,,,,,,,,0,"************ 2022 TTR 230 *****************  TOP FEATURES 1 . Broad, Accessible Powerband YZ-inspired looks with a stout 223cc air-cooled SOHC four-stroke produces predictable, broad power making the TT-R230 a great choice for both beginner and intermediate riders. 2 . Racing- Derived Ergonomics The competition-style flat seat and tank junction position the rider for greater mobility. 3 . Convenient Electric Start With a simple push of a button, the electric start makes getting started a breeze. 4 . Trail- Ready Dimensions The low seat height on top of a long-travel suspension and 11.6 inches of ground clearance make this a serious trail bike that's accessible for a wide range of riders. 5 . Robust, Compact Frame The steel, diamond-type frame design means great handling and strength.  ENGINE Broad, Accessible Powerband The 223cc air-cooled SOHC four-stroke puts out smooth, widespread power that is perfectly suited for all kinds of trails and riders. The super-reliable electric start adds quick-start convenience. — 6-Speed Transmission Smooth-shifting, six-speed transmission with heavy-duty clutch is geared for maximum versatility and usable power delivery. —Digital Ignition CDI magneto ignition system is ultra-reliable and nearly maintenance- free. —Free-Flowing Intake The YZ-type air filter offers easy maintenance and maximum airflow. —Forest-Friendly Exhaust Lightweight exhaust with quiet muffler and USFS-approved spark arrestor. —Low Maintenance Engine Automatic cam chain tensioner means minimal maintenance and longer engine life. CHASSIS/SUSPENSION Robust, Compact Frame The steel frame with a compact wheelbase and low seat height result in superb maneuverability and super responsive handling for beginner or intermediate riders. —Advanced Rear Suspension A linkage-mounted adjustable rear shock serves up 8.7 inches of smooth, progressive rear wheel travel for great bump absorption and handling. —Trail-Ready Front Fork The 36mm front fork with 9.4 inches of wheel travel provides plush, confidence-inspiring control over rough terrain. —Generous Ground Clearance Generous 11.6 inches of ground clearance is enough to handle almost any trail. —Lightweight Swingarm Aluminum box-section swingarm features snail-type chain adjusters for quick and easy chain adjustments. Dual Disc Braking System Front 220mm disc and 130mm rear drum brakes provide powerful, confident stops. —MX-Style Wheels and Tires Full-size 21-inch front and 18-inch rear aluminum wheels keep unsprung weight down while knobby tires provide motocross-spec grip. ADDITIONAL FEATURES Comfortable Saddle Long gripper seat is low, comfortable and allows for easy rider movement. —Racing Styling Team Yamaha-inspired colors and graphics and front and side number plates create distinctive, motocross styling. —Grippy Foot Pegs Large folding, cleated foot pegs provide excellent footing, even in wet or muddy conditions. —Fork Protection Durable fork boots provide excellent fork seal and stanchion tube protection.  SPECIFICATIONS: Engine Type 223cc air-cooled SOHC 4-stroke; 2 valves Bore x Stroke 70.0mm x 58.0mm Compression Ratio 9.5:1 Fuel Delivery Carburetor Ignition CDI Transmission Constant-mesh 6-speed; multiplate wet clutch Final Drive Chain Suspension / Front Telescopic fork; 9.4-in travel Suspension / Rear Single shock; 8.7-in travel Brakes / Front Hydraulic single disc, 220mm Brakes / Rear Drum, 130mm Tires / Front 80/100-21 Tires / Rear 100/100-18 L x W x H 81.3 in x 31.5 in x 46.5 in Seat Height 34.3 in Wheelbase 54.5 in Rake (Caster Angle) 27.0° Trail 4.4 in Ground Clearance 11.6 in Fuel Capacity 2.1 gal Fuel Economy n/a Wet Weight 251 lb Warranty 90 Day (Limited Factory Warranty)  FOR MORE INFO, PLEASE FEEL FREE TO CALL, EMAIL OR JUST STOP BY AND CHECK US OUT.  VISIT US AT www.ga-motorsports.com TO APPLY FOR FINANCING ON LINE  ALSO, FIND US AND LIKE US ON FACEBOOK TO SEE UPCOMING EVENTS AND DEALER SPECIALS.  ----------------------------------------------GA MOTORSPORTS-----------------------------------------------  ***ADDITIONAL DEALERS COST & FEES, TAX and LICENSE ARE NOT INCLUDED IN ADVERTISED PRICE***",,,,
3024,4599.0,hanford,https://hanford.craigslist.org/mcd/d/visalia-2022-vstar-250/7468226395.html,2022-04-07 10:37,2022 VSTAR 250,,,,,,,,,,,0,"************ 2022 VSTAR 250 *************  TOP FEATURES Compact Custom Light weight and a seat just 27 inches from the pavement make the V Star 250 a great first step into motorcycling, as well as a great choice for more experienced riders who appreciate the fun that comes in small packages. Big Bike Style Dual exhausts, plenty of quality chrome and Yamaha's unmatched attention to detail—this is one sharp little motorcycle. Strong Brakes Front disc brake provides highly controllable stopping power. Unique V-twin Performance The V Star 250 is the only V-twin in its class with a smooth, torquey, controllable power delivery that's fun for every rider. Ultra-Efficient Engine Estimated 78 mpg means almost 200 miles between fill-ups.  Engine Type 15-cubic-inch (249cc) air-cooled, SOHC 60° V-twin, 2 valves Bore x Stroke 49.0mm x 66.0mm Compression Ratio 10.0:1 Fuel Delivery Mikuni® 26mm carburetor Ignition TCI: Transistor Controlled Ignition Transmission 5-speed; multiplate wet clutch Final Drive Chain  CHASSIS Suspension / Front 33mm fork; 5.5-in travel Suspension / Rear Dual shocks, adjustable preload; 3.9-in travel Brakes / Front Hydraulic disc, 282mm Brakes / Rear 130mm drum Tires / Front 3.00-18 CHENG SHIN C-916 Tires / Rear 130/90-15 CHENG SHIN C-915  DIMENSIONS L x W x H 86.2 in x 28.0 in x 41.7 in Seat Height 27.0 in Wheelbase 58.7 in Rake (Caster Angle) 32.0° Trail 4.7 in Maximum Ground Clearance 5.7 in Fuel Capacity 2.5 gal / CA model 2.4 gal Fuel Economy** 78 mpg Wet Weight*** 324 lb / CA Model 326 lb  OTHER Warranty 1 Year (Limited Factory Warranty)  FOR MORE INFO, PLEASE FEEL FREE TO CALL, EMAIL OR JUST STOP BY AND CHECK US OUT.  VISIT US AT www.ga-motorsports.com TO APPLY FOR FINANCING ON LINE  ALSO, FIND US AND LIKE US ON FACEBOOK TO SEE UPCOMING EVENTS AND DEALER SPECIALS.  ----------------------------------------------GA MOTORSPORTS-----------------------------------------------  ***ADDITIONAL DEALERS COST & FEES, TAX and LICENSE ARE NOT INCLUDED IN ADVERTISED PRICE***",,,,
3025,9899.0,hanford,https://hanford.craigslist.org/mcd/d/visalia-2022-yz450fx/7468223053.html,2022-04-07 10:30,2022 YZ450FX,,,,,,,,,,,0,"*********** 2022 YZ450FX ***********  TOP FEATURES YZ450F-Based GNCC® and Hare Scrambles Focused Racer The YZ450FX is developed from Yamaha’s flagship motocross model—the YZ450F—with many added features and unique settings that make the YZ450FX the ultimate GNCC®/Woods racer. High Performance Four-Stroke Engine The compact, powerful YZ450FX engine includes all the same race-developed technologies of the class-defining YZ450F motocrosser, tuned for cross country performance. A host of go-fast innovations include steep valve angles, aggressive cam profiles, high-compression forged piston with low friction rings, high-flow intake and exhaust systems—all thoughtfully packaged to optimize mass centralization. Innovative Yamaha Power Tuner App Yamaha’s industry-leading Power Tuner app puts the flexibility and precision tunability of the GYTR® Power Tuner into your smartphone. Make fueling and ignition timing changes instantly and upload them to the bike for ultimate track-side tuning. Best of all, it's free-of-charge. Adjustable Engine Mapping A handlebar-mounted map switch allows the rider to quickly select between preloaded engine maps—loaded and configured in the Power Tuner app—to account for changing riding conditions. Advanced Bilateral Aluminum Frame The YZ450FX's advanced aluminum bilateral beam frame features precisely tuned flex characteristics that give riders the ultimate combination of cornering performance, traction feel and bump stability. Class-Leading Suspension Yamaha's spring-type KYB® forks with refined, speed-sensitive damping and linkage-type rear suspension featuring a KYB® shock endow the YZ450FX with its renowned, class-defining suspension performance straight out of the box. High Performance Braking System A rigid front caliper and compact rear caliper work with aggressive pad compounds and lightweight rotors to provide exceptional braking power and controllability, dissipate heat more efficiently, and reduce unsprung weight. Electric Starter System Utilizing a compact starter motor and ultra-lightweight lithium battery, the YZ450FX maintains the convenience of push-button starting for effortless restarts under pressure, and more relaxed riding when the clock isn’t ticking.  ENGINE Engine Type 450cc liquid-cooled DOHC 4-stroke; 4 titanium valves Bore x Stroke 97.0mm × 60.9mm Compression Ratio 13.0:1 Fuel Delivery Mikuni® fuel injection, 44mm Transmission 5-speed; multiplate wet clutch Final Drive Chain  CHASSIS Suspension / Front KYB® spring-type fork with speed sensitive damping; fully adjustable, 12.2-in travel Suspension / Rear KYB® single shock; fully adjustable, 12.5-in travel Brakes / Front Hydraulic disc, 270mm Brakes / Rear Hydraulic disc, 240mm Tires / Front 80/100-21 Dunlop® Geomax MX33F Tires / Rear 120/90-18 Dunlop® Geomax MX33  DIMENSIONS L x W x H 85.6 in x 32.5 in x 50.4 in Seat Height 37.6 in Wheelbase 58.3 in Rake (Caster Angle) 27.2° Trail 4.6 in Maximum Ground Clearance 12.6 in Fuel Capacity 2.2 gal Wet Weight 254 lb  Warranty 30 Day (Limited Factory Warranty)  FOR MORE INFO, PLEASE FEEL FREE TO CALL, EMAIL OR JUST STOP BY AND CHECK US OUT.  VISIT US AT www.ga-motorsports.com TO APPLY FOR FINANCING ON LINE  ALSO, FIND US AND LIKE US ON FACEBOOK TO SEE UPCOMING EVENTS AND DEALER SPECIALS.  ----------------------------------------------GA MOTORSPORTS-----------------------------------------------  ***ADDITIONAL DEALERS COST & FEES, TAX and LICENSE ARE NOT INCLUDED IN ADVERTISED PRICE***",,,,
3026,2000.0,hanford,https://hanford.craigslist.org/for/d/hanford-2002-suzuki-intruder-lc/7467323309.html,2022-04-05 10:00,2002 Suzuki Intruder LC,,,, excellent,,,,,,,2,I have an 02 Intruder LC 1500 for sale. This bike is in very good condition and drives great.it has been sitting so may need new battery If interested call or text me. $2000 OBO,,,,
3027,4500.0,hanford,https://hanford.craigslist.org/mcy/d/hanford-2014-ktm-450-sxf/7461486950.html,2022-03-22 09:03,2014 KTM 450 SXF,,,,,,,,,,,0,,,,,
3028,300.0,hanford,https://hanford.craigslist.org/for/d/hanford-schwinn-stationary-bike/7458853204.html,2022-03-15 21:46,Schwinn Stationary Bike,,,, like new,,,, Schwinn,,,5,"Schwinn Stationary Exercise Bike. Very lightly used, $300 obo pickup only, will not deliver.",,,,
3029,4000.0,hanford,https://hanford.craigslist.org/wan/d/stratford-2017-ktm-85-cherry/7456142504.html,2022-03-09 14:22,2017 ktm 85 cherry!,,,,,,,,,,,0,,,,,
3030,60.0,hanford,https://hanford.craigslist.org/spo/d/hanford-fluid-bike-trainer-stand/7455333607.html,2022-03-07 19:53,Fluid Bike Trainer Stand,,,,,,,,,,,0,,,,,
3031,1500.0,hanford,https://hanford.craigslist.org/bik/d/lemoore-mate-foldable-electric-bike/7455309112.html,2022-03-07 18:16,MATE X Foldable Electric Bike,,,,,,,,,,,0,,,,,
3032,135.0,hanford,https://slo.craigslist.org/bik/d/atascadero-mens-womans-giant-bikes/7472942439.html,2022-04-18 15:28,Mens/woman’s giant bikes,,,,,,,,,,,0,,,,,
3033,100.0,hanford,https://fresno.craigslist.org/bop/d/fresno-jeep-spare-tire-bicycle-carrier/7472721697.html,2022-04-18 08:32,JEEP SPARE TIRE BICYCLE CARRIER HEAVY-DUTY BIKE RACK HOLDS 2 BIKES,,,, like new,,,,,,,2,Came in an Estate Heavy Duty 2 bicycle bike carrier in good condition. Asking 100.00 O.B.O.  If interested call  show contact info  NO TEXTS OR EMAILS PLEASE!!!!!!,, other,,
3034,120.0,hanford,https://slo.craigslist.org/bik/d/templeton-black-and-yellow-bikes/7471845031.html,2022-04-17 22:25,Black and Yellow Bikes,,,,,,,,,,,0,,,,,
3035,90.0,hanford,https://slo.craigslist.org/bik/d/morro-bay-vintage-huffy-bikes/7465827949.html,2022-04-17 12:14,VINTAGE HUFFY BIKES, steel, mountain,,,, 22 & 19,, HUFFY,, 26 in,6,"HIS & HERS VINTAGE HUFFY TITANIUM 10 SPEED BIKES  MENS NEEDS NEW SHIFTING CABLE OTHER THAN THAT VERY GOOD SHAPE  26"" TIRES RAYALGEL SADDLES VERY GOOD TIRES  SMALL AMOUNT OF SURFACE RUST BUT WILL CLEAN UP WITH STEEL WOOL  MENS  22"" FRAME ------ WOMENS  19"" FRAME  show contact info     SELLING AS A PAIR $150  FOR BOTH", TITANIUM,,,
3036,100.0,hanford,https://slo.craigslist.org/bik/d/los-osos-fixed-gear-bikes-like-new/7472139331.html,2022-04-16 12:23,Fixed Gear Bikes -like new, titanium, road, caliper, like new,," 61 cm, 21 3/4""", bullhorn," Specialized, KHS", frame and fork (full suspension), 27.5 in,2,"1.   Specialized Langster fixed gear reversible hub for free wheeling, frame size 61cm, longhorn handle bars with brakes, color  red   Condition is like new  Langster$100 obo  2.  KHS Urban Uno, fixed gear reversible hub for free wheeling, frame size 21 3/4 “, longhorn handlebars with brakes, color grey and silver Condition is like new  KHS  $100 obo",,,,
3037,25.0,hanford,https://fresno.craigslist.org/bik/d/fresno-bikes-jogging-stroller/7472118782.html,2022-04-16 11:42,"Bikes, Jogging Stroller", other/unknown, other,,,, Various,,,, other/unknown,3,"1 bike for sale, $25. Bike tires full of air.  1 jogging stroller for sale, $40.  Right tire needs new tube/tire.  The other two tires are fine and full of air.  1 Bike rack to attach to back of a RV or Travel Trailer, $10.  I might not have all the hardware so hopefully you may be able to buy it at a bike shop or hardware store.  All items are used and I'm selling for spring cleaning my garage.   Cash and exact change only.  No Venmo, etc.,  I will not be able to make change.  I will not be able to check my email all the time, so please text your interest  show contact info .",,,,
3038,1.0,hanford,https://slo.craigslist.org/spo/d/thousand-oaks-spin-bikes-fleets-of-10/7459518877.html,2022-04-15 14:50,SPIN BIKES Fleets of 10+ SCHWINN * PRECOR * Cardio Indoor Cycling GYM,,,, excellent,,,,,,,6,"THIS LISTING IS FOR THE STUDIO / GYM OWNER LOOKING TO ACQUIRE SPIN BIKES FOR THEIR FACILITY.  This is for a minimum of 5 spin bikes. Please do not inquire about just 1 bike.  Current inventory: - 35 Schwinn AC Performance w/ Carbon Blue (w/ Echelon2 console + power upgrade; triple link pedals) - $795/BIKE - 90 Precor Rally (chain drive) - $895/BIKE - 17 Star Trac Blade ION - $625  ALL bikes are in excellent condition. I will give more details for each type of bike when we correspond.  And, be realistic about the pricing requests. Don't expect these bikes to be $200/ea. These are all high-grade commercial spin bikes. The Schwinn's brand new (w/ all the upgrades) are close to $3000. The Star Trac Blade IONs were about $2100; and, the Precor's were about $1900 brand new. AGAIN - be realistic on what to expect the numbers to be...",,,,
3039,180.0,hanford,https://slo.craigslist.org/bik/d/san-luis-obispo-road-commuter-bikes/7465153698.html,2022-04-15 12:18,Road/Commuter Bikes, steel, road,, excellent,, 15” - 63cm,,,, 700C,13,"Road and around-town bikes built up to spec: please provide your height, typical cycling distances, and budget to help me determine what I might build up for you to test ride.  Over thirty years’ experience as cyclist and mechanic.",,,,
3040,1200.0,hanford,https://fresno.craigslist.org/bik/d/merced-jc-higgins-bikes/7466987295.html,2022-04-15 09:29,JC Higgins Bikes, steel, other,,,, 26,,,, 26 in,0,"For Sale: Collectors  JC Higgins Bikes  His/Hers $1,100  For The Pair              Interested  Call show contact info",,,,
3041,1200.0,hanford,https://merced.craigslist.org/bik/d/merced-jc-higgins-bikes-his-hers/7466986586.html,2022-04-15 09:29,JC Higgins Bikes His/Hers, steel, other,,,, 26,,,, 26 in,2,"For Sale:                   Collectables  JC Higgins Bikes  His/Hers $1,100 For The Pair Interested : Call show contact info",,,,
3042,50.0,hanford,https://fresno.craigslist.org/bik/d/fresno-three-mountain-bikes-for-sale/7471499888.html,2022-04-15 00:22,Three mountain bikes for sale,,,,,,,,,,,0,,,,,
3043,3800.0,hanford,https://fresno.craigslist.org/snw/d/fresno-need-to-sell-dont-need-two-bikes/7471409389.html,2022-04-14 17:36,need to sell dont need two bikes,,,,,,,,,,,0,I have two bikes don’t need it text for pics it’s brand new less than 40 miles,,,,
3044,1.0,hanford,https://bakersfield.craigslist.org/spo/d/thousand-oaks-spin-indoor-cycling/7466652401.html,2022-04-14 13:11,SPIN Indoor Cycling Studios / Gyms SPIN BIKES AVAILABE! Exercise Bikes,,,,,,,,,,,14,"Much more that I will elaborate on when you contact me, but the simple version is this:  I have a lot of Schwinn AC Performance w/ Carbon Blue spin bikes (fully loaded; excellent condition).  AND, I have Precor Rally (excellent condition) and I have Star Trac Blade IONs (excellent condition; like new) If you're looking for a minimum of 5 for your space, no need to look further -- you're going to like what I have and recognize the pricing to be very fair. You know these bikes - you know what they're valued at... be realistic, please. For the benefit of both our times and effort.  Delivery / Installation available.  Currently - more than 90 bikes available!  Schwinn, Precor and Star Trac.",,,,
3045,10.0,hanford,https://fresno.craigslist.org/bik/d/sanger-mountain-bikes/7471308094.html,2022-04-14 12:26,2 mountain bikes, other/unknown, mountain,, fair,, n/a, other/unknown,, other/unknown, other/unknown,0,2 mountain bikes they need tires asking 10 each.,,,,
3046,50.0,hanford,https://fresno.craigslist.org/bik/d/madera-bunch-bikes/7471247521.html,2022-04-14 10:29,bunch o bikes, other/unknown, other, other/unknown, salvage, other, various, other/unknown, multi, other/unknown, other/unknown,0,Pile of old random bikes Kids choppers Beach cruiser etc For parts or restoring  Text or call 363.329 zero Thanks, multi,, none,
3047,1.0,hanford,https://slo.craigslist.org/mcy/d/paso-robles-2003-yz450f-bikes/7471061092.html,2022-04-13 21:30,2003 YZ450F ***2 bikes***,,,,,,,,,,,13,Selling 2 bikes as a combo.  Bike # 1 Turn key ready ride.  FMF Powerbomb FMF Q4 silencer R&D accelerator pump New Piston & topend rebuild Hinson clutch  Many other extras Current registration and pink in hand  Bike # 2 Rolling chassis Complete engine disassembled  2 sets plastics Current registration and pink in hand  Both bikes are 2003 YZ450F. All parts are interchangeable.  Make a reasonable offer Call for more info (Eight0five)97five-88six8,,,,
3048,60.0,hanford,https://slo.craigslist.org/spo/d/san-luis-obispo-car-trunk-rack-for-bikes/7471052570.html,2022-04-13 20:37,Car Trunk Rack for 3 Bikes,,,, good,,,, Hollywood Racks,,,0,"Hollywood Baja Trunk Rack, fits 3 bikes.  This has been a great bike rack but we recently got a roof rack so we just don't use it anymore.   See https://hollywoodracks.com/collections/trunk-bike-racks/products/baja-bike-rack?variant=44239528902 for details", Baja Trunk Bike rack,,,
3049,150.0,hanford,https://bakersfield.craigslist.org/bik/d/bakersfield-bikes-bikes-bikes/7470834963.html,2022-04-13 11:05,Bikes bikes bikes, other/unknown, bmx,,,,,,,,,0,I have 2 of my bikes im moving and no longer have room or the use for them,,,,
3050,35.0,hanford,https://santamaria.craigslist.org/bik/d/santa-maria-good-condition-kids-huffy/7470765826.html,2022-04-13 09:01,"Good Condition kids Huffy Bicycle 20""- Seastar Girl Bikes", other/unknown, kids,,,, Kids bike,, Huffy,, 20 in,2,Good Condition. Bike is stored in the garage.,,,,
3051,1.0,hanford,https://slo.craigslist.org/wan/d/san-luis-obispo-cash-for-old-road-bikes/7463091515.html,2022-04-12 17:30,Cash for Old Road Bikes,,,,,,,,,,,0,"Looking for complete MENs racing Road Bikes ,No parts or frames. Send photos of what u have",,,,
3052,150.0,hanford,https://slo.craigslist.org/bik/d/arroyo-grande-bikes/7470560525.html,2022-04-12 16:59,Bikes, steel, cruiser,,,, 58 cm,,,, 26 in,2,Red and silver Beach cruiser 100$ Xl nishiki prestige 150   NO CODES !,,,,
3053,300.0,hanford,https://fresno.craigslist.org/bik/d/fresno-bikes-for-sale/7463731729.html,2022-04-12 11:32,bikes for sale, aluminum, hybrid/comfort, cantilever, like new, none," 18""", riser, Windsor, suspension fork (hardtail), 26 in,5,"I have two bikes for sale eighteen speed, suspension front fork, both are in excellent condition and ready to ride I am asking $300 each $550 for both if you are interested please respond via Craigslist or text to 559 four five seven 9817 reasonable offers considered  thanks for looking", Dover 2.0,,,
3054,15.0,hanford,https://fresno.craigslist.org/hsh/d/selma-two-pld-bikes/7457851176.html,2022-04-10 15:08,two pld bikes,,,,,,,,,,,0,Old bikes,,,,
3055,300.0,hanford,https://slo.craigslist.org/bik/d/san-luis-obispo-new-city-bike-ellison/7461360204.html,2022-04-10 09:42,New City Bike - Ellison Deluxe, steel, cruiser, coaster, like new,, Medium,, State Bikes, none (rigid), 27.5 in,2,Selling a barely ridden State Bike Ellison Deluxe in excellent condition.   Was originally $600+ new. Selling for $300 to find a new home where someone will enjoy riding it.   Size Medium - 3 Speed  +added adjustable seat lever for ease of adjustability  If interested in picking up please text Garrett at phone number listed under contact to arrange a time., Ellison,,,
3056,50.0,hanford,https://visalia.craigslist.org/bop/d/visalia-bicycle-rack-for-bikes/7469466706.html,2022-04-10 09:24,Bicycle Rack for 2 bikes,,,, good,,,, Hollywood,,,3,"Hollywood brand, style Traveler, hitch mount (either 1 1/4"" or 2""), 2 bike rack", Traveler," racks, fenders, bags",,
3057,899.0,hanford,https://slo.craigslist.org/bik/d/pismo-beach-electric-bikes/7465534323.html,2022-04-10 01:18,Electric Bikes, aluminum, mountain, disc (mechanical), new, pedal assist, Assorted, riser, Motion Madness, suspension fork (hardtail), 26 in,12,"Fat tire 20 “ and 26” bikes , mid drive, hub motor as well as electric trikes, beach cruisers and mountain e bikes as well. fully assembled with extended local labor warranty in all styles new and used $899 and up.  CALL or TEXT for further assistance in Pismo Beach   Brand new quality Electric Bikes in all styles and sizes available as shown in pictures from $899 and up", Assorted,, Assorted,
